,Date,content
6031,2000-10-03,"  So move     Mr Chairman, before we resume our discussion,   let me mention the Basel capital accord  If all goes well, on our present schedule the Basel   Committee will approve the new accord at a meeting to be held in New York in mid-December  I   thought it might be useful to take advantage of the December meeting of this Committee to provide   an opportunity to brief the Reserve Bank presidents--and your heads of supervision, if you wish to   bring them with you--on that subject  We would plan to give a 2 to 2-1/2 hour briefing on what the   accord is so that you will be familiar with it before it is made public, as presently scheduled, on the   16th of January  If that is attractive to you, would you let Don Kohn know whether you would   prefer to have that session on Monday afternoon, the day before the meeting, or on Tuesday   afternoon, the day of the meeting?  Considering the length of the briefing and the heaviness of the   material, you might want to make it on Monday afternoon, but please inform Don of your   preference  Thank you     Mr Chairman, the Second Districts economy has   continued to expand at a moderate pace since my last report, while consumer price inflation has   remained subdued in the face of ongoing, though diminishing, cost pressures  After adjusting for the   Verizon strike, private sector job growth accelerated noticeably in August to a more than 3 percent   annual rate, though the reduction of Census workers appears to have boosted the unemployment rate   slightly  Retail sales apparently turned sluggish again in mid-September following a brief pickup   early in the month, while retail prices remained virtually flat  Our sources are giving virtually the   same story that President Stern just described of a noticeable slowing in retail sales and considerable   concern about the holiday season   While New York Citys office market remains extremely tight, residential real estate   markets appear to have cooled a bit  Home construction activity has tapered off noticeably in the   third quarter, although some of this slowing, especially in northern New Jersey, seems to reflect land   and labor constraints  Home prices in New York City are up 10 to 15 percent from a year ago but   that represents a slight deceleration, and unit sales continue to decline  Housing markets in upstate   New York are mixed but on balance improving  Purchasing managers in the region report continued   growth in manufacturing activity, with some diminution in price pressures in September  And local      62  banks report a continuation of recent trends weakening loan demand, tightening credit standards,   and falling delinquency rates--a banking supervisors dream   We think the national economy is slowing just as monetary policy tightening by this   Committee intended it to slow  We share the view that energy costs will not cause great damage    My own view is that the forward markets are not accurately reflecting the increased supply that will   result from the increased investment taking place, as President Hoenig described for his District  If I   am right and therefore energy prices begin to trail off after the winter in the Northern Hemisphere,   that should bring energy prices down just about in time to avoid what I think is the considerable risk   of the higher energy prices increasing inflation expectations     Our research indicates that the productivity revolution is continuing and is spreading more   broadly to the many users of technology  And, therefore, we agree with the Greenbooks view and   perhaps are even more optimistic  I also believe that our economy has now demonstrated for long   enough an ability to operate with an unemployment rate at or near 4 percent that we can presume   that it is likely to continue to do so for at least a while  Our growth forecast has the economy   expanding below potential, which we put at 4-1/2 percent per annum  We think the present stance of   monetary policy is just where it should be  As we get into next year I think there will be a question   as to whether our assessment of the balance of risks will have to be shifted  But for the present I   believe that the formal statement that the balance of risks is toward inflation continues to be the   correct one  Thank you  "
6032,2000-10-03,"  I concur with your recommendation, Mr   Chairman, to keep the fed funds at its current level and to retain the statement that the balance of   risks is on the inflation side      82 "
6075,2000-11-15,  So move  
6076,2000-11-15,"  Move approval of the domestic operations   SPEAKER(?)  Second     Thank you, Mr Chairman  The Second   Districts economy has continued to expand at a moderate pace since the last report  Price   pressures persist though they have become somewhat less pronounced recently  Private sector   job growth accelerated slightly in the third quarter to a 21 percent annual rate while   unemployment rates remained unchanged  Retail sales were reported to be on or close to plan   but that's largely because steep price markdowns helped clear out excess inventories and also   pulled overall retail prices down slightly               57      On the national level, we think the economy could slow a bit more than projected in   our own and the Greenbook's forecasts  That seems to be a definite possibility based on purely   domestic considerations  But I will admit that that assessment is based more on anecdotal   reports than on pure analysis     What does concern me considerably on the weakness side is what I feel is going on   internationally and what might go on internationally I think the forecast that Vince Reinhart   presented for the international economy is probably the right forecast  But I feel very much as I   did in the summer of 1998, before August--that there is a sort of eerie calm waiting for an   accident to happen  And there are some places where I think an accident could easily happen    Just looking at the industrial world, Japan has a horrendously badly structured   economy with much too much emphasis on a continuing push from fiscal policy  The business   sector is investing somewhat strongly and really is the only push behind the small amount of   growth that one sees in Japan  The consumer, however, is very, very wary  I think                                                                                                                                                                                                                                                                  have finally decided that it is time to show their   hand  The present leadership of the country is very much in the hands of the old economy--the   construction industry, farmers, and heavy manufacturers  The aging of the population involves a   fiscal problem that is dramatic even by Italian standards  What the reformers are seeing is that   they are simply going to have to take political power and change rather radically the   macroeconomic policy of the country  But even if they are successful at taking over, the forces   against change are so great that I think their chances of success are not very high  And yet what               58      could happen because of this possible or even likely political change is that an already fragile   situation could become more so with considerable effect on the rest of Asia   In Southeast Asia there are a few areas of strength, including Singapore, Hong Kong,   and Taiwan  But the serious problem countries, such as Indonesia and Thailand, continue to be   very weak and are very much dependent on strong exports  Moreover, the structural change that   they very badly needed as of 1997-98 by and large has not taken place  The same is essentially   true of Korea  Even though                                                                                                            there still is a great reluctance to allow economic reality to be manifest  Instead, efforts are   directed at trying to patch things together  That does not leave a situation in which any ripple   effect coming from someplace else would be easily manageable   As for our friends in Europe, when we talk to them about the weakness of the euro,   they understand that the main reason the euro is weak is because they have experienced   substantial outflows of capital  That reflects the fact that their own citizens seem to think,   correctly, that investing in the United States is better than investing at home, and they know the   reason is that theres a very significant productivity gap  Just as the productivity gap against the   United States led to the long trend of the weakening dollar in the 1970s, it has been the main   driver behind the strengthening trend of the dollar in the latter part of the 1990s  Add in the   short-term effect of higher growth expectations in the United States than in Europe, and those   two factors add up, I think, to a reasonably good explanation of why the euro is where it is   Now, when we talk to the Europeans in those sort of analytical terms, they nod their   heads sagely and find the analysis acceptable  But they are desperately concerned about the   political reaction within their countries to the weakness of the currency  They are particularly               59      concerned that the reaction is going to be more obvious in 2002 when the Deutschemark and the   French franc disappear and the euro takes their place  At that time I believe the underlying and   growing anti-Americanism, which is very clear in Europe, is going to become more manifest    And that is precisely the time when the industrial world should probably be working in   cooperation  I think that will become increasingly difficult   We have a very serious problem in Argentina in my view  Argentina is a country in   which a brilliant politician, President Menem, decided to put in a foreign exchange regime, not   because of its                               but because                                                                                                  That country has seemed incapable of imposing enough                                                      so he tied its currency on a one-to-one basis to the US dollar and decided that he was   going to import discipline  Twice--after the Tequila crisis of 1995 and the Brazilian devaluation   more recently--there was a very difficult macroeconomic adjustment for the real economy  Now,   with a much weaker political leadership and a much more difficult economic situation, there's a   very real question of whether that exchange rate regime--which continues to be vital for the   political stability of the country--can be maintained  Essentially, what the IMF is trying to do,   and what the rest of us will eventually be called on to do, is to try to see what can be done to help   maintain stability there  Can a country with a structurally overvalued exchange rate, which they   don't want to change for political reasons, and with an economic growth of maybe 2 or 3 percent   per year, which they also need to keep the nation together politically, make it?  It's a very, very   tough call as to whether it is going to work  The contagion effects on what I have described as   the other problem spots in the world could be a lot greater than the size of the Argentine   economy in the world would seem to suggest  It may well be that we will continue to muddle               60      along and the world economic situation will be more or less as weve described it, which   probably is the right forecast  But I think we have to pray a lot and hope that God is very good   for that to actually work out   As for our own situation, it seems to me that that danger outside our country calls for   us to be even more prudent than usual in our own responsibilities for the management of the US   economy  I do think that we are moving more toward a balance of risks between inflation and   insufficient growth  My own feeling is that we are heading in the direction of balance, but I   don't think we are quite there yet  Thank you  "
6077,2000-11-15,"  Mr Chairman, I find myself exactly   where you are  I believe that we have to stay with the balance of risks on the side of   inflation but we also have to express our view that the real world has changed somewhat    The proposed verbiage certainly sounds like something a central bank would produce    [Laughter]  Since we are a central bank, I think it says just the right thing and I believe   that the language sets the right tone  So, I agree fully with your proposal      I think we just won the argument!  [Laughter]     Time to vote  "
6127,2000-12-19,"  So move   SPEAKER(?)  Second     Different people handling the portfolio who dont   talk to each other     Move approval of domestic operations     Well, Ill tell you what I was thinking about  In   further answer to Jerry Jordans question, if you look back at 1996-97, the A1/P1 line was very flat   then   In 1997-98 we had the Asian crisis, in 1998-99 we had the Russian crisis, and in 1999-2000   we had Y2K  So one can argue that this year is the closest thing weve had to a normal year since   this time in 1996  I dont know if thats valid, but thats what I was thinking of when I forgot to   move approval of the domestic operations      11    I think most people, unlike experts, understand   growth more than activity  "
6128,2000-12-19,"  Mr Chairman, two points One, I associate myself   with your comments 1000 percent, which is 10 times more than the usual enthusiasm with which I   support your views     This will work out better!  My second point is on   the staff presentations  I think the reason there seem to be no questions or comments is that the   presentations were remarkably good and extremely well balanced  I'd like to note that I thought   Karens presentation of the balance of risks internationally was right on the mark  I wouldnt   disagree with a single thing she said     There is no way I can top that!  Mr Chairman, the   Second Districts economy continues to expand, though at a more subdued pace than in some time    Cost and wage pressures persist, but there are few signs that these increases are being passed along   to consumers  Private sector employment grew at a brisk 1-1/2 percent annual rate in October, a bit   below the third-quarter pace, despite declines in manufacturing  Unemployment rates continue to   hold steady near cyclical lows  New York State retailers report that same-store sales slowed   somewhat in early December and were running 2 to 4 percent ahead of a year ago, led by book,   record, and specialty apparel stores   Available official and private sector data make it clear that the expansion is slowing to a   pace below trend growth  Inflation seems quiescent, but it is not decreasing  Anecdotal evidence,   however, is overwhelming that the economy is slowing considerably faster than the available data      59  indicate, and the anecdotal information is more forward-looking  The economy in my view is highly   likely to grow at a slower pace than we had hoped to achieve through our policy tightening   It is clear in my view that the balance of risks has shifted and now points to concern about   economic weakness  For this Committee not to note the realities of the world in which we live   would itself be a source of instability  Our choice today, it seems to me, is between one of two   options  One is a reduction in the fed funds rate, probably by 25 basis points, with a statement that   the risks are balanced between concern about inflation and about economic weakness  Alternatively,   we could leave the rate where it is and go to language expressing the view that the risks are weighted   mainly toward concern about economic weakness  I prefer the latter option for two reasons   First of all, its closer to my own view  Secondly, it gives us maximum flexibility to   respond to incoming data by reducing rates early next year either at our next meeting or beforehand   if the data are sufficiently weak to make the more dramatic response of a move between meetings   appropriate  On the other hand, if the data are not clearly in that direction, it also leaves us the   option of not having to move the rate at all  Although a shift in the balance of risks language from   our current stance of risks toward inflation to one of risks toward weakness in economic growth is   rather strong, it really more clearly reflects what is going on in markets  I think the markets are   assuming that, as a minimum, we will go to a balanced risks statement  And in the last few days, the   view has probably become that we will move to language that the risks are weighted toward   economic weakness  On the other hand, I don't think the banging of the gong of a rate change at this   meeting is anticipated  Now, the markets are extraordinarily thin and very risk averse  And   therefore, if we were to do something that might be deemed a bit too dramatic, I am not sure what   the market reaction would be--especially what the second or third tier reactions would be after the   first one  It seems to me that that is a bit more risk than we need to take when there is an option for      60  us to show that we see what's going on--that we are concerned about economic weakness--without   taking the market risk that I think a rate move would involve  Thank you  "
6129,2000-12-19,"  Mr Chairman, I agree fully with both the   conclusions youve reached and the reasoning for them  I believe that the most important thing in   public life is to know what you dont know  And we don't in fact know enough at this point to move   the rate downward  Doing so would be unwise, in my view, especially for the reasons I cited earlier    The markets are just too thin  But I think we have to have the balance of risks toward concern for   economic weakness, and we have to be very flexible during the month of January as you have   suggested     I don't think we will make you our press secretary!     He is very consistent  "
6180,2001-01-30,"  So move     Thank you, Mr Chairman  Let me   make a quick comment on the issue we just discussed before I go into what I had   intended to say  As long as the business cycle exists, I think there will be times when the   government will and should be in surplus  And there are times when the government will   and probably should be in deficit  I hope that doesnt brand me as a Keynesian, which   certainly Im not, but I think thats how the accounting works  There will be times,   therefore, as your testimony last week indicated extremely well, when some entity in the   government will be accumulating assets  For the Federal Reserve to say not us, and   then plan to have a particularly palsy relationship with the Treasury in order to avoid that     1/30-31/01 18  entity being the Federal Reserve, I think is ill-advised public policy  I doubt that it would   be a very good idea to encourage the invidious notion of Social Security or any other part   of the US government being in the business of holding private assets There would be   the temptation--and humans would surely succumb to temptation as they have since the   fall of Adam--for political meddling in the private sector  I think we should avoid that in   any way that we possibly can     Let me direct myself now to some of the questions that Don raised  One   involves the relative merits of a highly diversified portfolio versus a portfolio whose   principal attractiveness would be a greater degree of liquidity  I think that dichotomy is   based in its extreme on the notion that our holdings of market assets are of such a size   that if we have a large position in a more diversified group of assets, we would really be   moving the markets and, therefore, having a slight but still significant effect on the   relative prices of assets  I believe the degree to which we have a relatively small portion   of a diversified but liquid portfolio makes that dichotomy less than complete  So I think   we need to study this more  How much can we diversify the portfolio and still keep it   liquid?  How do we achieve both goals?  To me the size of our holdings is the key to   answering that question   As regards the balance between outright transactions and RPs, I think weve   had it about right over time  When we have a permanent need to add to reserves, we do it   through outright purchases  The question is, outright purchase of what?  Thus far the   experience weve had on the tradeoff between outright transactions and RPs indicates that   the process is working very well, and therefore it should be a guide to how we would   continue to operate in the future       1/30-31/01 19  As for the use of the discount window for monetary policy purposes, it seems   to me that we should look at the present situation and differentiate between two aspects   of the Federal Reserves responsibilities  One is our primary responsibility, which is   monetary policy  Another, although not the only other, is our responsibility for the safety   and soundness of the financial system--particularly the commercial banking system,   given our role as bank supervisors  Thats especially true since the passage of the   Gramm-Leach-Bliley bill, which gives us even broader responsibility as umbrella   supervisor of financial holding companies     Let me note one of the good things about the present system, especially if we   could attain Governor Gramlichs goal of moving the discount rate to a penalty rate  A   penalty rate would be much more consistent with the way the discount rate should be   used than it is now--where by historical accident it is below the fed funds rate  Using the   discount window with a penalty rate is very consistent with the Federal Reserves   approach to banking supervision  And that approach is that we expect bankers to be good   bankers  We reward them for being good bankers by allowing them to do certain things   if theyre well capitalized  And we punish them rather severely, including by formal   actions, if theyre not such good bankers  I speak with considerable experience, having   been the risk manager and the financial manager of a large bank holding company, when   I say that if liquidity is readily available at the discount window, it would be easy--even   in a well managed bank--to succumb to the temptation to borrow  Now, the fact that   there is a temptation does not mean that every bank has to be a sinner  There is   temptation in the world and there are highly virtuous people, maybe even saints  But   again, human nature being what it is, I think there would be a tendency for the     1/30-31/01 20  availability of the discount window at a relatively low discount rate to interfere with   sound management of banks  Banks might engage in less sound asset and liability   management practices and less sound liquidity management  Thats not a conclusion; its   a question  If we, the Committee and the Board together, decide to move forward and   seriously consider the use of the discount window as an instrument of monetary policy to   any meaningful degree, then I think we would have to expand the scope of the questions   weve been asking  And one question to include would be this issue of the tradeoff   between two of our responsibilities  Thank you     Exactly     You mean shooting a mouse with a   cannon     Sandy was here at the time of Drexel      And it certainly explains why we want   to study state and municipals at the same time     Amen!     Move approval     Move approval     Mr Chairman, I assume that we would   be better off to have you go into those discussions with the Authorization for Foreign   Currency Operations in place, which means we should renew the authorization today       If, as a result of your conversations   there is some reason to change it, we can do so later     Do you need a motion for the foreign   currency instruments?     So move     It is the very active marketing of that   facility by the Home Loan Banks that makes me worry about the effect it has on how   well people manage their depository institutions     I share Peters view that if the Lombard   rate, or whatever we call it, were above the fed funds rate--which is where it ought to be--   institutions would be much more likely to use the window     Exactly  I was a CFO in the heyday of   banks worrying about going to the window  I cant tell you how many banks had   somebody assigned to kick the computer from time to time so it would stop working and   the bank could pretend that it didnt know its reserve position!     The key is that the term RP is the   residual  That's his fudge factor     Its the semiannual--     Thats something to report in the   minutes!       Thats an abnormal sequence of FOMC   proceedings     You certainly do!     Normally we do indicate when its   effective     I would take it out     For some it may be tomorrow  "
