,Date,content
4018,1996-01-30," I move approval   I second that and move a favorable review of the series of dances he briefed us about [Laughter]   Mr Chairman, the idea that these ranges are mainly a communications device is what guides me Since the Humphrey-Hawkins report and your testimony no doubt will point out that we do not find the monetary aggregates to be a particularly useful policy tool, adopting Alternative I, II, or III would not result in a strong market reaction or great excitement except perhaps in some corners of the academic community However, at a time when we are still in an easing mode--certainly the last move of the Committee will have been an easing action, whatever we do today--I think using Alternative I would best communicate our long-term goal of price stability So, that alternative is definitely what I prefer If the majority of the Committee were to prefer some other alternative, that is not something about which I would get very excited and I certainly would not object by dissenting But I think Alternative I conveys the message most reliably   I would like to associate myself to an absolute degree with Ed Boehne's remarks I believe that the degree of credibility that we enjoy at the moment has been hard earned, but it is very high I don't know of anybody--even in the  -42-    1/30-31/96  world's capital of cynics, New York City--who really believes that this Committee is not absolutely resolute in the pursuit of price stability I think that, as Ed suggested, we are better off to continue as a Committee performing with deeds, with good solid, sensible, anticipatory monetary policy As for words, I for one have been giving a number of speeches recently to groups like the National Mortgage Bankers in which I state as firmly as I can that my whole view of monetary policy is that price stability is the means by which we achieve sustained economic growth Therefore, I don't really need a change in the Humphrey-Hawkins legislation To me, that legislation is not in fact contradictory It says that we want sustained economic growth and we want price stability I think they are the same goal because sustained economic growth is achieved through price stability By speaking out publicly, one of the things we can do--and it is a role that I have taken on myself--is to confront the traditional anti- price stability group by reversing their argument The reason very sensible people have been against price stability is that they believe it is socially and politically harmful to the poor whom they feel they represent I think they have it absolutely backwards I believe the best thing for the poor in the South Bronx is price stability I have argued that, and believe it or not, some of the people who have been most vocal over time as attackers of price stability sort of begrudgingly tell me that I may have it right  I am very much in favor of a Mack Bill because I think formally establishing price stability as a goal of the Federal Reserve is a major political judgment Major political judgments should be made by Congress with the agreement of the President In my view, it would be very much in the national interest to have the Mack Bill or something very much like the Mack Bill enacted into law So, as an individual and as the President of the Federal Reserve Bank of New York, I have publicly stated that the Mack Bill is a very good idea I am not endorsing all its details; it's too early for that But rather I think that legislation establishing a single goal for the Federal Reserve has great merit That is what the Congress and the President are for, and we would be ill-advised in the meantime, as the Chairman suggested, to preempt that debate and in a way make it unnecessary The whole history of this country is that the Federal Reserve does its job best when we are carrying out what the American people want us to carry out Over time we have brought this issue to a point where the American people as represented in the Congress are really in agreement that price stability is what makes sense We should let that political process take place "
4019,1996-01-30," Thank you, Mr Chairman The anecdotal evidence in the Second District in recent weeks has been very negative, but that is probably more the mindset of the people in the District than anything else The broader economic data have been somewhat more positive recently In the labor markets, private payroll employment rose at an annual rate of 1-1/2 percent in December in New York State and was stable in New Jersey The monthly unemployment rate rose in December in both states, but we tend to smooth that rate over a quarterly average On that basis, the unemployment rate in New York State actually declined from 67 to 62 percent from the third to the fourth quarter and was unchanged in New Jersey Consumer spending as reflected in retail sales tax collections rose moderately in December in New York, led by strong gains in New York City Our manufacturing contacts reported that the blizzard had minimal effect on production in the Second District, and that any losses would be quickly made up In fact, our recent survey of manufacturers, some of which are among the nation's largest employers, was quite fascinating The majority of them expect unit sales to increase in 1996, but they say that competition will prevent  -23-    1/30-31/96  them from raising prices Wages are expected to rise 3 to 4 percent, and capital spending will be similar to that of 1995 Their most optimistic view of the world is that they think their exports will be growing in the 5 to 10 percent range, about the same as in 1995  On the national level, assuming that monetary policy remains the same, our forecast is somewhat different from that of the Greenbook We have real GDP somewhat weaker, growing 17 percent in 1996 and dropping off slightly to 16 percent in 1997 We have the unemployment rate going up to 59 percent in 1996 and 62 percent in 1997 We have found the employment picture somewhat confusing, as I think many people have One of the things we have found difficult to explain is that participation rates in the labor force by women and by teenagers of both sexes are holding relatively steady, but the participation rate by adult males has been coming down over the last few years I am not certain that anybody has a very good explanation, but it may be that the 56 percent unemployment rate is suggesting greater tightness in the labor markets than really exists That will be one of our research projects  We have the CPI about the same in 1996 as it came out last year; we have it at 28 percent and dropping off to 27 percent in 1997 Again, we have trouble, as I think most people do, in anticipating exactly what will happen to prices because neither we nor any other countries that seem to provide a relevant comparison have a whole lot of experience with what happens to prices when the CPI is at the 28, 29, 3 percent level We have essentially no experience in estimating the cost of going to price stability, assuming as I do that it is something below 3 percent But if we want to reduce inflation, it would be nice to know what that will cost, rather than saying it is something that warms the cockles of our theological heart That again is a major project that we are looking at Without the knowledge of the cost of lowering inflation further, we are not very content--I am not very content--with our economic forecast A real GDP growth rate of 17 percent this year and 16 percent next year, essentially no gain on price stability, and, we think, a rising unemployment rate do not lead us to believe that the basic assumption of unchanged monetary policy has a whole lot going for it Thank you, Mr Chairman "
4020,1996-01-30," Mr Chairman, I support the recommendation of alternative A, symmetric, for the reasons that you gave I also found Jerry Jordan's intervention just now quite convincing as well "
4074,1996-03-26, I move approval of the domestic operations 
4075,1996-03-26," Thank you, Mr Chairman The economy of the Second District continues to underperform the nation as it lumbers along on its slow growth path Recently, retail contacts reported that February sales rebounded to plan levels following the very disappointing January and the record blizzard Senior loan officers at small- and medium-sized banks reported that demand for nearly all types of loans has strengthened over the last two months, with the largest increase developing in the consumer loan segment Of course, we all know that the consumer loan debt level is a bit higher  -15-    3/26/96  than we might wish In the securities industry, a major investment bank reported a three-fold increase in pretax profits for the fiscal quarter ending in February compared to the same period a year ago, and our market soundings indicate that its competitors also seem to be having a robust quarter The profits in that industry are an important contributor to income growth in New York State Overall, the District's housing industry has remained weak in February and early March, but we have a glimmer of hope in the commercial real estate market, with continued improvement in the vacancy rates in midtown Manhattan We continue to be concerned about the District and why it underperforms the nation We are going to be moving even more of our research capabilities into that area and look forward to having a couple of meetings toward the end of the year one consisting of economists will try to identify the problems and the other of policymakers will discuss what might be done to get the area growing a bit faster  At the national level, our forecast is very similar to that of the Greenbook The Greenbook, as you know, has growth at just about 2 percent in 1997, and we have it somewhat below that Not surprisingly, therefore, our CPI forecast is more attractive, at 28 percent this year and 27 percent in 1997 We have the unemployment rate moving up some, in fact to about 62 percent next year That is to some degree related to our view that the participation rate, especially by adult males, has been unusually low, and there might be some rebound in labor participation that would raise the unemployment rate So, with the favorable data recently on employment, consumer sentiment, auto sales, retail sales, housing starts, and net exports, the major shift that we have made in our forecast is that we think that the risks to the forecast are now quite well balanced At the previous meeting, we were concerned about the risks on the down side and therefore thought that the ""insurance"" easing, as the Chairman described it at the last meeting, was appropriate Now we think that the forecast looks rather good and that the risks are quite well balanced "
4076,1996-03-26," Symmetry?   Mr Chairman, I support the ""B"" symmetric proposal I agree that the most likely forecast is the one that we all agreed on, and I think it also is highly unlikely that it will materialize We will have to adjust one way or the other and stay extremely wary and ready to move in the interim But certainly for now, the ""B"" symmetric proposal is the right one "
4122,1996-05-21," So move  SPEAKER(?) So move   Second   Mr Chairman, I share Don's ultimate goal, but I do not think that his recommendation is a helpful way to get there I believe that the appropriate goal of monetary policy is price stability and price stability only I further believe that at some stage we have to define price stability and that the best way for people to understand it would be for us to connect it with a number In order to have any notion that that number is something other than what we think we are likely to achieve, given what is going on in the economy at the moment, we have to push it out at least three years And therefore our number for the second year out is an uneasy compromise between what we think is really going to happen in relation to today and what we are seeking to achieve So, two years is too short a period to be useful in achieving an objective, and therefore I think it would be counterproductive to establish such an objective I would much prefer that we have an unfettered debate in July I am  -43-    5/21/96  very much in favor of a debate on the issue of where we think we ought to be going, but I would not complicate that debate with a big row over who has 1998 right or wrong I think that would obfuscate the real issue, which is whether we should agree on price stability as the goal and how we should define price stability So, I am in agreement with where I think you want to go eventually, Don, but I think your specific recommendation is counterproductive   No, I would say that, if we wanted to do this and we had had the debate beforehand, we would say the rest of 1996, 1997, 1998, and 1999   Yes, correct   That's right, exactly   You made what I was thinking infinitely more clear Thank you "
4123,1996-05-21," Mr Truman expresses his opinion perfectly; he does it with a nod   This may be related to the line of thunderstorms coming from the west and everyone wanting to get out of here   Thank you, Mr Chairman The broad economic indicators suggest that the economy in the Second District grew at a moderate pace in recent weeks, which is an improvement In March, payroll employment advanced at an annual rate of 22 percent in New York and 33 percent in our part of New Jersey Vacancy rates for prime commercial office space continued to inch down in Manhattan and northern New Jersey, reflecting the improvement in office leasings Contract awards for nonresidential construction, primarily additions to and alterations of commercial space, rose sharply in New York compared to year-ago levels The gain in New York was offset slightly by a 1 percent decline in New Jersey In April, retail sales tax collections rose robustly in New York and moderately in New Jersey on a 12-month basis, implying moderate to strong gains in retail sales Similar 12-month gains were reported in April personal income tax collections Inflation moderated The April consumer price index for the New York/northeastern New Jersey region rose just 29 percent on a 12-month basis, following gains of 3 to 3-1/2 percent during the previous 4 months  On the national level, our forecast is rather close to the Greenbook's The differences are that we show less growth in 1997, and we are below the Board staff in our estimate of the CPI increase for 1996 On a Q4/Q4 basis, we have the CPI at 3 percent this year compared with the Greenbook's 34 percent However, we agree on 32 percent in 1997  Our Bank's forecasting record over recent years has been quite good, except that we were slow to recognize the wage restraint that is the main reason for continuing good inflation numbers We, like all of you, are not certain how long that can or will continue But I could have said that a year ago, and the restraint has in fact continued People running businesses still seem to be reluctant to raise prices When we talk to business people, they sound very alarmist about their industry or about the country or the world in general, but I find that they know very little about those subjects All I am really interested in is what they are planning to do with their own businesses When we ask them that question, we are told about very severe price restraint--the inability to pass on rising costs--and the need to rationalize their businesses So, I do not see great risks of the real economy growing above trend In fact, we have strong growth in the first half of this year, especially in the current quarter, and then growth drops slightly below trend in the second half of the year and in 1997 So, I see the risks as balanced by-and-large Despite all that, my anxiety level regarding price trends has begun to gnaw However, I consider the present stance of  -24-    5/21/96  monetary policy to be just about right or so close to it that, to borrow a phrase from Ed Boehne, ""watchful waiting"" is appropriate In fact, when he mentioned that, I remembered back about four decades to my days as an officer of the deck on a Navy ship where the possibility of a storm encouraged one to increase the state of alert On the other hand, increasing the state of alert did not in turn increase the probability of the storm [Laughter] "
4124,1996-05-21," Mr Chairman, I would like to concentrate on the part of your presentation relating to what we don't know It is clear that we don't fully understand what appear to be some new relationships in the economy affecting the connection between the real economy and the inflation rate And because I think that the present stance of monetary policy is close to being correct, if not absolutely so, I feel that we have the luxury of waiting until our next meeting in early July and I believe we should wait However, we should be careful not to assume--and your remarks did not assume, indeed quite to the contrary--that today's decision to wait until the next meeting has any implication that we will reach the same conclusion at that meeting The next meeting will be a new ballgame In my view, all we are discussing is whether to do something today or wait until the July meeting to consider what we should do I very much believe that we should wait  As regards symmetry and asymmetry, if the incoming data suggest that it would be appropriate for us to move before the next meeting, those data will be sufficiently dramatic that I am sure you would wish to have a conference call But I don't see the need for an asymmetric directive because I think the probability that you would be highly likely or even fairly likely to take action between now and the next meeting is quite low If we were to adopt an asymmetric directive at this meeting, then not move to implement it over the next 6 or 7 weeks and decide for good and sufficient reasons at the July meeting that a change in policy was not appropriate, I think that the minutes of this meeting to be released on the Friday following the July meeting would give a very strange and difficult to interpret message I do not believe such a message would be in our best interest So, I very much believe that we should take alternative ""B,"" and I feel perhaps considerably more strongly than you do, Mr Chairman, that symmetry is appropriate "
