,Date,content
4970,1998-05-19," Thank you, Mr Chairman The Second  District's economy continued to expand at a sturdy pace in the first quarter, but there have been  some signs of slowing in the manufacturing sector in recent weeks Job growth in New York and  New Jersey slowed a bit from a very brisk fourth quarter, with job losses in manufacturing and  government more or less compensating for strong gains in most other sectors As a result, the  unemployment rates were little changed in the two states Retailers are happily reporting that sales    5/19/98  continued to run ahead of their plans in both March and April, and they are satisfied with their  inventory levels Residential and commercial real estate markets both retain a firm tone On the  residential side, our data indicate that new home construction, existing home sales, and home prices  strengthened in the first quarter Office rents in New York City, especially in Manhattan, rose  sharply in the first quarter, and vacancy rates continued to fall Local banks report some slowing in  the growth of loan demand, but they also report further declines in delinquency rates, especially in  consumer loans, so the banking sector looks rather good  At the national level, we do not quite find ourselves ready to buy the productivity  improvement argument in the Greenbook Therefore, although we have about the same picture as  the Greenbook for 1998, we have inflation rising substantially more and heading up toward the 3  percent level in 1999 If that should be the case, namely that productivity does not increase as the  Greenbook says it will and that I personally hope it will, then I think we would be looking for a  monetary policy correction toward the latter part of this year But I believe we are now in a  position in which we can look at the domestic economy and decide that patience has been very  rewarding for the Federal Reserve Open Market Committee over the last couple of years We are at  a position that if we continue to get the productivity shock or if it becomes no longer a shock but a  real improvement in productivity, then policy at its present level would be quite acceptable Even  if productivity growth does not continue to benefit us or other pleasant supply shocks do not come  along, it impresses me that we do have some time to wait  When the Federal Reserve is in a position of being able to wait because that is, I  think, the best policy for domestic purposes, it gives us the opportunity to give the international  effects of our actions a rather high priority From that perspective, I believe that most times the  best thing the United States and the Federal Reserve can do is to manage our own economy well    5/19/98  because of its huge importance in the world economy At present, I sense that the world economic  situation continues to deteriorate The Indonesian situation is still very touch-and-go, with nobody  sure of what the political developments are likely to be and the economy getting more desperately  bad every day Thailand and Korea are improving, but in both countries the improvement is in the  external sector, and there is a very long and a very difficult domestic workout ahead for both  countries It seems to me for reasons that we discussed in conjunction with Peter Fisher's report  earlier that the situation in Japan is, if anything, getting more risky, not less, and it continues to be  the single, greatest threat to a stable world economy  Elsewhere in Asia, India's decision to test thermonuclear weapons caused the United  States to react with financial measures against India, which the Indian economy may or may not be  able to tolerate well However, if Pakistan responds as it may very well do and we have to impose  similar measures against Pakistan, its very weak economy could implode rather quickly The  measures that were taken against Mexican banks yesterday, however justified, are very likely to  create considerable backlash politically in Mexico in a situation in which the leadership is already  having difficulties, and they almost certainly are going to have some serious spillover effects on the  Mexican economy So, the rather optimistic view that one could have about Mexico certainly has  to be tempered  Russia is getting ever more highly volatile The history of Russia has been a long  conflict between the westernizers and the nationalists The nationalists now have a very popular  hero available to them after General Lebed's election victory in Siberia on Sunday The situation  around them with NATO's expansion, however much everybody may think that is a fine idea, gives  additional strength to the nationalists, and if they come to power, we are going to have a very  destabilizing regime--destabilizing not only for Russia itself but for its neighbors    5/19/98  It seems to me that as we look around the world, we see a good American economy  The British are doing reasonably well, but unlike us, their economy does not appear to be  benefiting from rising productivity Therefore, a correction is likely for the British economy  Actually, the two good lights are continental Europe and ourselves On balance, it seems to me that  international considerations would say that an interest rate increase by the Federal Reserve, which  could conceivably be justified domestically for preemptive reasons, would carry such a degree of  risk internationally that I think it would be extremely ill advised Thank you, Mr Chairman "
4971,1998-05-19," Thank you, Mr Chairman I agree completely  with both the recommendation that you have made and the arguments that you have advanced in  favor of it "
5031,1998-06-30," I second the nomination     The Russians are aggravating the problem  further in their handling of their short-term workout, if there is one, by doing some borrowing in  dollars and other hard currencies and pledging export earnings as collateral   Move approval, Mr Chairman   I also move ratification of the domestic  operations   I want to support the point that has just been  made I think we have enough intellectual resources within the System that have not been  brought to bear on this paper because of the shortage of time It was very difficult for any of us  to spend enough time on it, let alone to have an in-depth discussion with our staffs on it I think  that a robust discussion within the Federal Reserve System, which certainly does not create the  security problem that I believe is a very real one, would be much to be desired   I agree That is the magic of the verbal rather  than the numerical definition of price stability   I am somewhat sympathetic to President  Parry's view, but I think this is a dog that is better left not barking in the night and bringing  attention to the ranges at this time We would have a lot of explaining to do if we said that we  were reducing the debt range to move even more in the direction of price stability I'm not sure  that opening up that argument would be very convincing or worth the trouble The move would  occur at a time when most of us are concerned that, if we look purely at the domestic economy,  the likelihood is that monetary policy might have to be tightened I think giving a signal that  clearly would be interpreted as a weakening of monetary policy would be a terrible idea  Although I sympathize with President Parry's view, I believe we are better off if we retain the  present ranges for all the aggregates   In other words, I would not change the debt  range even though I think you probably are correct intellectually   I think we should not make any changes that  would increase the monetary ranges, and therefore the fine-tuning of the debt range--which is  really all you are suggesting, is it not?   I think that would bring attention to the subject that  we do not need "
5032,1998-06-30," Even better, the Big Mac index comes to the  same conclusion [Laughter]   They have a very rich economy, with income  and wealth rather well distributed That gives them a capacity to continue an inappropriate  policy for a fairly extended period of time They also have a relatively content electorate so that  there is not the pressure on the elected officials that would normally come in some countries such  as our own    6/30-7/1/98  I think another aspect of President Jordan's question relates to an assumption that the  Japanese economy is more of a market economy than it really is It is a command economy that  worked rather well for an extended period of time because the people commanding it did a  reasonably good job That command structure has broken down to a large extent, but there is not  enough pressure, except that brought by foreigners including recent visitors, to say to the people  running the country that they simply are not going to be allowed to let their currency devalue and  export their way out of the current economic difficulties because the rest of the world will not  permit it We, the rest of the world, will bring enough pressure to bear on you to make it clear  that rising exports are not a solution you will have the luxury to use That may be good policy or  bad policy, but if we look at the effect on the United States and on Europe of having to absorb  the cost of the Asian crisis, we can easily see where the pressure on Japan is going to come from  to manage its economy in a way that is more hospitable for its neighbors in Asia and less  demanding on the rest of the world Japan will have to fill the role that I think we can properly  ascribe to them   Thank you, Mr Chairman The Second  District economy has been quite strong in the second quarter Our manufacturing sector, which  is concentrated in the northern half of New Jersey and upstate New York, actually began to look  up a bit until the General Motors strike came along GM has laid off about 5,400 workers of the  10,000 located in Buffalo, some more at a parts plant in Rochester, and about 2,300 in northern  New Jersey That has set manufacturing back a bit Although New York City still has an  unemployment rate of over 7 percent, that rate is down from over 10 percent 8 or 9 months ago,  and the city seems to be on the way to adding more new jobs this calendar year than in any year  since the 1960s So, the city continues to do rather well  As I look at the national and international economies, the word that comes to my mind  is ""uncertainty"" I think that the forecast, as presented in the excellent staff Chart Show, is a  perfectly reasonable one and one that I sincerely hope will materialize, especially the  international aspect of it However, the downside risk on the international side is very  considerable in my view The situation in Japan impresses me as one in which the economic  data do not tell us the nature of the crisis What we are dealing with in the second largest  economy of the world is a very deep cultural crisis in which the decisionmaking process of the  society, which had served Japan very well since the Meiji Restoration and especially since the    6/30-7/1/98  Second World War, has broken down The decision recommenders and to a large degree the  policymakers have been in the bureaucracy, which is now completely discredited and even more  completely dispirited  During our recent trip to Japan Deputy Treasury Secretary Summers and I found that  leadership for the Japanese nation would now have to come from the largest political party, the  LDP This is a rather significant shift in the way that society is run, and one has to hope that the  shift will work well In my view, the emerging decisionmakers in the LDP probably have a  window of opportunity of about two to three months in which to convince the party members and  other political decisionmakers to take some very difficult steps as regards the restructuring of the  Japanese economy, especially the financial sector There is a real question concerning whether  they will be able to do that  If they do not--that is, if the Japanese people continue to have very low confidence at  both the consumer and business levels and if that doesn't turn around in the next two to three  months--I think that Japan will sink into a deeper recession That inevitably will cause a much  more serious crisis elsewhere in Asia, largely because the situation in Japan would add to the  crisis of confidence in an area where confidence is already abysmally low It is very difficult to  imagine that the effects would not spread to the key countries in Latin America We have seen  that even Chile has become vulnerable and has had to change policies of very long standing,  which they thought had served them very well We have a crisis that is at an advanced stage in  Russia, and it could readily spread to Russia's neighbors Turkey is always an accident that  could easily happen In my view that sort of international financial crisis would not be limited  to an Asian trade effect of, say, 1/2 or 3/4 or 1 percent on U S economic growth, because it is very    6/30-7/1/98  difficult to imagine that that would not spill over into our financial markets and create a rather  large correction  Looking at the purely domestic economy, if the crisis that I believe could emanate  from Japan does occur, the downside risk to our real economy will be very considerable If on  the other hand a crisis in Japan does not happen, the other great uncertainty is whether we will  continue to have the kind of productivity growth that is projected in the Greenbook Lower  productivity growth could reduce the rise in real output to below the Greenbook forecast and  raise inflation to a rate above that in the Greenbook and certainly as high as that in my own  Bank's inflation forecast Our forecast, which appears to be rather similar to a number of  forecasts reported around the table, has inflation rising to about 3 percent next year We simply  don't know whether productivity will continue to ""finance"" more rapid economic growth with  very low inflation We have been experiencing very nice productivity improvement since the  last quarter of 1995, and even a nonbeliever in the new paradigm like me eventually has to  become convinced, if it goes on long enough, that there really is something new here  Now, it seems to me that if we have this massive uncertainty on the international side  and very considerable uncertainty on the domestic side and we have monetary policy close to  where we want it to be in any event, there is a very, very strong case that the watchful waiting  that has served this Committee so extraordinarily well over the last several years is the right  policy to continue "
5033,1998-06-30," Thank you, Mr Chairman I am essentially in  agreement with your analysis and with the conclusion I do have modest differences I believe  that the risk on the external side is somewhat greater than you indicated, and it could materialize  even sooner than we have anticipated On the basis of what we now know, what the Liberal  Democratic Party is going to announce in Japan on July 2, which is coming on us rather quickly,  will be very disappointing to the financial markets The big rally that we have had in the yen and  the Nikkei was mainly an end-of-quarter rally as of June 30 Today, when the Nikkei rally  resumed, I think the markets indicated that they are expecting far more out of the announcement  on July 2 than is likely to be there Therefore, the notion, which I think is the single biggest  problem, that the Japanese government and its leading party cannot get their act together could  be on us rather quickly indeed  I agree that the Russian situation is extremely hazardous Since one of the areas of  strength in the world economy is continental Europe, a serious financial crisis in Russia, which  could very quickly turn into a political crisis in a nation with lots of weapons, could easily undo  some of the confidence that has been restored to continental Europe in the last year I think a    6/30-7/1/98  severe worsening of the international situation is certainly not within the range of the probable,  but I would describe it as a risk that is distinctly possible  On the domestic side of the economy, I agree very much with your view, Mr  Chairman, that we do not know whether the wonderful productivity improvement we are  experiencing is going to last You laid out the basis for that uncertainty very well in your  remarks I think the likelihood that wage pressures are going to burst out is not terribly great  What would happen in my view is that in various pockets of the economy people would start to  realize that they could push their employers to pay higher wages, but I think that realization  probably would spread somewhat more slowly than your remarks suggested Therefore, the  price reaction might be somewhat slower as well However, clearly if the domestic economy is  to be looked at in isolation and one assumes that the international crisis will not happen, and we  certainly all hope it will not, then I think we will be in a situation in which the risks to inflation  are sufficiently great that, although I agree we should not change our policy today, an  asymmetric directive toward tightening is certainly in order   Mr Chairman, could I remind us all why we  decided to do it that way? If we change the tilt but not the federal funds rate and we say there is    6/30-7/1/98  ""no change"" in policy, we are in some sense lying because there has been a change in policy  There has been a change in the tilt   That is why we invented the notion of saying  ""the meeting has ended, there is no further announcement""   Had we said that the first time, I suppose we  could continue to say that   The reason that we want to be very clear is  precisely not to deceive the public   I think our current practice has the benefit that  people are used to the way we do it now   If you succeed, you could be a candidate for  one of three Nobel prizes literature, economics, or peace [Laughter]   Mr Chairman, I wind up agreeing with the very  fine explanations by President Boehne and Governor Kelley that have been supported by a  number of people, but let me say why First of all, a bit of history The reason that we decided  in February 1994 to announce changes in the funds rate was partly transparency and partly  ethics The Committee's previous policy of making a decision and then having the Desk at the  New York Bank in effect apprise the cognoscenti through its operations in the market seemed, in  my view as someone who had been in the business 22 years, to verge on the unethical The  reason is that it clearly had the effect of letting the insiders know before the unwashed knew So,  one of the main reasons we changed that practice in my view was because it was the right thing  to do, the moral thing to do At the time, we also decided that if there was a change in the tilt, it  would not be announced, and that is how we got into the announcement mode that I mentioned  earlier  It seems to me that we can go one of two ways at the present time We can either stay  where we are, which is what I think we should do, or we can move to announcing as soon as  possible what the policy decision has been I think a number of people who are of the latter  persuasion have concluded that we would probably issue a cleaned-up operational paragraph that  is understandable to the average person I see that as a big problem because such a paragraph  would inevitably state very baldly what is in fact a very sophisticated message Monetary policy  is not an ""on and off"" switch nor is it a partially on, partially off switch, which is the tilt It is    6/30-7/1/98  rather something that one is trying to do in order to have a better economy at the end of the day  for the good of the American people and people around the world  I think our present policy, which is to make an announcement when there is a change  in the federal funds rate, is very clear and very specific It is easily understandable If we need  some additional explanation of what we are doing, ideally we have the Humphrey-Hawkins  testimony or, if not, the Chairman can either create or take advantage of a speech opportunity  We have the great advantage of having an unusually capable spokesman, who is able to provide  all those measures of subtlety and nuances that I believe are a very important part of the policy  message We simply cannot do that in an announcement that we have to release on the day of  the meeting If we did, we would have exactly the problem that Ed Boehne described so well  We would spend the whole meeting shadowboxing about what we were going say at the end of  the meeting That would take any spontaneity out of the meeting, which is already  unspontaneous enough because of the knowledge that the whole transcript is eventually going to  be released So, people come into the meeting with prepared remarks It is always hard for me  to believe that if we have prepared remarks, we will spend a lot of time listening to the other  people who have been trying to share some information with us  I think that releasing anything on the day of the meeting would make the meeting a  completely unspontaneous set piece, and as a result we would have poor monetary policy It is  wonderful to have transparent monetary policy If we could have the best possible monetary  policy and the most transparent monetary policy, I think that would be the ideal I don't think we  can have both In my view we are better off having the best possible monetary policy explained  to the American people in a way that in fact works quite well, which is what we have now So, I  am very much in favor of retaining our present formula    6/30-7/1/98   This directive is clear by comparison!  [Laughter] "
5086,1998-08-18," Move approval   If their position does not appear altogether  logical, it is not   Move approval of the domestic operations, Mr  Chairman    8/18/98 "
5087,1998-08-18," Thank you, Mr Chairman The Second  District's economy has continued to expand at a strong pace since our last report, led by real estate  and construction Job growth moderated a little in June, but it was brisk in the second quarter  overall Retailers report continued very good sales in July, notably of home durables Retail  prices were steady last month and inventories remained at satisfactory levels Tight real estate  markets persisted in the second quarter Office rents surged at a 27 percent annual rate in  Manhattan but leveled off in the suburbs, and vacancy rates generally were steady  On the national economy, our forecast is somewhat more optimistic on growth and, not  surprisingly, we have the CPI rising a bit more between now and the end of 1999 than does the  Greenbook But by and large, we are in sympathy with the Greenbook forecast What I think has  changed since our last meeting is the balance of risks The risks have moved from a higher    8/18/98  likelihood of rising inflation to a situation in which that possibility still exists but is at least  counterbalanced by the possibility that both the American consumer and the American business  executive will become more cautious, with the result that growth could be reduced to below our  New York forecast or that of the Greenbook I am not suggesting that we fear a recession but  rather quite weak growth  The international situation appears to me to be worse Japan's new government is  doing virtually nothing, and the political opposition has announced its unwillingness to support  the already inadequate banking reform legislation that the government has proposed The  recession in Japan, in my view, is at least as likely to persist--with continuing chilling effects on  the rest of Asia and the rest of the world--as to bottom out and improve A weak Asia, a seriously  troubled Russia, and weakness showing up in Latin America all raise the likelihood that the flow  of capital to the safe havens of the United States and core Europe will not slow down but rather  will continue, making those currencies stronger than they otherwise should be I believe that will  lead to a political furor both in continental Europe and in the United States, especially as people  become, probably appropriately, unhappy with helping Japan solve its problems, to the degree it is  solving them, by drawing in exports from that country  I do not recall a time when there has been more uncertainty in financial markets  Although there has been heavy trading volume in the US equity markets in recent days, that  seems to be concentrated among speculative investors In many other markets, there is  considerably less liquidity as large financial institutions, both observably and from what they tell  us, react to the uncertainty by reducing their trading positions That strategy makes an immense  amount of sense at the level of the firm, but it increases market volatility because of a lack of  liquidity    8/18/98  I have felt for many months that watchful waiting is appropriate for this Committee but  with a view that the risks were in the direction of rising inflation Now I think that the risks are  greater still but much more fully balanced, given the perceptible shift in the direction of the risks  toward inadequate growth Thank you, Mr Chairman "
