,Date,content
4970,2003-08-12,"  Thank you, Mr Chairman  The Tenth District economy has   strengthened since the last meeting  Although economic growth is certainly not robust, it is at   least showing some positive signs  The labor markets are still soft, but they do appear to be   improving slightly  Employment has slowly edged up since the end of the Iraqi war, moving   August 12, 2003 50 of 110    almost to year-ago levels  Layoff announcements did rise somewhat in July, but that was due   mainly to some anticipated job cuts at certain military bases     Manufacturing activity showed further signs of recovery in July  New orders were up    Our manufacturing index was 16 in July, up from 6 in June and minus 2 in May  Thats   consistent with other improvements, such as increases in capital spending and expectations of   future production that remain generally favorable  The negatives were that current production   did slip back to below year-ago levels and plans for future hiring and capital spending remained   unclear  Theres a certain sense of wanting to go forward but a hesitancy that still remains     Consumer spending has continued to rebound from the dip during the war  Retailers   contacted in mid-July said that their sales were up a little from previous months and at or above   year-ago levels in most locations in our region  Commercial real estate, though still weak, has   shown some signs of stabilizing  Office vacancy rates were unchanged in the second quarter,   and construction activity leveled off after trending down for the last year and a half  Housing   activity remained strong  The recent increase in mortgage rates has caused a fairly sharp   reduction in refinancings, but so far weve not heard any reports that it is curbing housing   demand itself  Energy activity remains an important source of strength  Drilling for natural gas   continues to expand, supported by high prices and the lifting of some environmental restrictions   recently in Wyoming   State and local budgets remain a drag on the District economy  Colorado, Nebraska, and   Oklahoma are planning to implement some further spending cuts  Also, legislators in Nebraska   and Kansas are talking aboutand in fact are very close toenacting some tax increases    Pricing trends are little changed since the last meeting  Retail prices have been stable  In   manufacturing, our contacts tell us that prices of materials have continued to rise while prices of   August 12, 2003 51 of 110    finished goods have continued to encounter downward pressure  The farm economy is   recovering  Those areas that have a crop have a very good crop  Some areas in western Kansas   and Nebraska still are experiencing a drought, and farmers there are relying on government   payments as they have in the past   Let me turn to the national economy  It appears, as others have noted, that the economic   forces are in place for sustainable recovery, making a rebound to trend growth this year possible   and to above-trend growth next year most likely  We have accommodative monetary policy and   fiscal policy, strong productivity, and a healthy financial system that can support the credit needs   of businesses as those needs materialize  Of course, as weve talked about today, the significant   increase in long-term interest rates is a topic receiving a lot of attention  While the rise in long-  term rates can be a negative, obviously, part of the increase reflects simply a rebound from the   dramatic declines in May and June  But I think those rates also have risen because investors are   more confident about the strength of the recovery  In addition to anticipating the strong   monetary and fiscal forces propelling the economy forward, were now beginning to see the   strength reflected in economic and financial data  Inflation-indexed Treasury yields suggest that   real interest rates are higher  In addition, the inflation premium has in fact increased   Putting this all together, my outlook for the economy continues to be for real GDP   growth of about 3 percent in the second half of this year, which is below the Greenbooks   4 percent  I think growth next year will be closer to 4 percent than the Greenbook forecast of 48   percent  Of course, if business becomes confident about the outlook and business fixed   investment increases to the 13 percent suggested in the Greenbook, then we could see growth in   the range of 4 percent or better  So, while I see upside risk to growth, it is based on my   August 12, 2003 52 of 110    forecast of growth most likely being near 4 percent, not the 48 percent projected by the staff    Relative to that 48 percent, I think theres probably some downside risk   Let me turn briefly to the inflation outlook  I expect core inflation to remain relatively   stable  While the output gap may put some downward pressure on inflation, I would be reluctant   to place too much weight on the output gap as a predictor of inflation going forward  More   significantly, financial markets and market economists seem to me to be expecting somewhat   higher inflation  In my view, the inflation risk for 2004 is about balanced  More generally,   given the outlook, I think the risk of unwelcome deflation or disinflation caused by a collapse in   aggregate demand is negligible, although I do recognize that continued strong productivity, along   with modest economic growth, could lead to some further disinflation  Thank you  "
4971,2003-08-12,"  Im very comfortable with your recommendation on both counts, Mr   Chairman   August 12, 2003 76 of 110      On balance, I think it would be preferable to drop the last sentence   because it does change the statement, which gets attention, and then expectations change  If we   August 12, 2003 90 of 110    just repeat what we said before, were signaling to everyone that policy is on hold  In terms of   policy announcements or implications, I think that is the safer course, and we can have a full   discussion of these communication issues at the September meeting  I recognize that this last   sentence comes out of the semiannual monetary policy report, but if it becomes part of the   Committees statement, it will receive more emphasis     No, Im not suggesting that you are  Im just saying that having that   wording here does tend to bring out the point more forcefully    "
5015,2003-09-15,"   Mr Chairman, I have a question about something you said  Ill ask for   Vincents interpretation of it so I can get this question on the table now  [Laughter]  You were   talking about wanting to inform the market about our outlook for the future  I think thats what   you were saying in your opening comments       Thats what I want to clarify  Are we talking about the risks we see   today and how we interpret those risks?  Or are we talking about taking the statement further, as   we did last time, in terms of policy in the foreseeable future?  What is the intent?     Okay     I think its important to be clear what we mean when we talk about the   future  If were talking about the balance of risks we see today based on the information   September 15, 2003 16 of 78    currently available, thats one thing  If we suggest that our assessment of the risks implies a   future action on our part, then I think weve gone beyond what we can reasonably do as far as   predicting the future     Thats helpful to me  Thank you     Right     Mr Chairman, Im going to back off of Als point  I have some   sympathy for setting an inflation objective, but I think price stability is the objective  Im more   or less following up on Bob Parrys comments  Where Im having difficulty with this whole   issue is that, to my mind at least, we are introducing a new ambiguityI think it happened at the   last meetingand that is this idea of market guidance  I feel very uneasy with it       Yes, or anything like that  Weve moved further away from our   boilerplate language in trying to be more explanatory about our actions  As you started out   saying this evening, we cant predict the future  None of us can predict the future  Another   factor is that the markets receive as much data as we do, and they can judge our actions or our   prospective actions based on those data and on our past actions  Over a long period of time, it is   September 15, 2003 39 of 78    the actions that really do speak better than the words  So thats where Im coming from    Moreover, its my experienceand I think others have found this to be the case as wellthat   people hear what they want to hear  Sometimes, and maybe often, the markets hear what they   want to hear, so we cannot expect to convey conditional statements very successfully to the   markets  People simply dont believe or accept statements as conditional in hindsight  Thus, we   find ourselves having to surprise the markets, in a sense, when we try to be too prescriptive or   forward-looking     So I would focus on the statementI think its a good suggestion to bring the wording in   the Bluebook and the language of the press release togetherand say that this is what our action   is today  We can talk about the risks we see todaythe risks with regard to economic output   and inflation and leave it at that  That means more boilerplate  My view is that, if we try to do   any more than that, we will get into a very complicated pre-approval process on the press release   because wed be saying more than the action itself says  I think thats a very bad course to   follow  In my view, outlining our sense of the risks is about as much guidance as we can   provide  However, if we are going to try to use our press release to explain moreand Ill end   with thisI have a very strong sympathy toward the Bank of England model  Vincent talked   about the possibility of errors occurring if we use that model, but frankly, I think there will be   fewer errors if we publish the minutes more quickly than if we try to write a press release that   represents twelve views in two paragraphs  With the latter approach I think we really open   ourselves up to errors and rough statements     Its one I think we ought to consider very seriously if we start going   down the road of wanting to expand what we say in the press release rather than making it more   September 15, 2003 40 of 78    boilerplate  I have to tell you that I think focusing on those minutes and saying that they are an   accurate representation of our discussion would be very healthy for the market  With the release   of the minutes we are saying in effect these are the facts  The market can interpret our actions   and our outlook based on those facts     I would go back to announcing our action      With no comment, right     Id release them as quickly as we cantwo weeks after the meeting if   thats reasonablebecause they provide the explanation for our actions  The market can   decipher the minutes  Yes, people may occasionally misinterpret them, but the minutes are our   representation of the discussions that occurred at the meeting  And theres no attribution, so   there is no risk to an individual member  I would prefer that to expanding the press statement    Now, if we go to a boilerplate statementthis is our action, and these are the risks, with the risks   clearly understood as those we see today and not anything that hints at our next moveIm fine   with that  But absent that, I think we ought to get the minutes out more quickly and confine the   statement       Remember one thing I said  I said that Id rather go through this   challenge with the minutes than opt to expand the press release  I think theres more danger in   the press release if were going to get prescriptive with it         "
5049,2003-09-16,"  Thank you, Mr Chairman  To begin with the region, our Tenth District   economy actually has shown further improvement since our last meeting, although District firms   remain reluctant to hire strongly or to spend a lot of money on capital  At the same time,   manufacturing activity has expanded, retail sales were solid heading into the fall, and residential   construction and sales rose to new levels  I would also note that weve had reports that state and   local tax revenues are now starting to come in above projections     Layoff announcements for District firms are continuing to trend downward, although we   havent seen a pickup in employment, as I mentioned  While large firms we contacted indicated   that they are not planning much in the way of new hiring, it is interesting that a substantial   number of small to midsized manufacturers said that they do expect to add to payrolls in the   coming months  The picture for capital spending is similar; its sluggish overall but with a few   signs of a possible turnaround, especially among small and midsized firms  This includes a   pickup in nonresidential construction due to some plant expansions now being talked about    September 16, 2003 33 of 106    Also, there is some increased interest among manufacturers in the new investment tax incentives    As for inflation in our area, raw materials prices and benefits costs have continued to rise   significantly  Also, in keeping with the stronger economic picture, there has been less evidence   of price cuts on finished goods     Turning to the national picture, I agree with the staffs assessment that the economic   forces are in place for a sustainable recovery, with growth above trend this year and next year the   most likely outcome  As has been noted, we have an accommodative monetary policy,   stimulative fiscal policy, strong productivity, and a healthy financial system that can support the   credit needs of businesses when those needs materialize  In addition, economic data released   since our June meeting have been consistent with stronger growth this year and next  More   specifically, I expect growth over the rest of this year to be at least at the 4 percent mark  I   would note also that I know of more people now expecting growth to be north of 5 percent in the   third quarter and Ive seen projections here and there of 6 percent growth   Of course, I am aware that there are downside risks to the outlook as well  Obviously I   remain concerned, as do others, about foreign economic growth  As the Greenbook notes, the   foreign outlook has been revised upward, but thats primarily because the forecast for the US   economy has been revised upward  So to some extent were looking at one another and saying   that we each should get a better economic outcome, and I think we have to be sensitive to that    Im also concerned that while CEO confidence is improving, its not taking off strongly  Though   weve seen some increase in capital spending, we do not yet have a clear self-sustaining   recovery, as they say, on the business fixed investment side  Without that, we all are concerned   about the continuation or the sustainability of the recovery itself  The largest question mark   remains the labor market  I realize that employment is a lagging indicator, but the lags seem to   September 16, 2003 34 of 106    be especially long this time  Strong productivity is affecting this situation, obviously    Nevertheless, I expect that we will be seeing an increase in employment, as the Greenbook   projects, by the end of the year if not before and then a decline in unemployment beginning next   year     Let me speak very briefly about the inflation outlook  I expect core inflation to remain   relatively stable at its current level, which I think is a good thing  While the output gap may put   some downward pressure on inflation, I am cautious about putting too much weight on the output   gap as a predictor of inflation trends  For one, theres the issue of level and speed effects and so   forth, which I believe Dave mentioned also  In addition, market economists are expecting   somewhat higher inflation, not lower, and I think thats because they also question the role of the   output gap or its change in determining the course of inflation  My own view is that the near-  term inflation risks are about balanced  Inflation may move higher or lower but probably not   much in either direction if it does move  Given the outlook, I think the risk of an unwelcome   decline in inflationone caused by a collapse in aggregate demandis in fact negligible  I do   recognize, as I noted, that with continued strong productivity growth we could get a reduction in   inflation  But I would be hesitant to call such a development an unwelcome event  Thank you  "
5050,2003-09-16,"  Mr Chairman, I agree with leaving the funds rate target unchanged at   this meeting  My own view is that we are in an environment where were close to price stability,   with low and stable inflation, and I think the risks are balanced  I will tell you that trying to   figure out what to say in this statement right now makes the early release of the minutes seem   more appealing to me than it did last night  In any event, I dont think we can do much to   change this statement given the current circumstances, so Im not going to argue any further  Ill   live with this language, but I hope we do develop a very carefully crafted exit strategy fairly   soon  Thank you     Mr Chairman, listening to this discussion, I want to say that I very much   agree with those who say we should leave this wording absolutely the same as it was last time     Keeping it the same tells the market something right there  It means that   we dont want to change anything, and market observers will begin to think about the fact that   well be backing off in the future  I think that will take us a step forward in an exit strategy   September 16, 2003 93 of 106   "
5105,2003-10-28,"  Mr Chairman, I more or less share the view that President Guynn   expressed  One of the things I did in preparation for this discussion was to go back to the press   release that we used in January 2000  After some considerable thought, the Committeerightly   or wronglyput that wording together  It worked very well as far as Im concerned  Then some   special circumstances came up, and we made changes in that wording  They served their   purpose but now we have some fallout from that  We ought to go back to the earlier language as   a starting pointnot to the language were now using, which was put together ad hoc piece-by-  piece, but back to the base  Lets think it through and see what we need to modify in that   language  If it makes sense, Id keep the structure as close to that earlier version as possible and   then move forward  I would not try to figure out wording today or choose now among several   options  I dont feel comfortable with any of them  Id feel reasonably comfortable with what   we had before with some changes to reflect that were in a more stable price environment  So I   agree with Jack  Maybe circumstances are changing too quickly, and we cant wait until   January  But we ought to wait at least until December, think this through more carefully, and   come up with some options or narrow our options at that point  "
5106,2003-10-28,"  David, looking at 2004, your estimates for consumption are strikingly   strong  It would be great if the figures came out that way  But you estimate consumption to be   as strong as it was in the late 90s  You touched on your reasoning, but could you again give me   your rationale for that?  I ask because your forecast is an outlier; its at the upper limit of the   range of forecasts     Well, I question only the third reason relating to the wealth effects    When we had these kinds of growth rates in PCE previously, the wealth effects were much more   positive  So in my view the wealth effects returning to neutralwhile granted they are no longer   a dragwont produce quite the boost that might be expected  I do agree with you on the labor   market, however; I certainly see that improving as we move forward  But the consumption   forecast seems a little strong to me     Mr Chairman, the Tenth District economy continues to improve, and our   business contacts have become somewhat more optimistic about the outlook  Let me talk a little   about the labor markets They remain soft but are showing some signs of firming  According to   some of the payroll data weve looked at, employment was flat for our District in September    However, layoff announcements are down from earlier in the year, and more firms say that they   are planning to hire or are thinking about hiring  I would note anecdotally that firms announcing   job increases in the last couple of months include several call centers, a major railroad, several   manufacturers in our area, and a number of high-tech firms in Colorado  To the relief of people   in both Kansas City and Tulsa, American Airlines decided not to lay off workers at its two large   maintenance facilities in those cities   On the manufacturing side, activity actually strengthened further  Production and new   orders both increased, and expectations for future production and orders remained relatively   high  Capital spending also improved somewhat  Although employment remained below year-  ago levels, the average workweek did rise noticeably  On the negative side, aircraft   manufacturing continued to struggle, with little improvement expected until 2005  I would note   that from August to September the year-over-year production index from our survey of   manufacturers rose from 8 to 17, the new orders index climbed from 22 to 31, and the capital   spending index improved from 0 to 12  Moreover, preliminary data received for October as late   as yesterday suggest that these trends persisted in October   Consumer spending continued to edge up despite the softer labor market that I   mentioned  Retailers contacted also said that they had had pretty good sales and their confidence   remained strong  Housing activity increased further, setting new records in most of the areas   except for Denver where its a little slower  Commercial real estate does remain weak in the   October 28, 2003 50 of 126    region, and energy activity is expanding but at a moderate pace  State and local budgets show   further signs of improvement, with some tax revenue increases in several of our states  But I   would caution that to some extent those numbers reflect tax increases  On the agricultural side,   forecasts for net income have moved up as much as 22 percent over last year  But I would   remind you that about $20 billion of federal farm payments are included in those numbers     Let me turn to the national outlook  The economic forces are in place for a relatively   robust recovery  That assessment is based on current monetary policy, fiscal policy,   productivity, and a good strong financial system that can support credit needs going forward    Overall, I expect growth through the end of next year to be above 4 percent, a little better than   the Blue Chip consensus but not quite as strong as the Greenbook forecast  As noted, a recovery   in capital spending and an increase in employment remain two risks to our achieving sustainable   economic growth  But Im hearing about some increases in capital spending from the people we   talk to, and we see some evidence of it in the numbers  In my conversations with CEOs in the   District, theres a clear sense of greater confidence and an indication that firms are more willing   to undertake planned expansions  So Im optimistic about that  We also are beginning to see   some signs that labor markets are responding to the acceleration in growth over the past several   months  The evidence is very preliminary and tentative, I realize, but I think it bodes well for the   labor markets going forward     Turning to the inflation outlook, I would say that, in the near term, inflation is likely to   remain stable and that the risks going forward are about balanced  A continued decline in the   dollar could put upward pressure on inflation  Although the output gap may put some downward   pressure on inflation, I am reluctant to put a lot of weight on that gap as a predictor of inflation    October 28, 2003 51 of 126    Research here and elsewhere suggests that the predictive powers of the output gap on inflation   are difficult to find   Finally, on the topic of policy let me say that I clearly would be of the view that for now   we should maintain policy where it is  I think any change would actually be harmful in the   current environment  However, given recent data, Im not convinced that we can define a period   within which we can keep rates this low  I also think its important that the public come to   realize, as President Parry suggested, that an accommodative policy refers to the level of the   funds rate and not to the direction of any change  Although I do not have a point estimate of the   long-run equilibrium for the funds rate, it probably is more likely in a range of 3 to 4 percent   than near 1 percent  Thank you  "
5107,2003-10-28,"  Mr Chairman, I support you completely  Since were into metaphors   today, heres mine  With regard to the communication part of your recommendation, with the   second paragraph I think we have dug ourselves into a hole and were trying very hard to get out   October 28, 2003 83 of 126    of it but all were doing is getting in deeper  Lets put the shovel down, think about it, and climb   out of this hole later  Thats why Id say leave the paragraph exactly the same  "
