,Date,content
1235,1991-10-01, As a matter of fact it is and that's a warning to all of you 
1236,1991-10-01," Mr Chairman, do you want to hear from our District?   I appreciate that  -25-    10/1/91   I might just make a couple of comments that might be of some value   Our District economy has been growing fairly modestly, and I think it's particularly important that this has happened in the manufacturing area as well Our automobile manufacturers are operating at capacity And while our aircraft industry, which is important in parts of our District, had a downturn in the first half, it is anticipating some recovery, which is good news for us I might mention that residential construction activity in our area has been picking up, but nonresidential has continued to languish, although not as seriously as in other parts of the country I might even mention that in Denver, although there's not a lot of activity, there is an appearance that lease rates are firming up and that is important to us  In agriculture, the situation is very similar to what you've heard here There is some strengthening in crop prices but cattle prices have been falling fairly importantly and we anticipate about a 10 percent decline in agricultural income in our part of the country Energy also is weak, particularly in the natural gas area It has been very harmful to our Oklahoma area where prices have been down and therefore rig activity has been falling as well  On the national economy, I would like to mention that our analysis is, like others, very similar to what is in the Greenbook We are a little more pessimistic in the consumption area and net exports but a little more optimistic on the investment side We think it might be even stronger if long-term rates were to continue to come down We are also in agreement with the projections on inflation being less than 4 percent We think that's a very important focus as we go forward because that will help long-term rates to come down and that will have a much more important stimulus on the national economy So with that, Mr Chairman, I'll make my remarks short Thank you "
1237,1991-10-01," ""B"" symmetric "
1287,1991-11-05," I totally support taking this action tomorrow for the very reasons that Governor Angell, Governor Kelley, and others have expressed We need to get it out "
1288,1991-11-05," May I ask a follow-up to Tom's question? As you described the economy, there were some fundamentals in terms of real estate and some adjustments in leverages and so forth that are going to be constraining If we ease now, what in your judgment is the risk of pushing inflation [up] and compromising our ability to bring it down in the future, given these fundamental adjustments that probably should continue regardless?   The Tenth District continues to outperform the nation to some extent, although if we keep talking about it we may talk ourselves out of any improvement It's doom and gloom from a number of people, although the numbers continue to show some improvement For example, most of our automobile plants continue to operate at capacity Now, in aviation manufacturing, there has been a decline in production over [the level] a year ago and that's primarily due to a drop-off in foreign demand The District's oil and gas exploration activity remains lackluster, as it does elsewhere Drilling rigs were up very slightly in October over September and are still well below--about 23 percent below--year-ago levels In  -14-    11/5/91  agriculture, cattle prices have turned [up] and are now back to the break-even point And in the grain area, prices have increased, which has been a help in that sector Finally, the indicators of construction activity in our District quite frankly have been improving Building contracts awarded in the District in August were up 11 percent over year-ago levels Residential awards are increasing in most of our states And we're even seeing some improvement in non- residential contracts in Colorado and in New Mexico So, the District's economy is consistently showing improvements  As far as the national economy goes, we continue to forecast sustained growth although slightly weaker, as the staff is projecting Our forecasts are for a little better growth than the staff has in the first half and a little more moderate growth in the second half We see a little stronger inventory investment and some continuing strength in consumer spending; even though the attitudes are down, we don't see that dropping sharply As for inflation, we anticipate the inflation numbers will stay modest and actually fall somewhat below 4 percent So, that is how we are viewing things right now Thank you "
1289,1991-11-05," Mr Chairman, I have some concerns about easing now in terms of inflation down the road I assume that there may be a discount rate cut If that's the case, that would make for an announcement from the Fed and then I would recommend the possibility of a 1/4 point cut on asymmetric [language toward] easing based on new information that may come to you So, I'd be slightly different "
1342,1991-12-17," Thank you, Mr Chairman Our District growth continues to be slow and we see no real improvement in [prospect] in the near future In agriculture, we expect declines in income of between 5 and 10 percent this year and we anticipate similar declines next year Activity in the oil and gas areas of our District continues weak Drilling operations activity as of November is down about 30 percent from the year before and there are no signs of any significant improvement there Manufacturers, particularly the auto companies that are operating in our District, are now increasing their furlough periods The General Motors plant is going to go out for four weeks starting I think this week or next week In the construction area, our District has seen improvements As I mentioned last time, it's partly because we've had such deflation; but we've seen good residential activity and some nonresidential activity in parts of our District  As far as the national economy goes, our staff feels that its projections are generally in line with those in the Greenbook We're not quite as pessimistic for this quarter or the next quarter, but we're certainly not as optimistic about the rest of 1992 For inflation, our forecast is very similar to the Greenbook forecast We see no really strong inflationary pressures going forward  As for the implications for policy, then, we think there is room for easing, although our preference is along the lines of what Governor Mullins said in that we think it's something we ought to be prepared to do down the road but would wait and choose our time I think that would be perhaps a more effective way of going forward Thank you "
1343,1991-12-17, I agree with your recommendation 
1393,1992-03-31," Our District continues to show a mixed performance on balance with very slow recovery [emerging] For example, our employment in January was up about 01 percent over the prior month As for the positives, one is retail sales Retailers around the District tell us that there has been a pickup in sales and they are, as we've been saying, cautiously optimistic that that will continue Construction-wise, we are still seeing improvement January was about 12 percent over a year ago for the District, but that was primarily in residential Commercial property continues to be fairly weak, with vacancy rates in Colorado, for example, still in the 24 percent area and higher than that yet in Oklahoma So, that sector is going to remain weak; but residential [construction] has been very strong Manufacturing is mixed for us In the auto industry there are still plans to continue with two shifts, but there has not been enough optimism for them to reverse [the decision] in process of being implemented to lay off 1,000 employees in Kansas City Also, other manufacturers we talk with are seeing some pickup, but it's very modest and they're not at all convinced that business is going to continue strong as we go forward They're waiting to see Economic activity is also being dragged down a bit with some defense cutbacks Martin Marietta in Denver, for example, is laying off 1,000 workers; and Allied Signal in Kansas City is laying off about 750 So that's a bit of a drag offsetting the anticipation of stronger sales in the auto industry Clearly, our weak sector is energy It's still very weak The rig count is down 25 percent from a year ago--not as much as in Louisiana, but down As you may have read this morning, Oklahoma has passed a law trying to restrict production of natural gas in an effort to boost its price; we'll see how successful they are In agriculture, the outlook is a little mixed In the grain area, there is some optimism with regard to prices In the cattle area, there is more pessimism Land values have remained virtually unchanged because of some concerns about pricing going forward So, our economy is mixed, although people are trying to be optimistic  Nationally, we generally agree with the Greenbook although our forecast is not quite as strong We anticipate and we're optimistic that the economy will grow a little less than 2-1/2 percent over the year However, we differ a little We think investment will be a little stronger and consumption a bit weaker than the Greenbook is projecting On the inflation front, we are also about in line with the Greenbook in terms of seeing core inflation continue to trend down So, that's where we see things right now "
1394,1992-03-31," Mr Chairman, because the Greenbook and our forecast agree that the economy is improving and because year-to-date, at least as Gary said, the money numbers are near the midpoint, I'm comfortable with alternative B At the same time, I recognize that the money numbers that have just come in cause us to flinch But more importantly, I can support the asymmetry [because], although our economy is being projected as stronger now than it was in February, it still remains a very modest recovery by any [historical] comparisons and it is in my mind still a very tender recovery Therefore, I feel comfortable with the asymmetric language toward ease "
1450,1992-05-19," Mike, just to follow up on your comment on inventories You say that in the revised first-quarter numbers inventories are playing a more important role but that should not have an adverse effect going forward That is what I think I heard you saying Can you go through that again as to why we would not have some repercussions from that?   Thank you, Mr Chairman Our District economy is growing, but it's still very slow and somewhat mixed As others have mentioned here, the agriculture area is subject to some uncertainty due to the dry weather Also, in our area cattle is a very important industry and, although prices are up, there's a lot of uncertainty there With this environment of uncertainty there has been some very reduced activity in the agricultural sector; in fact our banks' loan-to-deposit ratios in that sector are at their lowest levels in some time, at just over 50 percent Manufacturing is mixed to flat, I would say In the aircraft industry there has been some slowing in shipments recently And in our auto industry, there has been activity but no real expansion in activity, with some modest gains overall in employment Our energy industry is suffering very significantly The level of drilling activity in both oil and gas is at post-World War II lows and [the outlook is] not at all good Everyone one talks with is blaming it on some of the regulatory restrictions as much as on some of the economics, so that is a very sore point in our area As to the construction side, construction activity in the residential sector has been very high but our anecdotal information now suggests it is backing off from those highs just as you hear is happening elsewhere  On the commercial real estate side, there is some increased absorption but still enough vacancies out there that we're not seeing any significant pickup in prices An important factor we've heard in very recent conversations is that in some of our areas the lease rates remain extremely low And until those pick up we don't really expect that the price levels are going to pick up at all That includes Denver, where there has been some activity; still, lease rates are very favorable, and though we have had some sales we're not seeing a real pickup in the prices or bidding to any large extent  On the national economy, our projections are very similar to those of the Greenbook There are some differences We are looking at a little weaker consumer spending and residential investment, and a little stronger government spending and stronger still business fixed investment On the inflation front, we're very much in line with the staff forecast; we may be a little more optimistic on inflation but not enough to make a real difference overall at this time Thank you "
1451,1992-05-19," Mr Chairman, I certainly would support ""B"" As far as symmetric or asymmetric, my preference would be toward asymmetric I may have heard some good things about the real economy, but I don't consider it all that much stronger than where we were some months ago when we were talking about being willing to live with money growth above the midpoint And now suddenly we're very satisfied with it being at the bottom [of the range] and are satisfied that [it will be sufficient] to carry us forward We're now relying on an accelerating velocity that we really can't predict I don't see that there is all that much strength going forward But I certainly can live with symmetric language given that we would have a consultation if there's other news coming forward "
1504,1992-08-18," Our District continues to show sluggish growth in most sectors except for real estate construction in some areas As for the farm economy, it's stable but as you've heard elsewhere prices are down and that is bringing the prospects for our ag sector toward the down side as we go forward; there may even be a decrease in [farm] income depending on what the near-term future holds Manufacturing in our District is flat The aircraft industry is feeling the effects of slumping foreign sales Our auto industry is not pushing production at all and that is showing through In energy, we have had some pickup in the rig count, but that is a very sluggish industry and we are not going to see much economic activity coming from that sector As far as the real estate area goes, our residential sector does show some strength There is a considerable amount of refinancing But we are also seeing new construction in some parts of our District, particularly in Denver where what is almost a boom situation in residential housing gives us some pause  -21-    8/18/92  I would add a couple of anecdotal points We have talked with bankers in our region and we also hear and observe that the problem is not that they are unwilling to make loans but [that there is little] demand for loans But that is a very unique situation Beyond that, though the banks will say demand [is the problem], where their [loans] have picked up or they want to add [loans], they have changed their underwriting on the margin--how many guarantees and how much collateral they require In one instance when they did that we observed that they were able to add significant amounts of loans, some of it taken from other banks who wouldn't change their underwriting I'm not talking necessarily about throwing out all caution, but just that some changes will make a difference I think banks in our region as they anticipate the need to bring their capital levels up are keeping their underwriting standards higher than they might otherwise and are trying to build those capital levels; and it is showing through in terms of the level of their lending activity  As far as the national economy goes, we have some differences with the Greenbook quarter-to-quarter, but overall our GDP projections are now similar We've adjusted ours down and we've adjusted our inflation expectations down as well I see the national economy, with the things that are going on right now, in a sluggish mode, and as I listen to comments here I think we can anticipate further sluggishness The situation does in fact suggest that perhaps we need to take a more forceful action "
1505,1992-08-18," I would be more with President Forrestal's alternative now, but I would accept your argument of holding back and thus would accept ""B"" asymmetrical "
1555,1992-10-06," Mike, I'd like to follow up on Ed Boehne's question If I understood you correctly, you were saying that within the context of having provided a fair amount of liquidity for the readjustment, you are expecting things to improve down the road next year and beyond based on where rates have already fallen But if the improvement doesn't happen, you suggested toward the end of your comments that we might have to make substantial reductions in rates to move the economy along Having said that, is your discussion about a    10/6/92  modest reduction now an insurance policy on the rates that have already come down or did I misunderstand you?   Our District continues [to expand] at a very modest pace overall and employment is up just a little over last year The agricultural sector is flat; there may be a little decline in [farm] income, even though crops are good, because prices are less robust Manufacturing is basically flat Our aircraft industry is suffering because of the reduced demand overseas Our manufacturing of autos is either flat or there is significant [unused] capacity So, there is not a lot of activity there As far as construction goes, the residential sector is still strong throughout the District and in some areas the nonresidential sector remains good In the energy sector, the movement in natural gas prices is in a sense positive I think more fundamentally than the effects of the hurricane there has been an improving trend; supplies have been brought into a little better alignment with demand so prices are increasing nationally In talking to people in that industry, though, they say if that were to continue, they wouldn't really have resources until sometime next year, so that's not an immediate pickup for our District at all  On the national scene, we have no real differences with the Greenbook We're not quite as pessimistic for the fourth quarter Fundamentally, we're looking at the negative numbers and adjusting our projections of real activity down a little Also, like the staff, we do not expect inflation to be a major problem  With regard to policy considerations, I have to admit I'm a little more ambivalent about easing than I was last time, partly because we have talked to business people, as others of you have, and they're saying that interest rates are not a problem right now We don't need it, given the other aspects of the economy and the so- called headwinds we've talked about Credit growth is a little better and I have some concerns about the foreign exchange situation But on balance I'm personally still comfortable with easing because we are looking at a continued [sluggish] and maybe even weakening economy And while I say that credit is improving, it's still weak in every way The monetary aggregates, M2 and so forth, are still weak by every definition And price inflation is not at this point a major issue; we don't see inflation picking up again given these other factors and, therefore, we have some room to ease And on the margin I feel that easing would facilitate this restructuring that is still in process, even though we don't know where the equilibrium may be We know it is in process and there are still significant adjustments that have to take place So, as I wash all this out, I have to come down on the side of some further ease   To repeat myself a little, Mr Chairman, I came in a little more ambivalent, and I think we have had a very good discussion The preponderance of views is that ease is appropriate I think now would be the time [to ease], having had the discussion, and it would be a deliberative move However, given your [explanation], I can live with ""hard asymmetric"" "
1605,1992-11-17," In terms of what Mr Gonzalez is asking for--and that is a detailed record of some kind as well as timeliness--as Jerry said, to have cameras in here or to have an immediate release of a detailed transcript or memorandum of discussion would inhibit the process under all these circumstances Going back to your issue that the public has a right to know at some point, I think we have had in the past, as I've read this material, a position that says, yes, we would be willing to accommodate them with a detailed memorandum of discussion again if we could have some assurances that there wouldn't be premature release of that material to the public through a FOI request That issue still stands and we can be consistent with protecting the deliberative process and making [a detailed transcript] available if they're willing to protect that over time And, as we apparently did in the past, we can make some compromise in terms of what others are talking about here--releasing the results in a more timely way than we do now, which is waiting until after the next meeting That may be of more value in essence to the public than having the TV cameras in here "
1606,1992-11-17," Mr Chairman, our District continues to show some modest improvement and considerably more optimism looking forward Our agricultural sector is really trading off between improvement in our livestock business and some deterioration in our grain business, so that overall we have flat prospects for that sector this year and into next year The manufacturing sector is a bit mixed Our aircraft manufacturers are still weak The auto sector is mixed because production at our GM plant is still very slow whereas Ford is going to be investing significantly in its plant in Kansas City, which I think will bring in some jobs Other than that, activity in our nondurable goods area is ""decent,"" as they say, looking forward The rise in natural gas prices has spurred drilling activity in the District; the third quarter was up over 20 percent from the second quarter, although that doesn't bring it back to anywhere near what it was a little more than a year ago But we are seeing some pretty robust [growth in] activity there right now Our construction area is still doing pretty well That is particularly so in the Denver region where economic activity is coming back rather strongly right now In fact, for the region construction activity is up fairly dramatically over a year ago, well over 10 percent Our employment levels are up over last year--our estimate is about 06 percent--and the anecdotal reports we're getting from our directors are uniformly positive in terms of their reading of the environment and their own attitudes The banking industry in our region, with a couple of notable exceptions, is really quite strong; earnings are strong across the region, and I think there's a little more of an attitude of making an effort to get into the lending business again, although [bankers] are keeping the lessons of their past experience close [to mind] Overall, I see some general improvement in our region  -11-    11/17/92  As far as the national outlook, as we look over two quarters ahead our view is very similar to the Greenbook on average although our timing is somewhat different, which I don't think is significant We're looking for inflation to be in the 3 percent range So, we are fairly comfortable with the Greenbook projections as we look at the national economy Thank you "
1607,1992-11-17," Let me talk about the short-term issues first The economy is showing strength--more strength than I saw last time-- and I think it is real There is a fair amount of liquidity in the system to accommodate future growth should that continue, so I don't  -40-    11/17/92  think we would be hurting things by staying where we are So, I am inclined towards alternative B As for asymmetry or symmetry, I'm inclined at this stage to go with symmetrical language partly because we meet again fairly soon and partly because I think the economy is fundamentally stronger Even though I recognize the downside risks from the trade situation and all these other factors that we have talked about, I think we do have a fundamentally better economy  As for the long-term ranges, I think they should be lowered, and my preference is for 2 to 6 percent [for M2] I believe that's orderly and consistent with what we may see going forward As to when to announce it, I don't have a strong preference It's something that takes explanation, though, and if we try to put it in a letter we won't have the opportunity to explain it, which is so important We need to weigh that against what may be bad timing next February But we have to do something next February, and that is the normal timing So, I guess I lean toward doing it later in the [usual] form   Yes "
