,Date,content
4032,2000-05-16,"  Mike, I'm struck by your last comment that we've perhaps tended   to do too much late in the game because we did too little in the early stages  But does doing   too little in the early stages justify in anyone's mind doing too much later?     But if we are behind the curve, do we want to overreact in an   attempt to correct that?     Right  I like that answer       Mr Chairman, the Tenth District remains generally healthy    Employment growth is still running around 2 percent and we have an unemployment rate of   about 3 percent  But I thought I would take just a minute to convey some anecdotal   information on the District, which supports what Mike Moskow said in his comments in that   to some degree it shows a change in the tone within the District     First on wages and prices, there has been a subtle move toward pressing for higher   wages and some efforts to raise prices  We met last week with both our economic advisory   council and our board of directors  Fairly generally we heard from labor, including unions,   that they are beginning to ask for a little more on the wage front, 4 to 6 percent  But also they   are focusing very heavily on the benefits side, recognizing rising health-care costs and   wanting to keep those benefits up and recognizing, too, that benefits are the nontaxable   portion of income gains  Even among the non-union groups, there is continued pressure for   wage increases and we are hearing more about that   On the pricing side, we are still hearing the story that firms cannot pass on their   higher costs through price increases, but we are hearing about more attempts to do so  In our   area of Oklahoma and of Colorado there have been attempts to move prices up, say, 4 or 5   percent  Of that, maybe 1 percent will stick; but the fact is that the 1 percent is sticking  So,   we do see that taking place  Nevertheless, we are also hearing from the same individuals that   they sense some slowing in their regional economies  The obvious case is real estate  We are   seeing a fairly significant drop in housing demand in the Lincoln, Nebraska area, for example,      62  and some slowing, though not a decline, in Kansas City  Denver remains very strong, and we   are also seeing some carryover of that strength reflected in manufacturing, especially if it is   related to the real estate sector--in home improvement, say--though theres just a hint of that   Turning to the national economy, our projection is very similar to that of the   Greenbook except for one important difference, which is that the moderation in growth in our   forecast comes with a less aggressive interest rate move  Having said that, with the   information we are getting on wage pressures, I would agree with those who suggest that we   will need to continue to move rates up somewhat  One thing I want to caution about, and I   hinted at it earlier in my question to Mike Prell, is that I think we want to be careful not to get   sweaty hands"" with respect to our policy of gradualism in moving the funds rate up  From   one point of view, we started this tightening when the funds rate was 4-3/4 percent and it is   now at 6 percent  We know that a good portion of the effects of that increase has not yet   played out  We know there are lags in policy  We know that the budget surplus is increasing,   and that has an impact that we have to keep in mind  Considering that and the lags, it seems   to me that the gradualist approach with quarter-point increases is still appropriate rather than   suddenly moving forward to a more aggressive policy  That is particularly noteworthy   because, while we may not be at the right rate yet, we started at 4-3/4 percent and are now at 6   percent, which certainly makes more sense today than it did a year ago  So, while I would   readily agree that we need to keep the pressure on the economy, I think there is something to   be said for staying with a gradualist approach  Thank you  "
4033,2000-05-16,"  Mr Chairman, everything you said convinced me that a 1/4 point   seems right  Inflation is not taking off and in fact a lot of the evidence suggests some easing off   in the expansion  Moreover, I don't think we should be validating the market necessarily  I think   we should be looking at what is in front of us, and 1/4 point with asymmetric language seems   most appropriate  A year ago when we were at 4-3/4 percent on the funds rate, there was a better   case for moving more aggressively in the sense that we had put in a lot of stimulus  And yet we   were very cautious in moving up  It seems to me that we have been on a pretty good track in our   policy actions and if I had my preference, I would stay on that track  I'll put that view on the   table for consideration  "
4080,2000-08-22,"  Thank you, Mr Chairman The overall economy for the Tenth District   remains solid; it hasnt changed a great deal from last time  However, there have been some very   slight signs of further slowing since the last meeting  In the interest-sensitive sectors, particularly   home building, there is clear evidence of some cooling  Also, manufacturing activity appears to   have slowed systematically across the District in both the durable and nondurable goods areas  And   while retail sales picked up in July, the environment in that sector is clearly softer throughout the   District than it was earlier this year     However, in the other direction, nonresidential construction remains very solid in the   District and energy activity has expanded fairly significantly as higher oil, particularly gas, prices       36  have persisted throughout the last several weeks  Labor markets remain strong in the region    Unemployment rates continue to hover around the 3 percent range  But having said that, there are   no real signs of increased wage pressures  So, the situation is fairly much the same within the   District   On the national level, my views havent changed significantly from the time of our last   meeting  The economy is carrying momentum forward, but more signs of slowing continue to come   in on the national level  And core inflation pressures obviously remain modest  Perhaps one way to   describe our projection is to say that it is very similar to that of the Greenbook except in a couple of   areas  In our analysis we dont have in mind a level of demand as strong as in the Board staffs   projection  Our forecast of productivity gains is a bit less aggressive and that outcome assumes less   aggressive interest rate increases over the period  So, going forward, we see some modest slowing   in the economy and continued modest pressures on inflation  Thank you  "
4081,2000-08-22,"  Mr Chairman, I support your recommendation  I would say that policy   right now is tight and the issue is whether it ought to be tighter We certainly can wait to see whether   that is the case  One comment on the bias  As a suggestion, I wonder if we should not consider          78   taking out the lone reference to tight labor markets as the reason for our bias  I don't know that there   is a one-to-one mapping into inflation over the time horizon we have been talking about  Given your   comments, as well as those of others here today, it seems to me that we see other risks that are just as   important right now in leading us to this bias  I think they also ought to be considered, or certainly   that tight labor markets should not be given more consideration in our statement than these other   risks     In my view it is something we ought to consider as we go forward  "
4127,2000-10-03,"  Dave, let me ask you a question  In reading the Greenbook and your   projections, I know you havent changed your forecast much from the last time  We need to adjust   for energy, I understand  But in listening to you I sensed a little more of an acknowledgement of   some downside risks in the economy emerging in manufacturing and elsewhere  Is that a fair      34  description of the tone that I heard this morning--that there is a sense of greater downside risks than   you felt before, even though the projections themselves are pretty much unchanged?     Thank you     Thank you, Mr Chairman  The Tenth District as a region is continuing to   do very well in terms of economic activity, but it is apparent to us that growth is slowing  While   overall employment growth in the District is about the same as in the nation, private employment   growth is about  percentage point slower overall  Nonresidential construction reflects the softer   conditions in our area  The value of District nonresidential construction has fallen in three of the last   four months and remains significantly below previous peaks in the region  Homebuilding also has   slowed--not as dramatically perhaps, but its still a couple of percentage points below year-ago      56  levels  Manufacturing activity in the District also has moderated  Manufacturing jobs actually fell   about 03 percent in August and are down about 06 percent from a year ago  So, we have seen some   slowing there, in part due to higher fuel costs and so forth   Of course, the area in our District that is suddenly doing well relates to the oil and gas   industries, especially natural gas  Like Texas, we produce a lot of natural gas  Our rig count is up   about 125 percent and employment in that sector is up rather significantly as well  So we do have   activity starting to pick up now as people are becoming more confident that higher oil prices are   going to last for a while and are therefore willing to bring some activity back into play     Retail sales generally have been steady and actually have been fairly strong in the Denver   area, as has the whole economy in that region  But, overall, with some slowing we have seen a little   loosening of labor market conditions  The unemployment rate remains about the same or a bit   higher in different areas of the region as well  Price pressures have also remained steady, despite the   fact that some raw materials costs, of course, are going up and have to be dealt with by the   manufacturing companies  We havent seen those higher costs come through at all at the retail level;   weve actually heard some talk of easing price pressures there     Our agricultural sector is still seeing very weak prices  That industry is very much   dependent upon government payments and will continue to be so through next year at least, based on   the bumper production we see in our region  So we have a strong economy but with some slowing   apparent   At the national level, incoming data have done little to change my outlook on the   economy  From the information I have heard here and our own analysis I would say that growth of   economic activity is in a longer-term slowing phase  Since the beginning of the year, I think the flat   stock market, the higher energy costs in play, and the tighter monetary policy have cooled off      57  consumer spending  And while investment spending remains very good, our projection is that its   growth will be down from the earlier high level, and I think that will play a role as well  As   compared to the Greenbook forecast, our projection is for a stepping down of GDP growth toward   the 3-1/2 percent area  We also see that occurring without further increases in the fed funds rate   from its level today  The risks, of course, are related to energy, which weve talked about  And, yes,   energy costs could push overall prices up and that could actually slow the economy  The situation   could be complicated if personal income levels fall and the debt burdens in our economy have to be   dealt with  So, those are the downside risks     In essence, while I wouldnt fall on my sword on this, Mr Chairman, I think the risks are   more balanced than they have been  I would feel comfortable saying that with a balanced risk   statement, even with these economic projections, because I think the higher rates are still in play    We have seen a slowing expansion and I think that is continuing, which gives us a picture of an   economy with more balanced risks in the future  Thank you  "
4128,2000-10-03,"  I can accept your recommendation, Mr Chairman, although I think we   could go to a more balanced stance  But we can wait  "
4176,2000-11-15,"  Thank you, Mr Chairman  Let me spend a little time on   developments in our District  Growth across the Tenth District continues to moderate and some   of the slowing appears to be the result of labor supply constraints  But there is also evidence that   the pace of demand is slowing  Moreover, in talking with business leaders throughout our   District at least, I've noticed a shift in sentiment about future activity  There is increasing   concern about the possibility of a more significant slowdown coming  Having said that, private   employment growth remains close to the national average in most District states  Colorados   private employment growth, while still the highest in the District, has fallen considerably--from               29      about a 4-1/2 percent rate in mid-1999 to 2-1/2 percent now--and growth there clearly exceeds   that in the rest of the District   Manufacturing activity was flat in October in our District, although capacity   utilization remained relatively high  Looking forward, District manufacturers have been   lowering their expectations  A manufacturing survey revealed the second consecutive downward   revision in capital spending plans  This obviously raises some questions as to whether   productivity gains will be sustained in that environment  It may also help to explain the shift in   sentiment I mentioned a little earlier   Residential construction activity continues to cool in the District  Excluding   Colorado, single-family housing permits have fallen for four consecutive quarters, leaving the   level down about 20 percent since the fourth quarter of 1998  Indicative of the slowdown, our   business contacts in Kansas City report that start times on housing have now declined from about   90 days to around 15 days  In contrast, though, single-family permits in Colorado are up about   10 percent and median prices in that area are up about 15 percent year over year  Nonresidential   construction activity has fallen even more sharply in most of our District  For example, in the   third quarter the value of nonresidential construction was down about a third everywhere in the   District but in Colorado, where it was down about 10 percent   Energy activity, in contrast, continues of course to benefit from the higher energy   prices  District counts of active oil and gas rigs have increased for about eight months in a row   and are now the highest since December 1993  Drilling contractors have accumulated a sizable   backlog of job commitments, but growth is constrained by a lack of skilled workers in that               30      industry  Many have left the oil industry and it is hard to get them to come back at the wage   levels that are now prevailing   Labor markets overall have remained tight, but with very little change in wage   pressures that weve noticed  The District's unemployment rate was about 32 percent in   September, below the national average  Intel, for example, attributed a delay of several months   in opening a new computer chip fabrication plant in Colorado Springs, originally scheduled for   November, to difficulties in hiring--especially construction workers   Manufacturers are seeing higher input prices but they are not able to pass those costs   through in prices  And our farm economy continues to see little change  Cotton crop production   was very strong and, therefore, we continue to see obvious downward pressure on prices   Let me turn to the national economy  The incoming data confirm, as Dave already   noted in his briefing, an ongoing process of moderation in the economic expansion  The lower   rate of GDP growth in the third quarter helps to confirm that slowing  I realize the key question   is, of course, whether the third-quarter results represent a respite or a new trend  To be sure, the   third-quarter growth in consumption expenditures at an annual rate of better than 4 percent is   unlikely to be sustained, but early indications for the fourth quarter suggest that consumers are   following the rest of the economy toward a more moderate pace  And I think that's significant   Nevertheless, I remain satisfied with the outlook for economic activity  I expect the   economy to grow near its sustainable rate, along the lines described by the staff in its projection    Despite a pickup in compensation costs and the acceleration in overall inflation this year, the   underlying inflation rate remains relatively modest in my opinion  On balance, the unwinding of               31      the effects of higher energy prices in conjunction with the 6-1/2 percent fed funds rate should   place some downward pressure on underlying inflation over the forecast horizon   Let me note quickly, though, the risks in the outlook  While inflation risks are still   real, they have moderated to some degree for the reasons Ive just described  In contrast--and I   think this is consistent with what the staff said in its briefing today--my view is that the downside   risks to economic activity have increased somewhat  I believe that growth slowing to trend is the   most likely outcome  But I also believe there are greater downside risks stemming from recent   developments, and Id like to tick off some that I would highlight  First, financial conditions   have tightened and the downturn in economic activity has softened corporate balance sheets    Also, we have the higher interest rate spreads that we've talked about today, tighter lending terms   and standards, lower equity prices, an increase in the cost of capital to some degree, and   increased aversion to the risks of more speculative investments  Junk bond default rates are up,   rating downgrades are more prevalent, and profits are lower  Debt as a share of net worth has   been rising more quickly in 2000, after leveling off in prior years, and debt service costs are   increasing   These are factors that are on the horizon and they are affecting the balance of risks   with which we need to deal  And while none of these developments means that growth will   decelerate beyond our expectations, I think we are in a more risky period in terms of our   economic projections and the outlook  Thank you, Mr Chairman  "
4177,2000-11-15,"  Don, my question is similar to Governor Meyers  It strikes   me that how you view the risk statement depends on how you view monetary policy right   now  And this is what I think you were just saying  Suppose you view monetary policy   right now as tight--that is, the funds rate is above the natural rate, whatever term you   want to use--and the economy is slowing  If we still have the risk of inflation but we   have a tight policy, which is addressing that, and now we see a slowing, that means the   downside risks are increasing  We might then want a balanced risk statement because we   have a tight policy to address the one concern and the economy is heading in this other   direction  So, how one views the appropriateness of the risk statement depends on how   one judges the tightness of current monetary policy     Mr Chairman, I too would prefer a balanced risks statement,   and my reasons are perhaps similar to Bill Pooles  I think we do have upside risks for   inflation, which we are addressing  That's why we have a fed funds rate at the level it is   now, which I believe indicates a fairly tight policy  And I think by holding that position   we have introduced new risks that bring the position more in balance in terms of the   outlook  In my view what is happening with your additional statement is that we've come   full circle  We're now finding ways to compromise on the risks statement; we are   neutering its role and putting more emphasis on the rest of the press release  That may in   fact be the option we end up with, which better describes the views of this Committee in   terms of the risks that have now been introduced and the policy actions that might be   taken in the future  But by having these two different statements, I think we are   introducing a new potential for confusion in the marketplace as well  So I would go for a   balanced statement now in the press release, but well see how this works  "
