,Date,content
9241,2011-06-21,"  To start, I would like to thank Mike and all of the System staff who   worked on this project, which has been going on for quite some time  I think this work illustrates   June 21–22, 2011 15 of 282              some of the valuable synergies between policy analysis and academic research  I especially   applaud the approach of comparing and contrasting alternative models, which illustrates the   tough modeling choices and tradeoffs that all researchers face when developing models for   policy analysis, and I think, more importantly, provides different perspectives on the economy   and policy   I have two questions for Mike  First, what do you see to be the key advantages or   insights of the DSGE models over, say, FRB/US in thinking about the current situation and the   appropriate stance of policy today?  And my closely-related second question is, what do these   models tell us about the impact of the events of the past three years on potential output—or, in   the parlance of DSGE models, the natural rate of output—and the output gap?   One purported advantage of DSGE models is they provide a theoretical basis for   distinguishing between shocks to supply and demand  Indeed, in many DSGE models, supply   shocks—that’s shocks to preferences and technology—account for a significant share of   economic fluctuations  This distinction between supply and demand shocks is a critical issue for   monetary policy because policy should respond differently, depending on the nature of the   shock  I am particularly curious about the New York Fed’s model, which shows very persistent   effects of the financial crisis on output  In the New York Fed model, does this primarily reflect a   decline in potential output or a very persistent output gap?    Thank you, Mr Chairman  I’m comfortable with this approach  I   actually think it does represent what I heard to be the consensus at the April meeting  I am   sympathetic to the point that Presidents Rosengren and Fisher brought up about being somewhat   uncomfortable with the very specific timing, and I think it’s probably better to stick with the   general principles of the sequencing, and I would agree with removing “probably within a few   months” and the other case where we’re being very specific on timing  I agree with the general   idea of how the sequencing should go, but I will mention just one comment  I think you and we   all will be asked for the rationale behind this particular sequencing of steps  So here we are   agreeing on what the sequence is, but I know that we all will be asked by reporters why we chose   one instead of another, and I think we should have some more discussion, perhaps, about that    I’ll give you one example  This may seem to be a no-brainer to some—maybe I’m just   overthinking this or just not thinking hard enough about this, but I’m still not 100 percent clear   on why reinvestments is the obvious first action out of the blocks  Maybe if we have time at   some point, we could have a discussion about not only what the right sequence is, but also what   the talking points are regarding why this makes the most sense    Thank you, Mr Chairman  The intermeeting data have been   worrisome  The extent of the bad news is starkly evident in the Tealbook projection, which   shows a steep downward revision to growth this year and next—a remarkably large revision for   just two months  Furthermore, despite the deep cuts to the output projection, the Tealbook has   also shifted to a downside skew to the risks of the growth outlook  This combination of a   downward modal revision to the growth forecast and downside risk assessment is a truly   sobering development, but it’s consistent with what we see in financial markets, such as lower   Treasury yields, the faltering stock market, and the rise in high-yield bond spreads since our last   meeting  The key question for the outlook for both output and inflation is how much of the   recent news is transitory and how much reflects more lasting influences, clearly what a number   of you have already been referring to  Now, I agree that many transitory factors have been   working to push down output during the first half of this year  These include unseasonably cold   and snowy winter weather, Japan-related supply disruptions, and the spike in energy costs,   June 21–22, 2011 127 of 282              especially the $4 per gallon gasoline, which I think we still have in California even today    Indeed, my business contacts trace much of the source of the first-half moderation in consumer   spending to this spike in energy prices  They refer to both the direct hit to disposable income,   but also the psychological punch to confidence that staggered consumers  In this regard, the   substantial decline in oil prices and now, more recently, gas prices since our April meeting   should help   I remain stubbornly confident that the economy will bounce back from its recent   stumbles  The recovery appears intact, though with significantly less underlying momentum   than I had previously thought  Like the Tealbook, I expect economic growth to pick up in the   third quarter of this year and to average about 3½ percent over the second half of this year and   next year  With this return to above-trend growth, I expect to see renewed improvement in labor   market conditions   My business contacts provide two notes of optimism  First, my contact at a major   Japanese auto maker reports that the Japanese auto industry is returning output to pre-crisis   levels more quickly than initially estimated  Some plants are already operating at 90 percent of   pre-crisis levels, and they’re expected to be at full capacity shortly  Second, my contacts are   quite enthusiastic about the economic boom developing in Silicon Valley  To give just one   indicator, home prices in the Palo Alto–Cupertino area are up double digits from a year ago    New IPOs for private-share sales for LinkedIn, Facebook, Twitter, and other social media   companies are providing a shower of cash  But we’re nowhere near the craziness of the dotcom   era of the 1990s—well, at least not yet  My contacts stress several important differences   between the current episode and the dotcom bubble  First, any bubble-like exuberance is limited   to a relatively small set of companies, and even these generally have solid customer bases,   June 21–22, 2011 128 of 282              revenues, and in some cases, even profits  For example, Facebook, with reportedly well over   600 million users worldwide, is no Petscom  Furthermore, the broader tech sector, including,   for example, Cisco and Intel, has matured considerably over the past decade  Some of the most   actively traded tech stocks have valuations that seem reasonable, certainly by comparison with   the levels of the dotcom era  Finally, my contacts describe a very different financing   environment  The amount of venture capital in play is on par with its pre-crisis level, well below   the dotcom surge, and a healthy dose of investor skepticism is evident  Importantly, from a   policy perspective, I hear of no indication that near-zero interest rates are fueling the bubble in   the venture capital sector   Turning to inflation—and I guess this is my defense of core inflation—the story in the   first half of this year was a sizable bump-up in headline inflation, and the second-half story may   well be falling oil prices and an undershooting of headline inflation  These extreme movements   in oil prices over the past few years reflect the underlying economics of inelastic short-run   supply and demand in this market  Such idiosyncratic volatility is a reason energy prices are   typically stripped out to formulate measures of underlying inflation  Indeed, research shows that   including the measure of underlying inflation in forecasting models helps in forecasting headline   inflation, and this result holds across a variety of samples and specifications  Various   alternatives measures of underlying inflation all perform about equally well  The simplest of   these—that’s the ex food and energy core—I find to be a useful series to keep an eye on  It’s   also completely consistent with how we treat a variety of macroeconomic series  We look at   core capital goods, which exclude the volatile aircraft and defense categories, and core retail   sales numbers  Of course, I’m not—and I don’t think anyone is—arguing that core inflation   June 21–22, 2011 129 of 282              should be the goal for policy  It’s simply that core inflation has proven useful in forecasting   overall inflation and provides a straightforward summary statistic for underlying inflation   Let me turn to how I’m interpreting recent inflation numbers  Despite the dramatic fall in   oil prices since our last meeting, I’m actually a bit more worried about the outlook for inflation,   much along the lines of President Pianalto, and that’s because of the somewhat firmer readings   we have gotten on core inflation in recent months  It appears that there has been somewhat more   pass-through of import and commodity prices into the core measures than we anticipated, and   similar to the report from President Lockhart, my contacts have repeatedly stressed the pressures   they are facing from higher raw materials costs, energy and transportation costs, and price   increases from China  Still, they see recent price increases as a result of a confluence of a   number of factors that are raising the level of prices rather than indications of a much higher   inflation trend  This view is consistent with market-based measures of inflation expectations   having retraced their increases from earlier this year  Therefore, looking ahead to next year, I   see both headline and core inflation settling in at around 1½ percent   In sum, looking through the temporary factors affecting output and inflation, I expect the   recovery to continue, albeit at a more muted pace, and inflation to return to levels below my   preferred long-run goal of 2 percent  Thank you    Thank you, Mr Chairman  I favor alternative B  We are   experiencing what looks to be a transitory slowdown in growth, and a transitory bulge in   inflation  If I am still allowed to use this word, “underlying” inflation remains moderate, and the   recovery should gain strength over time  Given the sizable slack and the expected decline in   inflation, the current very accommodative stance of monetary policy remains entirely   appropriate  Indeed, I would like to echo President Rosengren’s comments  I worry that 2011   could become a replay of 2010, and we should be thinking ahead to what we would do if the   economy stagnates and the risk of sustained deflation reemerges   June 21–22, 2011 174 of 282              Finally, I have a comment on the wording of the statement  In paragraph 3 of alternative   B, I’m a little uneasy with the addition of the phrase, “The Committee decided today to maintain   the current degree of monetary policy accommodation,” which to me is vague and perhaps   misleading  The special box in Tealbook Book B makes clear that the degree of monetary   accommodation—and I am thinking in terms of stimulus—from our large-scale asset purchases   is actually declining by the equivalent of about a 25 basis point hike in the funds rate every other   quarter, according to our back-of-the-envelope calculations  This occurs in the Tealbook   because the date of the expected future normalization of the balance sheet is drawing near  I   prefer a simpler way to describe policy  I would delete the phrase about monetary   accommodation  Instead, my suggestion is to begin paragraph 3 with “To promote the ongoing   economic recovery and to help ensure that inflation, over time, is at levels consistent with its   mandate, the Committee will keep the range for the federal funds rate at 0 to ¼ percent”  And   then, “It continues to anticipate that economic conditions,” et cetera  I think this is clearer and,   in fact, in a technical sense, more accurate  Thank you    I intended for it to be “The Committee decided today to keep”    I want to add my thanks to the members of the subcommittee for their   work on external communications  I agree they managed to strike a reasonable balance between   the various aims of our external communication  These are difficult issues  I’m going to pick up   on the staff issue, and I appreciate, Governor Yellen, this idea of getting feedback and seeing   how this actually works  I’m going to mention one potential challenge and, I hope, a   constructive idea about how research can be done within the confines of this rule  The   guidelines—and this is a separate issue than President Bullard mentioned—restrict staff   economists from communicating with outside researchers, including academics, about any   analysis, methods, or models currently in use but not available to the public  Now, having been a   June 21–22, 2011 208 of 282              staff economist in the Fed System for 16 years, I can personally attest to the value of such   consultations with outside scholars  Outside experts challenge our assumptions, they challenge   our methods, and they provide a check on group-think  To take one example, the FRB/US   model, which I worked on for many years, benefited from the critical scrutiny and suggestions   that we received from outside experts  Even models regularly in use need further, even continual   refinement, and the same applies to models used for forecasting and the DSGE models we talked   about yesterday   I understand the concerns that led to the new restrictions on the staff interactions with   outside experts, but given that these interactions improve the quality of staff analysis and,   importantly, ultimately improve our policy decisions, we need to ensure that the staff continues   to receive ongoing feedback from outside experts within the confines of the new rules  Indeed,   staff may need more public outlets for current analysis, such as economic letters and blogs, so   that they are free to discuss their methods with outside experts  These public outlets and the   dialogue with outside experts that they foster contribute to greater transparency and   accountability for staff research and analysis  I’m speaking from our experience in San   Francisco with our Economic Letters, and our FedViews—but many of the Federal Reserve   Banks have done the same thing  Putting our current analysis and our policy-oriented or current   research out publicly frees you up to talk to any outside experts about the models you’re using   and the results you’ve got, and it allows you to have those very fruitful conversations  But if you   don’t have those outlets available—and I’m not thinking about academic research right now—  then you couldn’t talk to the outside experts about what you are using in your policy analysis    Thank you   June 21–22, 2011 209 of 282               We are in complete agreement  My point was, to the extent that parts   of the Federal Reserve System don’t have outlets for your thinking on current analysis,   modeling, and research, then it is going to be a clampdown on the ability to talk to outside   June 21–22, 2011 210 of 282              experts  In some sense, I think we should have more transparency about what we’re doing, and   we should make it publicly available like we’ve done in San Francisco and like many other   Banks have done for a long time  That way I can go talk, for example, to Jim Stock about the   inflation model that I’ve been working on because my model is out there in the public and   widely available  I think we’re agreeing, but I don’t think the Board, for example, just to be   specific, has an economic letter or something like that  "
9265,2011-08-01,"  Thank you, Mr Chairman  I view all 10 proposed actions as being   entirely consistent with the Federal Reserve’s role of lender of last resort in response to market   dysfunction resulting from a failure to raise the debt ceiling   In particular, I view actions 1 through 5 as consistent with our past practice and good   policy  Indeed, in such circumstances, communication of this “business as usual” approach, as in   the draft statement, would send an important message that might reduce uncertainty and help   calm markets  In principle, I would also support actions 6 through 10 in the event these market   segments showed signs of serious impairment  Indeed, it would be useful for us to begin   discussions regarding the appropriate thresholds for taking these actions  Specifically, under   what conditions would we implement action 7, “RPs to Address Pressures in the Treasury Repo   Market”?  My question is, would it depend on signs of spillovers from the repo market to other   markets, such as commercial paper, or obvious signs of a drying-up of liquidity in the repo   market?   I think it’s very important—and I’m going to echo here some comments by President   Kocherlakota—that we clearly distinguish in our public communications between these lender-  of-last-resort policies aimed at providing liquidity and monetary policy aimed directly at   macroeconomic conditions  To sharpen this distinction, I prefer action 10 over action 9—that is,   purchases of defaulted securities should be matched with sales of otherwise similar nondefaulted   August 1, 2011 26 of 53              securities so that these actions are neutral with respect to our balance sheet, and we should   explain clearly that the enactment of any of these programs will not interfere with our pursuit of   our mandated goals of price stability and maximum employment  That is, even if we see a large   increase in our balance sheet through these programs, we have the tools to add or remove   monetary accommodation as needed   Finally, by transacting Treasury securities at market prices, I think that will protect us   from the charge that we’re propping up the fiscal authority through our actions  Thank you  "
9290,2011-08-09,"  Thank you, Mr Chairman  The deterioration in the economic outlook   has been dramatic and equally disturbing  Early this year, the economy downshifted to a rate of   expansion that fell well short of the growth rate of potential output, which we’d traditionally call   a growth recession  Some of this weakness reflected transitory factors, and economic growth   should pick up modestly in the second half of the year  But even with that improvement, the   pace of recovery will be insufficient to make meaningful progress on unemployment until next   year  Moreover, I see significant downside risks to the forecast  Anemic growth and high   unemployment leave the economy especially vulnerable to further adverse shocks and a double   dip  The debt crisis in Europe provides one example of such a shock  Concerns regarding the   recovery’s vulnerability have been a major reason for the recent volatility in financial markets,   August 9, 2011 65 of 162              and I’m especially worried about the fragile confidence of households and businesses, which   likely took another big hit with the stock market downturn  Perhaps more worrisome is that the   self-correcting process, key to past recoveries, appears to be largely AWOL this time around    Despite our efforts to account for the effects of fallout from the financial crisis, we have   consistently been too optimistic about the pace of improvement in the economy  I have become   increasingly concerned that we may not have managed to avoid a Reinhart–Rogoff pattern of   weak and prolonged recoveries that have followed past financial crises  Perhaps this time is not   so different after all   The extent to which persistent headwinds are hindering the recovery can be quantified in   terms of the medium-term equilibrium real interest rate  In my comments, I will refer to a   particular model that I developed with Thomas Laubach some years ago  In this model, the   equilibrium real interest rate equates supply and demand over the medium term of several years    It changes in response to highly persistent shifts in aggregate supply and demand  A decline in   the equilibrium real interest rate would imply a negative shock to demand relative to supply  I   think this measure gets at the issue of supply versus demand shocks or persistent ones  Since the   outset of the recession, the estimated medium-term equilibrium real funds rate has fallen from   24 percent to nearly zero today  And for comparison, before the current episode, the lowest   reading that we had on our estimate was 18 percent during the headwinds period of the early   1990s  Other measures of the equilibrium real interest rate that we look at, as well as those that   are reported in the Tealbook, Book B, have also declined considerably over the past few years   I am also increasingly concerned that the sluggish pace of growth may permanently scar   the economy  The magnitude and duration of this downturn will mean that the millions of long-  term unemployed are seeing their human capital deteriorate or actually be destroyed, along the   August 9, 2011 66 of 162              lines of the comments of President Kocherlakota  I found the alternative scenario “More-  Persistent Spending Weakness with Supply-Side Corrosion” to be a very real risk, although not   quite yet my modal forecast    Turning to inflation, with oil and some other commodity prices having declined sharply   from earlier peaks, headline inflation is moderating  Core inflation also rose noticeably this year,   albeit from a very uncomfortably low level  Some of the rise in core inflation reflects temporary   factors that, as mentioned in the Tealbook, should fade in coming quarters  For example, our   staff has looked at the issue of pass-through of import prices, and we find that pass-through of   higher import prices likely contributed about 03 percentage point at an annual rate to core   inflation in the first half of the year  With non-oil import price inflation moderating, the impulse   to higher core inflation should also diminish in coming quarters  Indeed, my business contacts   tell me that the pass-through of higher import prices to consumer prices either has already   occurred or will be completed soon   In sum, I expect the recovery to continue, but at a frustratingly slow pace that leaves the   unemployment rate elevated for many years  I expect inflation in coming quarters to return to   levels of around 1½ percent, below my preferred long-run goal of 2 percent  Unfortunately, I   don’t see light at the end of the tunnel  The staff’s long-term projection sees us falling short on   both of our mandates through the end of 2015, the final year reported in the table  Apparently   the long run is just not long enough to reach our goals, at least without additional monetary   support  But that’s a topic I’ll leave for my comments later  Thank you    Okay  Thank you, Mr Chairman  I support alternative A  And given   the significant downgrade to the outlook for output and unemployment, and the heightened risks   to the recovery, I think an additional accommodation is needed for the very reasons that you said    In this regard, I, too, very much appreciate the very helpful staff memos on possible policy   actions for providing additional monetary accommodation  In following Governor Tarullo, I   have been changing my comments very much in real time, so let’s see if I’ve kept up with   everything  I support incorporating the more explicit forward-looking policy guidance as you   suggested  This step is a small one  It may help markets better understand our policy framework   and our intentions, and it may reduce uncertainty  But as Brian pointed out earlier, if you look in   the modal forecast, markets don’t expect us to raise rates until sometime in 2014, I think  And of   course, this is a conditional commitment, as the proposed language makes clear  But I don’t   think that’s actually enough  Based on what’s going on in the economy and the forecast for   inflation, I think we do need to go further, and I support extending the maturity of our Treasury   holdings as described in paragraph 4 of alternative A  Research by my colleague Eric Swanson   on Operation Twist shows that that policy indeed did reduce longer-term interest rates  His   findings are completely consistent with the research that was done on the effects of the first stage   August 9, 2011 114 of 162              of the LSAP program in the current episode  So I think that it’s a small step  I know it’s not a   panacea, but I do think it’s a step that would help, and it would have relatively small downside   risks  I also think we should be thinking about all the other options, and I agree with the idea of   a two-day meeting in September  I think one option that I am also in favor of is lowering the   target fed funds rate and IOER to zero, but I know that’s an issue that’s more complex  We’ll   have a good discussion of that at the next meeting  I also prefer, by the way, when I said   alternative A, the language regarding the downside that I think President Evans also   mentioned—“Moreover, downside risks to the economic outlook have increased”—which was in   paragraph 2  I think that’s actually an important piece of the language that’s missing in   alternative B  "
