,Date,content
151,1976-08-17,"  Yes  Is there any steam left in the consumer?  The inflation rate’s gone  down the last three quarters, particularly the unanticipated or surprise inflation rate, which     8/17/76 - 17 -    should contribute to a decline in the personal saving rate  And also we know that consumer  sentiment seems to be up  Do you see further steam left in the consumer part of the recovery?    Yes, we would support alternative B  We’d like to see an expansion in  the band of the federal funds rate, may be out to 1-1/2 percentage points  And I would certainly  support Governor Coldwell’s [recommendation of] taking a close look at the reduction in the  reserve requirements with respect to the membership policy  "
237,1976-11-16,"  As we see the same softness in retail sales, we have one unique feature  in California; we have experienced a drought, at least until the last weekend or so  We have  [had] summer continuously through November, and this is resulting in [unsold] goods that would  normally be sold as weather changes in the fall    We see the same softness that the others see in retail sales  One unique  feature in California has been the weather--we have been experiencing a drought  We’ve had  summer weather practically through the present time except until the last weekend  Several of  the retail stores have mentioned [that] they have stocked goods for fall and winter that are not  moving at all  One other feature that one of our directors mentioned, which is a very good short- term indicator--corrugated containers and envelope stocks have dropped rather precipitously in  the last 35 days, and this is usually a good indicator of business conditions  This has really  changed in the last month    This would be the orders that they are receiving from buyers    We would favor a 1/2 percentage point reduction in the discount rate   This could probably be done in two steps of 1/4 each  We think this would give a better  alignment with the federal funds rate, and it would also give a lift to business expectations  We  would also support a slight easing of policy  We think that this can be done under the  established or the existing ranges rather than changing the ranges  We would favor alternative B,  although we could support alternative B as modified by Chairman Burns  "
732,1978-04-18,"  Our directors would agree with Mark Willes and Phil Jackson in that they  are very concerned about inflation  They are very concerned about the large government deficit  and the lack of concern of some in Washington about this deficit  Also, our staff would agree with  Henry that the March 62 percent unemployment rate places us within the zone of a fully employed  labor force, which I think is a little bit different from the staff [view]  I also want to ask a question  about the unprecedented growth of consumer debt and whether this will have a dampening effect  on consumer spending over the next few months      Thank you      Yes, we would advocate staying with the current ranges      I don’t think there is any big advantage one way or the other  However,  monetary policy is a consensus of the Federal Open Market Committee and, therefore, we would  urge the consensus view--provided you use the name Balles rather than Williams if they ask you  the name!      I have a feeling that I may be getting in over my head, but we voted today  to maintain the same long-run target ranges  M1 and M2 have been within those long-run targets  and, therefore, I have trouble figuring out why we don’t set the same short-run targets that we have  for the long-run targets       4/18/78             45    No    "
1111,1979-06-27, We would agree with Frank Moms’s position that there’s a fair  case for suggesting that we should [orient] our policy on the side of ease We would [build on  the action] that we took at the last FOMC meeting  
1158,1979-07-17," Yes, Mr Chairman With respect to reactions to the President's speech, I would agree with what Ernie Baughman has just said With respect to monetary policy, we would agree very strongly with Frank Morris and Bob Black that we ought to stand pat at the present time We would suggest that if there is a move for raising [interest rates] that the discount rate be raised before the fed funds rate [because] it's 75 to 80 points below the funds rate and raising the discount rate would have the announcement effect without tightening the financial markets [unintelligible] "
1180,1979-07-19," Yes, I would agree with Tom Gainor that for all the reasons stated we should go to 10-1/2 percent on fed funds and move the discount rate up to 10 or 10-1/4 percent "
1295,1979-10-22, We would certainly agree with the Chairman’s  recommendations Dave Eastburn clearly set forth our views and we  would support everything Dave said We would also agree with Larry  Roos about the announcement of targets  
7000,2002-01-29,"  Under the Taylor rule, policymakers would need to weigh the  deterioration in economic performance associated with the zero bound against the  benefits of lower inflation in establishing an overall price objective  And to be sure,  not all of those benefits are captured by the model  The existence of a tradeoff raises  the question of whether there are other ways to design policy so as to mitigate the  effects of the zero bound in a low inflation environment  That is the subject of your  next exhibit   According to previous research, policies that are more responsive to fluctuations  in output than the Taylor rule do a better job of stabilizing the economy; modestly  increasing the responsiveness of the funds rate to deviations in inflation from its  target also appears beneficial  There are two aspects to this advantage  First, such  rules reduce the probability that inflation will be well below its target if and when a  major disturbance hits the economy, and thus they essentially take away one of the  ingredients of a deflationary spiral  A second advantage of such rules is that they  reduce the funds rate quickly when the economy weakens, thereby limiting the  severity of major downturns, again reducing the risk of deflation   The middle table puts some numerical magnitudes on these advantages  For this  exercise, we assume that the more responsive rule reacts twice as strongly to  movements in the output gap as the standard Taylor rule but is the same in its other  dimensions  As can be seen by comparing lines 1 and 2, the more responsive rule  damps fluctuations in unemployment relative to the Taylor rule  And as shown on  lines 3 and 4, the more responsive rule is also more effective at keeping the economy  out of deep recessions In fact, the more responsive rule under a zero inflation target  is able to match or better the performance of the Taylor rule using a higher inflation  target However, as was the case with the Taylor rule, performance under the more  responsive rule drops off noticeably when the target is reduced below 2 percent but  improves little when the target is increased to 4 percent   As noted in the bottom panel, adopting more responsive rules—especially ones  with even greater sensitivity to economic conditions than the rule analyzed here—  brings some potential disadvantages as well  First, the greater responsiveness of  policy to changes in economic conditions implies heightened variability of the fed  funds rate and more frequent policy reversals  Although these differences have no  direct implications for economic performance in the FRB/US analysis, they may be a  cause of concern for reasons not captured by our model  Second, implementing a  more aggressive response to the estimated output gap amplifies the risk and  magnitude of policy mistakes owing to faulty data and mismeasurement of the  economy’s productive capacity  Lastly, because more aggressive rules drive the fed  funds rate quickly to zero when the economy weakens and rates are already low, they  increase the risk of triggering a confidence crisis if investors become unnerved                    January 29-30, 2002 Page 15 of 194  whenever the Fed has no more latitude for moving the fed funds rate down further   However, such possible effects on confidence play no role in the FRB/US model    For these reasons, the FOMC might want to consider policies that become more  responsive only when it is in imminent danger of hitting the zero bound  Such  asymmetric responsiveness is the subject of your next exhibit  As described in the  upper panel, to illustrate this idea we consider a policy that under most conditions  follows the standard Taylor rule but that lowers the fed funds rate more quickly when  economic conditions are sufficiently bleak  In particular, we assume that whenever  the standard Taylor rule would prescribe a funds rate below 1 percent, the funds rate  is automatically set to zero  Such a policy has the advantage shared by generally  more responsive rules of quickly bringing to bear the maximum monetary stimulus  possible to offset economic downturns or deflation, thus enhancing average economic  performance  At the same time, the cost of higher interest rate variability and the risk  of policy mistakes are lessened because the greater responsiveness of policy is limited  to episodes of economic distress   The middle table compares economic performance under the asymmetric policy to  that obtained with the Taylor rule  With an inflation target of 4 percent, the Taylor  rule only occasionally prescribes a funds rate below 1 percent, so the overall  performance of the two policies differs little  But with a lower inflation target, the  asymmetric policy mitigates the falloff in performance resulting from the zero bound  without significantly raising the overall variability of the fed funds rate  As shown in  lines 1 and 2, under the asymmetric rule the increase in the variability of the  unemployment rate is less when the inflation target is lowered from 2 percent to zero;  lines 3 and 4 show a similar result for the frequency of deep recessions   As noted in the bottom panel, one possible drawback of the asymmetric rule is  that it may be less transparent  In particular, communicating the nature of such a  policy to investors may be difficult, and the market may have trouble understanding  its full ramifications  This is because an asymmetric policy, unlike the Taylor rule or  similar strategies, does not always respond to economic conditions in the same  manner  Thus, the private sector might mistakenly interpret a sudden drop in the fed  funds rate as a temporary aberration rather than a systematic aspect of the rule  This  transparency problem could prevent the rule’s benefits from materializing if investors  do not correctly incorporate the implications of asymmetric behavior into their  expectations, in particular by pricing into bond yields the greater probability of a zero  funds rate during economic slowdowns   Your next exhibit considers another strategy for mitigating the effects of the zero  bound This approach, unlike the strategies that we have discussed so far, responds  not only to current inflation but also takes into account past deviations of inflation  from target  A key feature of such a strategy is that it involves a promise to keep the  funds rate unusually low following an episode in which the zero bound constrains  policy One specific example of this approach is price-level targeting, in which  policy is set so that the price level rather than the inflation rate fluctuates around a                         January 29-30, 2002 Page 16 of 194  predetermined target path  Under price-level targeting, investors expect that any  shortfall of the price level from its target will be made up later, so that a period of low  inflation will be followed by an offsetting period of high inflation, and vice versa       Policies that promise above-average future rates of inflation create the expectation  that the future stance of monetary policy will be relatively easy for a time  Thus,  even with the funds rate presently constrained at zero, this expectation about future  policy contributes to expectations of higher future inflation and relatively low funds  rates As a result, real bond rates fall today and stimulate real activity  This effect on  expectations thus reduces the severity of recessions and lowers the danger of  deflation Such policies have attracted a great deal of attention by some researchers  and have been advocated as a possible strategy for the Bank of Japan in its current  situation Model-based research, including work carried out using the FRB/US  model, finds that under the assumptions of rational expectations and perfect policy  credibility, these policies can be very effective in reducing the stabilization costs  associated with the zero bound     However, the effectiveness of such policies depends crucially on that  credibility—on investors’ expectations being consistent with the promised policy   Under certain conditions, investors may doubt whether policymakers will in fact carry  through on their pledge For example, the public may question whether policymakers  would really actively seek to bring about high inflation following a period of low  inflation, or vice versa, rather than being satisfied with just stabilizing the inflation  rate at the long-run target If investors don’t believe the promise, then real bond rates  will not come down, and therefore such strategies will be ineffective at mitigating the  effects of the zero bound   Your final exhibit lists the main lessons from this line of research  First, in a very  low inflation environment, the nominal funds rate can be expected to hit zero  relatively frequently But in general, such an event is not an insurmountable problem  The economy usually recovers despite the constraint on policy because most  economic disturbances are sufficiently transitory and modest in magnitude  That  said, if deflation sets in, the ability of the economy to recover can be jeopardized   Funds-rate-based monetary policies can mitigate the effects of the zero bound in  several ways—by not pursuing too low a rate of average inflation, by responding  relatively aggressively to changes in economic conditions, and by promising higher  inflation down the road in the event that the funds rate gets stuck at zero  Finally, it  pays to stimulate the economy aggressively when the probability of hitting the zero  bound is high; at least from the perspective of the FRB/US model, there is no  advantage in “keeping your powder dry” That concludes our prepared remarks      One point that Dave raised that is crucial in thinking about model-  based analysis is that we are using an estimated model on thirty-five years of data during which   we have not seen a period when the zero bound was a constraint  Nonlinearities may pop up        January 29-30, 2002 Page 26 of 194  during recessions for short periods of time but are not a dominant feature of the data in terms of   their average behavior  So we really are pushing the envelope a bit with respect to what a model   can do And we recognize that One of the questions that people often ask in thinking about this   is, Are we getting enough recessions, or is our model too stable?  And in fact, as Dave mentioned   and as we described in our paper, we get some whopper recessions or depressions in this model    The shocks that we have in our simulations I don’t think grossly overstate or understate the risks   to economic performance  But whether the economy would behave as the FRB/US or any other   model predicts in a situation like that, we just don’t know, in large part because we just don’t   have that experience to incorporate into the model    To be clear on the analysis that we did in our paper and that we talked   about here today, running at that higher inflation rate was really just to repair the damage that   had occurred because of the zero bound  So whether or not we had inflation or deflation didn’t   determine what we did  If inflation were below where you would have had it for your policy rule   because of the zero bound, you would offset that through an easier policy for a while  So your   average inflation would still be right, but you would not be inflating just to inflate      I’d like to respond to a couple of comments you made regarding how   the model was simulated, just so I can clarify a few points          January 29-30, 2002 Page 36 of 194   With regard to the assumption of rational expectations, what we did in   the paper and in what we reported today was to assume rational expectations, meaning that the   expectations people form are those of the model  We also assumed that fiscal policy comes in   aggressively after five years to stop a “great depression” from occurring or at least to limit the   damage  One of the implications of that is that after five years the zero bound is not constraining   policy anymore  Basically, fiscal policy is replacing monetary policy; that’s the way we think of   it So in your example, you could think of the zero bound in play for five years, affecting the   five-year bond completely  But the ten-year bond would have five years for which it wasn’t   affected, and the thirty-year bond obviously would be affected even less  So the way we did this,   when we bring in the fiscal policy I think that is closer to what you consider a more reasonable   way of thinking about this—that it would only be going on for about five years    The expectations are still rational in the sense that, if we had deflation   for five years, say, the inflation rate would start coming back to zero gradually depending on the   quantity dynamics  It wouldn’t jump to zero, but it would come back gradually    Right, and that would depend on whatever your target was  So with   regard to what happens in the “great depression” scenarios, it’s clear that our FRB/US model   breaks down under conditions such as a 25 percent unemployment rate  Again, with fiscal policy   coming in, the rescue package avoids these situations generally  Our analysis has few of those     January 29-30, 2002 Page 37 of 194  events occurring and, one could say, “contaminating” our results  In our paper I believe we   reported that with a zero inflation target, we would have a major depression once every century   or so So I think that addresses those two questions   On the quantity effects, it’s true that what we are saying is that if quantity effects don’t   matter—the monetary base doesn’t matter—this is what the problem would be  Clearly, if one   were to layer on the effects that Marvin was talking about, that could lessen or change the results   we would get I would note that at the Vermont Woodstock Conference, Ben McCallum looked   at the question of how big the quantity effects would be, and his conclusion was that normally   they wouldn’t be that big But that’s a point that I think one might dispute   "
