,Date,Speaker,content
6613,2000-08-22,SANTOMERO,"  Thank you, Mr Chairman  In the Philadelphia District business   conditions have been mixed recently, with improvements in some sectors and slowing in others  In   many respects District developments are similar to what we have heard around the table this   morning but with some interesting differences     The pace of manufacturing activity has picked up after a two-month pause  On the other   hand, recreation and tourism has remained strong as summer spending has hit the region  Certainly   the hotels in the region got a boost from the political convention, filling them to capacity  But in fact   the evidence is broader than that about a good season for our recreational areas  Growth in retail   sales in the region has flattened out this summer, although discount stores and specialty stores did       52  better than department stores  And most auto dealers in the region indicated that sales have slowed   this month  On the construction side, residential, commercial, and public construction activity,   although still strong, has been somewhat reduced in strength over the last several months  The   number of new construction projects coming into the pipeline is beginning to decline  And industry   contacts report that while vacancy rates are low and real estate prices and rents are rising, there has   been a lot of caution, particularly in our urban centers, again noting Philadelphia in that mix   Bank lending continues to rise moderately, but with some slowing on the consumer side,   including residential lending and non-credit-card consumer spending in general  Business lending   continues to be strong, however  Labor markets remain tight, with our region's unemployment rate   slightly below the nation’s in the most recent months, and that is unusual  But reports of outsized   increases in wages and signing bonuses seem to have become less widespread than earlier this year    More retailers in Philadelphia and in Pennsylvania more generally are reporting that they are seeing   increased costs and are passing them on in the retail network  That's not true, however, on the   manufacturing side  Our business outlook survey in August still shows a very high index for prices   paid by manufacturers, but the survey indicates that the index of prices received by manufacturers   declined this month to its lowest level for the year  The manufacturers are still having difficulty   passing on input costs to final customer prices  Businesses and banks generally expect moderate   growth for the remainder of the year   Turning to the nation, we too see mixed signals in the recent national economic data  On   balance these data suggest to us a moderation in the pace of final demand that is moving the   economy toward a more sustainable growth path  Even though the economy remains strong and the   labor market remains tight, recent consumer and producer price measures indicate that inflationary   pressures are not as strong as they were in the first quarter  I also note with interest the Greenbook's       53  latest upward revisions in the trend growth of productivity and potential GDP  I do think that the   outlook for core inflation is not as worrisome as it looked several months ago when I was first   deciding on this position  I also am encouraged by the fact that longer-term expected inflation has   been quite stable, as indicated in the release of our Federal Reserve Bank survey of professional   forecasters and the Michigan survey  The stability of these measures of long-term expected inflation   suggests that people believe that the FOMC will keep inflation under control and leads me to   conclude that the Fed is not behind the curve in this regard     In sum, signs of slower growth are encouraging, especially since we have not yet seen the   full effect of the increases in the fed funds rate and the discount rate that have already been put in   place over the last year  Thank you    I support your proposal not to change the fed funds rate and to retain   the statement that the balance of risks is on the side of higher inflation  I think we need more time to   see what is happening with the real economy  Nonetheless, the balance of risks appears to remain on   the side of higher inflation over the horizon  If the indicators of inflation point consistently toward   higher inflation, then we should respond, and I think we should remind the markets of our resolve in   that regard  "
6637,2000-10-03,SANTOMERO,"  Thank you, Mr Chairman  It is a pleasure to have an opportunity   to talk about conditions in the Third District  Activity in our District is basically flat, with some   decline in interest rate sensitive sectors  Employment declined for the first two months of the third   quarter, but most of that was attributable to the Verizon strike and the layoffs of Census workers    The unemployment rate has remained steady at about 39 percent for the three states, slightly below   the nation's 41 percent rate  Consumer price inflation is accelerating in the District but remains   below that of the nation  Employment costs accelerated in the first half of the year reflecting tighter   labor markets  Somewhat surprisingly, given the recent increases in oil prices, manufacturers in our   Business Outlook Survey reported less upward pressure on prices paid than they did earlier in the   year  Most manufacturers are holding their own prices steady  Signs of slowing are found in   construction and bank loan growth  Housing permits, employment in the construction sector, the   value of residential and nonresidential contracts, and both existing and new home sales are down   from levels at the beginning of the year  At the same time, C&I, consumer, and residential mortgage   lending have slowed somewhat since June  While retail sales did show a rebound as a result of   back-to-school sales, year-over-year increases were below expectations, contrary to some of the      45  comments of others here today  And retail sales were flat this summer  The outlook over the next   six months is that growth will resume but that the pace will be no faster than in the first half   In terms of our perspective on the nation, economic growth in our view slowed in the third   quarter toward its long-term trend rate but may be picking up in the fourth quarter  Household   investment in housing and vehicles slowed from the pace we saw earlier in the year but appears to   have stabilized  Still, if oil prices remain high, the effect on growth could be negative, though   probably not as big as the effects in the 1970s and 1980s  Equity market investors suggest that there   is a fear of a slowdown and their violent reaction to earnings disappointment is noteworthy   On the inflation side, rising oil prices have led to an acceleration in consumer and   producer price inflation  More troubling is the fact that core inflation has also shown a moderate   acceleration  Over this expansion CPI inflation has averaged about 25 percent, but it is not likely to   fall further based on recent inflation figures and the staff forecast  Both of these factors suggest that   inflationary expectations are a real concern going forward, so I share some of the reservations about   the future that have been expressed here today   We like to think about this in an historical perspective  In the fall of 1998 the Fed lowered   the fed funds rate by 75 basis points in three steps in the wake of a financial crisis  It is likely that   the data after that point really reflect the core inflation reacting to the expansion  The Fed has   subsequently raised the fed funds rate to 65 percent and that may be enough to stem the acceleration   of core inflation The tightening the Fed has done to date has not yet been fully felt in the economy,   but higher productivity growth suggests that the equilibrium real rate should be higher  Observed   inflation is likely to be higher and the growth of the goods and labor markets is still something to   watch  Long-term inflation expectations in our Survey of Professional Forecasters have been   holding steady, which is interesting  Respondents still anticipate that the CPI over a ten-year period      46  will be 25 percent  They believe, I guess, that inflation will be held in check by the Federal   Reserve   That is the end of my formal remarks, but I feel some obligation to commend the staff  I   can't do so on a relative basis; I don’t have that framework  But in an absolute sense I can say that I   did enjoy and appreciate the hard work they did in the materials provided to us  Thank you    I support the recommendation   "
6661,2000-11-15,SANTOMERO,"  There has been little change in my view of the state of the   economy since our meeting six weeks ago  We have more complete data since that time and   those data ratify earlier indications that economic growth has slowed from its very robust pace at   the beginning of the year and that core inflation is accelerating   On the District level, conditions in our region show a similar path  Economic activity   continues to grow but at a slower pace than earlier in the year  Slowing is especially evident in   the interest-sensitive sectors, as one would expect given the Committee’s earlier actions of   tightening monetary policy  Manufacturing, auto sales, housing, and bank lending have eased   off somewhat, but the declines are from relatively high levels of activity  For the first time this   year October’s business outlook survey of manufacturers in our District showed declines in the   general level of activity and in new orders and shipments  That was reversed somewhat in   November, but the latest readings indicate weaker activity than earlier in the year  Housing   permits remain on a downtrend in the three states in our District as they are elsewhere in the   nation    The Third District’s retail picture is also similar to the national one  Dealers in our   region report that auto sales fell in October from September’s levels but remained above the   figures posted in these months last year  Retail sales are coming in below what firms expected   earlier in the year but are up modestly from September to October compared to last year                50      Retailers report that consumer confidence remains high, although there is some concern about oil   prices and stock market volatility   Reflecting the softening of the housing sector, our banks reported fewer residential   real estate loans in October  Consumer lending has slowed somewhat while business lending has   remained fairly strong  Although the banks reported no general signs of deterioration in the   credit quality of local customers, they did see some potential problems in larger shared credits   I would still characterize the labor market in our District as tight despite the fact that   employment actually fell in the third quarter in all three states in our District  Some of that drop   was due to the Verizon strike and reductions in Census employment  The unemployment rate   has remained at 39 percent for the last two quarters, which is the lowest in 30 years in our area    We believe part of the labor market tightness reflects a problem of skill gaps as well as cyclical   activity   It's important to keep in mind the distinction between levels and growth rates in this   situation  Even though growth is slowing, it is slowing from a relatively high level  Our   business contacts give us the first indication of a change and they are talking about a change in   the tone of the economy  But we would be wise not to over-emphasize this anecdotal evidence   while ignoring the level of economic activity  Businesses still see profits rising but not at the   same robust pace as last year and earlier this year  Within this context the news that inflation is   still moving up is troublesome     We conduct three surveys of the business community in our area the Business   Outlook Survey of manufacturers, the Pennsylvania Retail Survey of area retailers, and the South   Jersey Business Survey, which includes businesses in both the manufacturing and the services               51      sectors  All three of the surveys had continued reports of rising input prices, with more increases   than declines  While manufacturers have not found it easy to pass these higher costs on to their   customers, other types of businesses report that they have been able to raise their own prices    Labor costs in our region continue to rise, although they don't appear to be accelerating  In the   Northeast the employment cost index rose 43 percent for the 12 months ending in September,   the same 12-month rate as that reported in June  Our Pennsylvania Retail Survey shows wage   and benefit costs rising in the third quarter but at a somewhat lower pace than in the second   quarter  Similarly, in South Jersey we're seeing record wage and benefit increases and they are   moving to high levels  Anecdotally, firms indicated to us that they are seeing boosts in wages   and salaries by larger amounts this year than in previous years  Firms are also reporting sharper   increases in health insurance costs, as others around the table have reported for their Districts    Perhaps more troubling is that respondents to our Business Outlook Survey continue to expect   their costs and prices to increase over the next six months   On the national level we are seeing pretty much what everyone is talking about here    Growth definitely has slowed in the third quarter--to a reported 27 percent pace, which is below   estimates of potential--and there is an indication that this number might be revised downward    Business fixed investment, an important driver of the robust expansion, grew at half the second-  quarter pace and well below the pace in the fourth quarter of last year and the first quarter of   2000  Residential investment showed a significant decline in the third quarter  Still, this   slowdown in economic growth is from a high level  Recall that growth in real GDP in the   second half of 1999 and the first half of 2000 averaged a bit over 6 percent, significantly above   what many would consider potential noninflationary growth  And even in the third quarter, the               52      consumer, another important driver of the expansion, continued to spend at a good pace  While I   expect that the leveling off of the stock market will mean less impetus in consumption spending,   past increases in permanent income will support spending, and I don't see a major drag on the   consumer side  Labor markets remain tight nationally as they do in our own region  Income is   expected to grow  Thus, while growth has slowed from its extraordinary pace at the beginning of   the year, my feeling is that the economy is still robust   For next year, we looked at our survey of professional forecasters, which will be   released on Monday, November 20th, and I can share the views here  The current outlook for   real GDP and unemployment is about the same as it was three months ago  The forecasters   expect real GDP to grow at an annual rate of 32 percent for the fourth quarter, which is the same   as they reported last quarter  For next year they see the growth rate at 32 percent and   unemployment moving to 42 percent on average  And the median probability that GDP will   decline in any quarter over their forecast horizon is less than 20 percent  They are putting a   slight increase on the probability of a decline, but it is still a relatively small number  One factor   affecting their projection is oil prices  Forecasters were asked to predict these prices, and they   assumed that oil prices will fall somewhat next year to about $29 a barrel rather than the $23 a   barrel in the Greenbook  While they believe the run-up in oil prices in 1999 affected the   economy’s growth rate, they argue that it was not substantial  In our forecasters’ view the   increase in oil prices in 1999 cut only 01 percent from the real GDP growth rate in 2000, and   they forecast that the effect for next year will be only 02 percent     I continue to be concerned about inflation  Measures of inflation continue to   accelerate; and not all of the increase is due to oil prices, since the core measures also have been               53      moving up  Core CPI, the Cleveland Fed’s median CPI, and even core PCE inflation have   moved up  This consistency across measures is troubling  And these measures are likely to   continue to accelerate in the short run, as the rise in oil prices passes through to other prices and   the expected depreciation of the dollar puts pressure on other prices in the index  Long-term   inflation has remained steady in our forecasters’ view, but I still believe that the real concern is   one of inflation rather than softness in the economy  So, as for the tilt we were talking about   earlier, I tend to think that's where the tilt ought to be  Thank you    I support the proposed statement  I, too, came prepared   with a long list of arguments on why we should remain where we were in terms of the   tilt  I'll forgo those and forgo any request to come back and discuss them further   I find myself in complete agreement with both the wording and the logic   behind it  I recognize that we may not have seen any long-term or major changes in   inflation expectations, but the Fed must remain vigilant against that possibility and focus   the markets on our continued concern over inflation  Given the tools at the Fed’s               95      disposal, the best way for us to ensure maximum sustainable growth is to stay focused on   our goal of price stability  With due regard given to the current economic vulnerability, it   is essential that the Fed maintain its credibility, and I believe the proposed statement does   that  Thank you    "
6684,2000-12-19,SANTOMERO,"  Thank you, Mr Chairman  Incoming data suggest that the   slowdown in economic growth continues in our region and in the nation  The real question is   whether growth is slowing too much so that the economy will enter a recession  My own reading is   that this is still a growth slowdown and that the economy is not heading toward a recession   Conditions in the Third District are similar to those that I reported at the last meeting    Growth is down appreciably from earlier in the year, with economic activity in the region expected   to grow at a slow pace over the next six months  Manufacturing activity in particular has slowed   considerably since last spring and manufacturing employment has declined this year  Our business   outlook survey of area manufacturers, which will be released this Thursday, shows declines in the   level of economic activity in December, and new orders remain weak  Increased energy costs and   increased import competition stemming from the strong dollar were cited by steel and metal   producers as drags on their businesses  And manufacturers' near-term outlook has weakened   appreciably in recent months   In contrast, indicators in the construction industry are mixed, with the residential housing   sector weakening but the nonresidential sector remaining robust  Housing permits continue on a   downward track in our three states, similar to the pattern in the nation  And home sales are relatively   weak in Pennsylvania and New Jersey  On the other hand, the value of nonresidential construction   in our region rebounded in the third quarter and for the year to date has risen about 6 percent, in   contrast to the 2 percent decline for the nation as a whole  The demand for office and commercial   space remains strong in our region, and rents have moved up as a result   The Third District retail picture continues to be similar to that of the nation  Retail sales   are increasing modestly and area retailers remain somewhat optimistic about holiday sales, expecting   an increase of about 4 percent in nominal sales compared to last year  Motor vehicle sales, by      49  contrast, remain quite weak  Bank lending has improved in recent weeks, mainly in the consumer   area  Bankers report a slowing in demand for business loans and indicate that they have begun to   tighten credit standards because of concern about slower economic growth and declining corporate   profits  Nonetheless, bankers expect overall loan demand to continue at a slow pace for the   remainder of this year and into next   I would characterize our labor markets in the District as still tight  A decline in   employment in the third quarter, which I reported earlier, appears to have been reversed this quarter    The unemployment rate in our region has remained at 4 percent or less all year  Price pressures in   our region appear to be lower than in the nation, with the CPI inflation in Philadelphia running at a   lower pace than the national average this year  And employment costs in the Northeast are also   increasing somewhat more slowly than in the nation  According to our business outlook survey,   there's less upward pressure in industrial prices than reported earlier in the year  And the prices paid   diffusion index is at its lowest level since September 1999  But this good news is tempered by the   fact that businesses in Philadelphia and elsewhere in the nation have suffered sharp increases in the   cost of health benefits  In Philadelphia the cost has gone up 8-1/2 percent this year, the largest rise   since 1992, and many employers are reporting increases in health benefit costs in the 10 to 20   percent range for next year  So inflation concerns remain   Turning to the national condition, the data received since the last FOMC meeting   confirmed that the economy is growing at a slower and indeed a below-trend pace  But a period of   below-trend growth is needed to bring the economy back to potential growth  Compared to a few   months ago, the risks of economic weakness are now higher  The question is whether growth will   slow too quickly and turn negative, given the current stance of policy  In my view, we are about   where we want to be  Consumption and investment spending have been the driving forces in this      50  expansion  A drop in equity prices has had an impact on consumer spending via the wealth effect    However, holiday sales are expected to be fairly good, though not as strong as last year  Sales of   motor vehicles have shown a drop in November but that, too, is not surprising given their recent   extraordinary pace  Investment spending has also slowed over the first three quarters, but monthly   data on orders and shipments of capital goods show continued strong growth  Employment   indicators point to an easing in the labor market; although the unemployment rate edged up to 4   percent in November and initial claims have risen, conditions remain tight   On the inflation front, there are hints that price pressures are easing and that acceleration   in core inflation may be ending  In my view, we would be wise not to reach this conclusion too   soon, however  The core PCE and the core CPI ticked downward in October, but core CPI ticked   back up in November, and the Cleveland Fed’s median price index continues to accelerate  Inflation   expectations have remained in check so far, but recent developments have added to price pressures   and inflation remains a concern to me  Thank you    I support your proposal for the reasons you stated, Mr Chairman    As President McDonough indicated, it’s also important that we recognize what we don't know and   not communicate to the marketplace something that we didn't intend to convey by moving at this   point  "
6704,2001-01-03,SANTOMERO,"  Mr Chairman, this is Tony Santomero  I also want to support your   recommendation and would join my colleagues in support of a fairly straightforward   representation of it as an action taken in light of the new data   "
