,Date,Speaker,content
7028,2002-03-19,SANTOMERO," I believe there’s no easy answer to the question that is being raised   by the Desk If we look at the data on outstandings, that should be obvious  Once one moves   away from Treasuries, what’s left are corporates, agencies, mortgage-based paper of various   kinds, and foreign securities—or at least foreign sovereign debt based assets  Municipal   securities were never a real alternative, given the limited size and depth of that market  If we   eschew credit risk and we shy away from GSEs, we’re left with Ginnies and foreign sovereign   debt based assets The staff has laid out the right issues here   Maintaining a GNMA portfolio is work that involves special skills  These skills aren’t   difficult to find, nor are they difficult for the Desk to acquire  The Desk could, in fact, maintain   a portfolio of mortgage-backed instruments  The industry that we regulate has thousands of its   members engaged in that activity as we speak, and given that our interest is limited to portfolio   investment rather than trading, it’s really pretty simple to accomplish  Alternatively, shifting to   dollar RPs against foreign sovereign securities would appear to be an easier option  The Desk is   already involved in RP transactions, and so allowing sovereign collateral seems like an easy step   From a conceptual point of view this is correct  However, as the staff memo indicates,   the market for cross-currency repos is currently quite small  We in essence would need to create   a market or, as the memo states, create a more vibrant market out of one that is indeed quite     March 19, 2002 Page 19 of 117  small  I have great reluctance to do so for two reasons  First, we would have to define countries   whose sovereign debt was acceptable to serve as collateral in transactions with the Federal   Reserve And we’d have to maintain such a list  More to the point, we would have to be   prepared to remove from our list a country whose fundamental creditworthiness had changed   substantially This would be awkward at best and potentially politically difficult  Second, it’s   not at all clear to me that the Federal Reserve should be placed in the role of market creator  We    currently worry, appropriately, about disrupting markets with our trades  Why should we be   willing to create new markets?  Clearly, if the Desk indicated that it would be trading in such   cross-currency instruments, the market would develop  But this would change spreads and alter   the status quo in uncertain ways I’m not sure that this is an appropriate role for the Federal   Reserve to play in world capital markets     In fact, I more or less come to the conclusion that maybe we should slow this effort   down I hesitate to say this It took us almost a year to get to this point  But the Treasury seems   to have shifted its spending outlook, as we indicated, and maybe not enough by the back-of-the­  envelope calculations But at least at the moment that has given us some breathing room  And   as was mentioned at the outset, the auction credit facility seems to have some promise if we in   fact proceed with it  If we must act, I guess I’d favor the GNMAs  And as a side bar, there are   lots of MBAs out there who would be happy to run that portfolio for us  Given the weakness in   the labor market, there are probably plenty available at the moment  Those are my comments   I’d be interested in some comments about what is going on in the   German and French economies at this point   Thank you, Mr Chairman  I reported at our last meeting at the end   of January that the foundation for recovery was in place in the Third District  I now believe that   such a recovery is under way District economic conditions have improved over the past two   months The manufacturing and retail sectors have strengthened, and the outlook of business   contacts in the region has turned considerably more positive  There are still pockets of   weakness For example, commercial vacancy rates have increased in the last few months    Nonetheless, forward-looking indicators suggest continued improvement ahead     Our most recent data come from the Business Outlook Survey of area manufacturers    The March survey results will be released this Thursday  I reported last time that the index of   general activity had turned positive in January for the first time in fourteen months  That   increase was followed by another increase in February, and our March survey will show another   positive reading at 11 percent  While that is marginally lower than February’s 16 percent   reading, I’m not too concerned about this decline for two reasons  First, the swing we saw in this   index from negative to positive in January had been larger than the typical swing at the end of   recessions Second, though fewer firms reported an increase in activity in March, the number of   firms reporting increases was more widely distributed across industries  The indexes on     March 19, 2002 Page 66 of 117  shipments and new orders also remained positive in March, with about 7 percent more firms   reporting increases than decreases  Last month the index of delivery times rose above zero for   the first time in two years and it, too, remained positive this month  While firms continue to   reduce inventories in March, the reductions are slowing; and for the first time during this   downturn, firms are reporting that they expect to increase inventories in the next six months    Our survey also indicates that manufacturing firms continue to shed workers  They did so in   March, and the workweek continued to shorten However, consistent with the strengthening in   activity, the employment outlook has also strengthened since January  Our March survey   suggests that in general, manufacturers expect to increase payrolls over the next six months     In a special question in this month’s survey we asked the firms that expected to increase   production how they expected to do it Over 40 percent said that they planned to hire additional   workers; about 30 percent planned to increase the work hours; and about 25 percent expected to   increase production solely through increased productivity of current staff working at current   hours I find this last number particularly interesting It underscores the fact that productivity   gains have become a significant component of business strategy in our area  Productivity gains   and weaker demands in earlier months have helped to contain price pressures in the District  In   March, however, the current prices paid and received indexes in our Business Outlook Survey   turned positive for the first time in eight months  Price expectations are positive and rising     My view of the national economy has turned significantly more positive over the   intermeeting period, as the data have been fairly consistently on the high side of expectations  I   now believe the economy has turned  Notwithstanding the strong data, I continue to believe that   this recovery will be weaker than most experienced in the postwar period  As we all know,   however, weaker than usual doesn’t mean weak in the absolute  In fact, the current range of     March 19, 2002 Page 67 of 117  forecasts that have been made for the first quarter and for all of 2002 would support my   characterization of a recovery that is weaker than the average postwar experience  This view   partly reflects the strength of consumption spending throughout this economic downturn, which   has been the primary factor in the mildness of this recession  In the early stages of a recovery,   real PCE growth is typically quite strong, often above 5 percent, reflecting recovery in the   consumption of durables more so than nondurables and services  But during this downturn, auto   and home sales have remained strong  With less pent-up demand, consumption growth should   remain moderate  I also believe that it will take time for business spending to reignite  On the   other hand, the government budget continues to be more stimulative than anyone might have   guessed only a year ago, and businesses have a habit of responding quickly to changes in market   conditions So we may yet be surprised on the upside     In any case, given the revised, more positive outlook, I believe it’s time to refocus our   attention on the longer run  We now see that the recovery is in place  That’s not to say it’s a   sure thing, but economic conditions have begun to improve across various sectors  Our   expansionary monetary policy is having the desired effect  The Committee now needs to   contemplate its strategy for moving the stance of monetary policy back toward neutrality  At this   point, we don’t need to decide where neutral is, but we need to take the necessary steps to allow   us to raise rates in the not too distant future  This means preparing the public and the market for   such a time  Thank you, Mr Chairman   I support your recommendations, Mr Chairman  "
7051,2002-05-07,SANTOMERO," Thank you, Mr Chairman  At our last meeting in March I reported   that economic recovery was taking shape in the Third District  That recovery continues, albeit at   a moderate pace  I spent the last month traveling around our District to a series of meetings with   bankers and business people Most of these contacts told me that they have seen increased               May 7, 2002 35 of 81  demands in their markets and that they believe the worst is over  This was true even in areas that   traditionally have been among the weakest in our District  According to our business outlook   survey, the region’s manufacturing sector improved for the fourth consecutive month in April    Our indexes of general activity, new orders, and shipments moved up  The current inventory   index for the last two surveys has been close to the two-decade average  This suggests that the   cyclical inventory reduction has likely run its course  Indeed, the future inventory index from   our April survey rose to the highest reading since 1984, suggesting that firms expect to be   rebuilding inventories over the next six months  Consistent with this, the CEO of a large   chemical company reported increased demand for his products, which are inputs into the   production of many consumer durables   In answer to a special question in our recent business outlook survey, one-third of our   respondents said that they plan to increase capital spending from current levels  The planned   increases are modest, and most are expected to occur in the second half of the year  However, it   is worthy of note that only a few suggested that they were increasing spending in response to the   capital-expensing provisions of the newly enacted economic stimulus package  The   improvement in the region’s manufacturing sectors has not spurred firms to add to their payrolls   yet, although the employment declines are less than we’ve seen in the past  Overall, employment   in each of our three states fell in the first quarter, and the state unemployment rate rose  This   weakness is likely to continue over the next few months, consistent with April’s national   employment report released last Friday  But firms are beginning to report that they plan to add   to their payrolls to meet increased demand  Many will be permanent hires  This is especially   true of retailers and service firms            May 7, 2002 36 of 81  Consumer demand in the District has held up, but Pennsylvania sales tax collections   indicate that retail sales are largely being supported by auto sales  Housing sales and residential   construction have shown gains in the past few quarters, and strong demand has pushed up house   prices This has also meant brisk sales for home furnishings, as you’ve heard around the table    Sales of other types of merchandise have been slower to recover  On the other hand, our first-  quarter South Jersey business survey of retailers, service firms, and manufacturers posted its first   positive reading in over a year  And the index of future sales is at high levels, an indicator that   we may expect a pickup in sales over the next few months   Prices in a few sectors in our region have shown sizable increases from year-ago levels    These include housing and medical costs, as we all know  Nevertheless, overall consumer   inflation remains moderate, tempered by productivity gains and weakness in demand during the   downturn Core CPI inflation in the Philadelphia region for the most recent twelve months is   about 2¾ percent, just slightly above the national average  However, we have begun to see some   signs of rising industrial prices  The price indexes from our business outlook survey are rising   after a period of negative readings, and the prices-paid index in our South Jersey business survey   has also returned to positive territory  I don’t want to overemphasize these signs of firming   prices Nevertheless, they do serve as a reminder that, as the recovery gains momentum, the   Committee will need to take steps to prevent an acceleration in inflation next year and beyond   My views on the national economy are consistent with what I’ve seen in the District  The   economic data we have received during the intermeeting period show that the economic recovery   is under way Earlier indications from our business outlook survey that manufacturing activity   was beginning to recover are now reflected in both the ISM and the industrial production   numbers  The timing of the inventory correction pushed up first-quarter growth at some expense         May 7, 2002 37 of 81  to second-quarter growth, but underlying demand has strengthened since our last meeting    Indeed, final sales came in stronger than expected in the first quarter, and I’m not convinced that   we will see much change this quarter  The Greenbook forecast of final sales growth of less than   1 percent seems a bit too low to me     One upside risk in the near term concerns imports  If the dollar continues to depreciate,   import growth could be weaker and domestic production stronger than assumed by the   Greenbook The April employment reports came in below expectations, but the weakness in   labor markets should come as no big surprise  Cyclical components of both employment and   unemployment typically lag GDP by a quarter or two  Note that the rapid productivity growth   we have seen means slower growth in employment, but it also means a more rapid recovery in   profits I don’t think the rise in oil prices we’ve seen over the last two months is sufficient in   magnitude to affect our outlook   Although I believe recovery is under way, I do have some concerns  At our last meeting   a major question was the outlook for capital spending  It remains uncertain  The March data on   nondefense capital goods were a disappointment, and the capacity utilization rates are still at low   levels, so firms might delay capital spending if sales and earnings slow  This could, in fact, stall   the recovery  On the positive side, our survey data suggest some improvement in the outlook for   capital spending Another hopeful sign is that capacity utilization has been rising since   December, and the change in utilization is associated with future spending on equipment and   software, with a one-quarter ahead correlation of 88 by our estimation    My feeling is that we’re in a transition and that the next few months will be tricky    Employment growth was low this month, and GDP growth is likely to be weaker this quarter   than last  Still, the ultimate policy question does not concern what the economy does over the                  May 7, 2002 38 of 81  next quarter but where the economy is headed by the end of the year  The tradeoff between   short-run and long-run concerns will determine when the Committee must take the first and   inevitable step on the path toward neutrality  Weakness in the labor market and a benign   inflation outlook give the Committee some time to wait  However, historically forecasters have   typically underestimated the effect of policy on the economy  This bears remembering, given   our current very accommodative policy stance  Thank you, Mr Chairman   The 88 was a one-quarter-ahead correlation between the change in   capacity utilization and future spending on equipment and software    Yes, spending on equipment and software   Yes, the cyclical components   I support your recommendation, Mr Chairman              May 7, 2002 74 of 81 "
7080,2002-06-25,SANTOMERO," Thank you, Mr Chairman  Data received since our last meeting   suggest that the recovery is proceeding at a moderate pace in the Third District, which is   consistent with our forecast  The manufacturing sector continues to improve  In June our   Business Outlook Survey index of general activity posted its sixth positive reading in a row    New orders and shipments have been expanding, and the indexes are at healthy levels    Responses to this month’s special survey question suggest that technology spending in the     June 25-26, 2002 78 of 179  District should increase at least modestly this year  While a majority of the firms plan to keep   technology spending at current levels, 6 percent more firms plan to increase such spending than   to decrease it for the remainder of the year Those increases should occur relatively soon, with   half of the planned increases coming in the third quarter   We expected retail sales to come in weaker in the second quarter than in the first, and the   data have been consistent with that expectation  According to our contacts in the region, retail   sales of general merchandise rose slightly in May, and auto sales were steady  This is a bit   stronger than we saw for the nation as a whole  Pennsylvania sales and use tax collections rose   slightly in April and May, reflecting an increase in non-motor-vehicle sales   Regional real estate markets are consistent with what we see nationally  Housing sales   and residential construction continue to expand, and housing prices have risen on strong demand    In contrast, commercial real estate markets in the region have eased since the winter  Large   amounts of subleased space have become available, depressing rents and boosting vacancy rates    The suburban vacancy rate rose above that of center city Philadelphia earlier this year  This   reflects two factors First, the patterns of the job losses in both the city and suburbs were   comparable; and second, there’s been very little new commercial building and no speculative   building in the city over recent years  Most recently, the value of nonresidential construction   contracts awarded in the region has increased slightly because of casino expansion in Atlantic   City, warehouse construction in several parts of the District, and educational and other   institutional building in the region  It’s too early to know whether this is the beginning of a   turnaround in nonresidential construction   Labor markets in the District remain stable, with little sign of improvement or   deterioration The unemployment rates in Delaware, New Jersey, and Pennsylvania remain             June 25-26, 2002 79 of 179  below the national rate One of our directors runs a temporary-help firm and she reports that   demand for workers has been strong, especially in manufacturing  On the other hand, many   college graduates, unable to find permanent positions, are placing applications with the firm    Our BOS employment index went slightly negative in June, indicating little change in   manufacturing employment in the region this month  The future index suggests that   manufacturers plan to add to their payrolls over the next six months     Although inflation remains modest in the region, tempered by productivity gains and   weakness in demand, we’re beginning to see some signs of price increases in a few sectors of our   region For example, our BOS indexes on prices paid and prices received have been positive   since March   My view on the national economy is consistent with what we are seeing in the District    The data appear consistent with a recovery that is proceeding at a moderate pace  And a   moderate recovery was what we expected in part because the recession was a mild one    Manufacturing is recovering, consumer spending is showing moderate growth, and there are   signs from the orders and shipments data that business fixed investment spending has stabilized   and that equipment spending is beginning to move back up  These data are consistent with our   forecast in which we show real GDP growth slowing in the current quarter, followed by a pickup   to about potential in the second half of the year  The pickup is driven by a resumption of   moderate expansion in consumer spending, a return to moderately positive inventory investment,   and some pickup in equipment investment  We have not yet seen much of a decline in the   unemployment rate, and we do not expect to see much this year since expansion in output is   expected to be only around the rate of potential during the second half  With strong productivity   growth and continued slack in the economy, inflation ought to remain subdued  Next year as the     June 25-26, 2002 80 of 179  recovery progresses, we expect GDP growth to accelerate to somewhat higher than potential,   causing the unemployment rate to come down a bit more rapidly and inflation to rise a bit    Obviously, there are uncertainties and risks in this forecast  But in my view these risks are   balanced, with risks on the upside as well as the downside    I should note that our forecast is similar to the Greenbook’s with a few exceptions  For   example, while the Greenbook sees inflation on a downward path over the forecast period, in our   forecast period it has an upward tilt  Given the error bands around these forecasts, one would be   hard pressed to say there is much difference between them  What we can say is that both   envision a modest recovery and one that will require monetary policy to move at some point in   the not-too-distant future But I’m becoming a bit nervous that the markets are not going to be   prepared for such a move when it comes   History tells us that turning points are hard to gauge and that we will very likely receive   mixed data into the recovery  We have now had very low interest rates—at recession levels—for   probably six months into the recovery  History tells us that forecasters consistently underpredict   the strength of the economy at the beginning of recoveries and underestimate the effect of   monetary policy on economic activity  All of this suggests that when we start seeing better   employment data and the financial markets have reached a trading range, we will have to make a   policy move  I think it’s important that we start preparing the markets for this outcome  We   need to let market participants know that we believe the recovery to be on track, we expect it to   be a moderate one, the data are coming in consistent with that forecast, and it is not prudent to   maintain a very accommodative monetary policy stance for too long  If we prepare the markets,   the first move will be less disruptive  Thank you   I support the recommendation  "
