,Date,Speaker,content
880,1978-09-19,WINN,"  Mr Chairman, a question and comment  The question, Jim, involves the   problems of the seasonality of the adjustments on the new orders of durable goods  The fiscal year  shift, you take unadjusted figures and you get a different picture  Yet that's one of the puzzling  developments here on the current scene      My comment, Mr Chairman, has to do with my role as one of Governor Jackson’s stable   boys  I think it's proper to call the attention of the group to the explosion that's taking place in  credit in the securities markets and the rapid expansion in the numbers of customers--if you can  depend upon the statistical reporting series, which I think is questionable  But there is quite an  explosion of activity there and the independent action of the exchanges to raise the margins on  certain kinds of securities      I just wondered if there is something in that that accounts for some of this   behavior     I'd remind the group that for the last couple of years we've been making   funeral arrangements for the economy after the strong starts at the first of the year and then worries  [later]  My own feeling is that it still may be a bit premature for this event  The durable goods  [figure is a] question--what prompted my question earlier--but I have a feeling that we may have       9/19/78            15  more strength than is apparent  But what worries me is further down the road for two reasons, or  three reasons maybe  First, commercial construction and apartment house construction are really  running full out  And there is no apparent barrier in terms of financing and [related] factors  So,  what worries me is that if these are brought on stream, then we may suddenly get a glut in this area  with a very sharp turnoff      Second, we're seeing some interesting things in consumer spending; jewelry, furs, and other   premium items are really going great guns  The nondurables are having problems  And what  worries me on this score is that with consumer credit [readily available]--with the credit cards and a  number of other things--we may have introduced a much higher degree of cyclical behavior in the  consumer area than we've experienced previously  And if this occurs simultaneously with  construction and a few other things coming to a head further down the road, there may be a  problem  But at the moment I suspect we're going to get more support in the consumer area as a  result of the still pushing of the credit card and credit and other factors we've projected  So, on  balance, I come out with the feeling that for the few months ahead the staff forecast is probably  more on the low side--not much, but we may see unexpected strength      Mr Chairman, I guess I’ve come full circle  It's a circle we have been around   here in our discussion  I associate myself with the Volcker position in the sense that I think we do  have to continue signaling our concern about the aggregates growth, whatever those aggregates are,  with the periodic adjustments we make to them  And we also need to retain a sort of “watch and  look” posture in the sense of the 4 to 8 and 6 to 10 on the aggregates with an 8-1/4 to 8-3/4 funds  rate range  That doesn't seem like a draconian kind of development and it gives us a chance to  assess later on the changing economic scene as well as the developments in these aggregates and  move then to 8-1/2, with an aggregates directive    "
908,1978-10-17,WINN,"  I would say perhaps a little lower on the real GNP--real output of 2-1/2 to 3  percent--and a little higher on prices, at 7-3/4 to 8-1/4 or something of that kind  What disturbs me       10/17/78 16             in all of these forecasts are the price developments  I just don't think you can talk to people without  coming away with a different sense that this is simply not sustainable, in terms of the bitterness that  is building up in a very, very broad area  I get public reactions that are different than we put into  our forecast      On the price developments      Well, their reactions are either going to be explosive on one side or complete  withdrawal on the other  At the moment I'm not sure how that will fall out but it's a very  widespread feeling and the first time I've encountered it  It’s such that you can't talk to any group  without that being the dominant factor in the picture      Steve, have the TT&L changes been factored into your November estimates?      I think my preference would be a money market [directive] with an 8-3/4 to  9-1/4 [fed funds] range and alternative 2, I suppose, [given] our lack of knowledge of what's  happening      Yes      On another matter, Mr Chairman, I've been unhappy this year with our  experience with the Ms, and the meeting today convinces me that we're certainly not sure about       10/17/78 57             how to measure them or what they are  I wonder if this isn't the time to reopen the question of our  guidelines  Even though we've explored it and buried it a number of times, [I’d like us] to reopen  the issue of some sort of reserve base aggregate to be used to guide our actions  I think it's time    "
933,1978-11-21,WINN,"  Scott, [you mentioned] the $46 billion of our intervention; what's the foreign  intervention at the same time?  The footnote in the Bluebook about $11 billion is for direct  placements in foreign securities in the bill market by foreign accounts      Before we leave the area, Mr Chairman, I wonder if [Alan or Scott] would  comment on the weakness reported on the foreign exchange markets this morning     11/21/78              7      On the business [side], you get a strange dichotomy  If you ask them how  their business is they'll tell you it’s very good but they're told by their economists that it is going to  get poor  Their own assessment is quite different from [their sense of the] general environment   On Jim's point on the consumption spending, the thing that bothers me a little bit is that if you look  at the service component of personal consumption expenditures, the big factor in its growth is  related to housing, as I understand it, including such things as storm windows and other things  It  seems to me that we may get more fluctuations out of changes in personal consumption  expenditures than we have had previously because of the real difference in mix that is going into  that service component  Some I find it hard to call “services” but that's the way they classify them      I think the variables are too great to be very confident on any kind of  projection  You can spell out four or five scenarios and I don't have a very strong feeling at this  stage as to which one is going to happen  I think we're paying too much attention to the retail sales  of the past month or so, which I think are affected by weather and differences in terms of the  samples [used] in collecting the data  I think we have more variables in those numbers and I feel  less confident about those than anything  I'm thankful for Christmas ahead to keep some  stimulation  And if we get some of this snow in Boston, it may actually spur sales rather than  handicap them      Across the country  Well, coats haven't done very well either      But you can trace some scenarios here of stability  [With a] regain of  confidence and a sudden purge in inflation, [we can get] output that we don't [have forecast]  On  the other hand, we can coast over to a very sharp decline very quickly here by consumers pulling in  their horns  I'm not sure how much [good] a yearly forecast does us at this stage with the kind of  variables we're faced with  I can see inputs that would lead to this result, but there are alternative  inputs that can give us quite different results      I would put a cap of 5 percent on M1, a range of 6 to 9 on M2, and 9-3/4 to  10-1/4 [for the funds] rate, staying at 9-3/4 until we see what's happening here      I'll go along with it    "
959,1978-12-19,WINN,"  Can you elaborate on your last comment a little bit?      Things are rather bizarre in Cleveland  I hope you won’t think that I am  following the Cleveland tradition in my comment  I’d like to take a little different path  I think we  are frozen in a pattern of operation that should be reexamined when you think about our focus on  rates  If we examine other underlying conditions, we assume that it’s going to take up to 14 to 15  percent on the [short-term] interest rate to get the braking effect that we want in terms of our  present tack  I suspect we could do the same thing with maybe a 1/2 or 3/4 percentage point  increase on the long-term end of the rate range  And I think maybe we ought to think that through  a bit      Usually we put our brakes on at the end of a cycle and then end up with over-capacity in a  number of areas  Then when we try to stimulate things, we feel equally frustrated on the other side  We are faced with looking at problems of commercial and industrial building where we probably  have a 1-1/2 to 2 year run without going into over-capacity  Yet that’s very interest-rate sensitive  to the long-term rate, but 14 to 15 percent on short-term rates is not going to slow that a bit  And if  we could effect some slowing down and braking at that end of activity, we might be able to rush  that very quickly with a change in the rate level because rates are the chief cost factor in a great  deal of that kind of construction activity  I wonder if we shouldn’t think a little more clearly on our  focus of what we are trying to achieve in terms of strength and whether a slight increase of that  might avoid a very big rise in short-term rates, [which is] what I’m afraid it is going to take to  accomplish our purpose  I’m thinking about not only the braking effect, but the stimulating effect  that may be far more effective at that end than the [short] end where we are focusing most of our  attention      The second comment I’d like to make is that the wage factor, at least in our state, is  certainly starting to get out of control  [That’s true of] everything from the state legislature on  down, [including] the Teamsters and others  So the wage factor is a very big problem in terms of  people’s thinking and what they’re [doing]      The third comment I’d make is that I consider the retailers the soft underbelly of the future   I’m not quite certain as to how that [sector] is going to behave  We have had sales stimulus from  the pre-Christmas season but very little price cutting, as I recall  And whether we will get an after-  Christmas price cutting and change attitudes or not, I don’t know  But it seems to me that that’s  very sensitive to where we go in the future      12/19/78          19       [Let me make] two other incidental comments  Cleveland doesn’t confine itself to  Cleveland in terms of its investment interest  I get all kinds of danger flags pointed to the Southern  California condominium real estate markets, à la the Florida markets a couple of years ago  More  people have been beating my ear on the dangers happening there, which always are pointed at the  other fellow, I guess      It would be welcome, I’m sure  The natural gas [situation] that Ernie  mentioned is not restricted to Texas  It’s also prevalent in Ohio; excesses are being reported and  they have no storage space  It’s partly that the winter weather has been mild in contrast to previous  winters  So we do have excess showing in that area         I’m concerned that we may be closer to changes in trends than we have been previously,  and I think this needs to be watched very carefully  And I share the feeling that maybe seven  weeks is too long between meetings, with the international and the domestic situations  My  personal feeling is that because of the psychological factors and the focus on us and the strength  that I agree is prevalent throughout [the economy, it] requires further attention on our part  So I  would feel that perhaps a little more modest braking would be appropriate but I’d like for us to  consider the long-term end rather than the short-term end        I can accept the suggestion made by Steve  I think I would prefer dropping  the ranges to 0 to 6 on M1, 4 to 8 on the M2, and 9-3/4 to 10-1/2 [on the funds rate]       Isn’t this just a reporting requirement, not an operating requirement?  In other  words, we have to report twice a year on this basis but there is nothing to prevent you from looking  or acting in the interim period when conditions change       It’s a reporting requirement, not an operating requirement       That’s still a reporting requirement, not an operating requirement       Otherwise we are locked in the ages-long controversy between automation  and judgment as a policy       The second Wednesday--isn’t that a possibility?       It does in July but we could make an exception     12/19/78          50         I would just raise the question with respect to January, in view of the  uncertainties that are prevalent  I’m wondering what the public relations aspect of it is, even  though we hold it by telephone, to say that there is not a meeting in January     12/19/78          51         I think we are missing the market aspect of this       I, too, would share the feeling that this is sort of a back-of-the-hand treatment  to a problem  I grant that it’s not a good guide and I don’t insist that it be in the targets or ranges,  but I think we have made a mistake in the past in ignoring the supplemental information that this  provides for us  And I’d like to see an examination in somewhat more detail of whether this  supplemental information tells us something about what’s going on in the aggregates, particularly  with respect to the future, that we have chosen to ignore  I don’t advocate that it be part of the  specs       12/19/78          68       That’s really all I’m talking about    "
1014,1979-03-20,WINN," M r   Chairman, a sobering exercise at a time like  this is to go back to the first quarter of last year and use our  models or any other approach and ask oneself what conditions would  produce a negative rate of growth in money supply in the first quarter  of this year We get astronomical interest rates and a lot of other  things that we really haven't seen So then we ask ourselves, given  that everybody is expecting weakness at this time--and that's  certainly the news--where do we find it? Again, if we follow our  models, they may not work out quite this way Having spent the winter  falling into potholes, I take a pothole approach to economic  forecasting One of the potholes, of course, is in the energy area,  with tremendous problems with respect to refining capacity I really  don't see how we can get out of this on any short-term basis What  this means for the consumer is that he may find he can't buy, beg, or  steal gasoline   Okay Then we divert more of our oil supplies to  producing electricity; with the shutdown of the atomic plants in this  area, I don‘t quite know what this means Another pothole I would  call to your attention is the fact that we focus pretty much on the  domestic scene in terms of our analysis Now, the international  situation looks a little better at the moment, but as I travel around  and see the diversions of some of these economies into the military  side, I get concerned about what this means down the road If a  country puts that much of its [economic resources] into the military,  the tendency is to use it in one form or another How this will turn  out, I don’t know, but we certainly can see trouble in Yemen and lots  of other places that aren‘t in the headlines at the moment The third  point is the confidence factor on the international side and the  tremendous flows that occur And I look at confidence in another  area--at many of our so-called monetary mechanisms Take the credit  unions and look at their loan/deposit ratios and their lack of cash;  yet they‘re in the share draft business What does it mean if  customers really step up their demands for [withdrawing] their money  from some of these [institutions] or want to transfer it? So, I would  project the potential for weakness that everybody’s talking about, and  then I’m raising the question of whether there are other possible  developments The only real weakness I can find at the moment in the  District is the coal situation, but in other areas such as cement  there is strength A number of the raw materials producers are at  capacity Steel is running flat out There’s just isn’t any [more  capacity] If we get demand for steel in excess of [the current  level], we will really be faced with a blow-up the other way Now, it  may not occur   M R   MORRIS Did you say the demand for coal is weak?   Yes, weak   I would say I end up confused in my outlook; I  think the uncertainty level is really quite high   Hold steady   Mr Chairman, I'd take generally alternative B  with a 4 to 8 percent range on both the M1 and M2 ranges and an  aggregates directive  "
1040,1979-04-17,WINN," Jim, in the last three weeks we've been getting a  little more evidence that disintermediation is starting to take place  We see it in terms of traffic in the Bank--direct purchases of  [Treasury] securities--and we see it in looking at some of the  institutional outflows Parallel to that is the fact that long-term  rates are starting to increase, particularly for the financing of  office buildings and other such things I get a reading that across  the country for the first time [builders] are really starting to look  very hard at costs and that a number of projects have suddenly been  pulled back in April Are we starting to see the bite of the policies  that have been in train for some time? If that's true, then one gets  a little different outlook than you projected for some of these  things   That's right, but the April data--   I wonder if the flows are going to go into market  investments?     4/11/19 -7   I think we are going to see more   I hate to see such unanimity over there I don't  want to be a counterforce today The inflation situation is still  very bad It seems to me that any easing would be misinterpreted and  could only be counterproductive On the [plus] side, it seems to me  that the transfer mechanisms really are at work, both from the budget  side and the food side [As for] the oil side, we really don't know  what that means I have a feeling that our policies are really  starting to work; they've been slow to take hold, but [monetary  policy] is not a quick fix And to be impatient at this stage would  be a mistake So I end up right in the middle--[no change]   I have no quarrel with alternative B I just  wonder, in view of the discussion, if there's some symbolism that  could be effected without really much change in market conditions,  such as a 114 point increase in the discount rate Reserve  requirements might be expanded on some other items such as on  Eurodollars and other [components where we know of] problems I don't  know whether this is the appropriate time--  "
1090,1979-05-22,WINN," May I borrow a little sand to feed my machinery?  I still get the reading that the financing of [housing] has been  turned off almost absolutely And there is about a 3-month lag  between financing and starts O n  that basis, starts should [fall]  very sharply starting by the end of June Insurance industries, in  contrast with the banks, report very little demand for financing at  the moment, which is rather surprising All of that leads me to feel  that commercial construction is in for a rather sharp decline, though  maybe not until the third quarter     5/22/79 -13-   The other comment I’d make is that the trucking industry  reports rather sizable declines in the last two weeks Now, whether  that’s the adjustment to the after-strike effect or whether there’s  something basic happening, I don’t really know   Mr Chairman, I sense a growing ugly mood in our  society I don't know whether the reaction is going to be in the  political sector or in the economic sector or in the racial area, but  I suspect it won't be a moderate reaction So I think we are in for  some rather volatile times ahead that could throw these estimates off,  but I certainly don't want to predict them My feeling would be that  this is not the time to tighten But in view of the uncertainties and  the inflation problem and other problems, I would say that we would be  well advised to stay where we are in terms of the current status of  policy I would favor a slight increase in the discount rate because  of the position of the banks; the inviting differential there is hard  for them to resist   I support Steve's recommendation   [Unintelligible]  "
1138,1979-07-11,WINN," I haven't any quarrel with the staff's projections  and I have only two comments on that One is that the continuing  inflation may force greater financial problems for some of our public  bodies--schools, cities, and so forth--and we may get some reactions  in that area that aren't really factored into the formula Second,  there is a potential that energy and some of the other problems may be  a greater stimulus to real investment on the part of the corporate  sector--if the growing recession talk doesn't scare them off on that  score--so that might be a potential stimulus   On the aggregates, I would certainly like to echo Henry's  comments on the meaning of these numbers and our not getting trapped  by putting too much emphasis on these as we make our projections  because of changes [occurring] everywhere Maybe it's all these other  [financial instruments] getting into those aggregates measures I  have trouble with drift And I have trouble trying to explain April  and June in spite of the [staff's] explanations I don't find them  very satisfactory as to what really has happened, which makes me  uncertain as to the future I would stay with the recommendations of  Steve Axilrod; I would go perhaps a little lower in 1980 because of  the uncertainties with respect to what's happening to ATS plus the  growth and magnitudes of these other numbers So I would be more  cautious with the '80 number I think than he was, but I have no  quarrel with extending the ' I 9  ranges  "
1159,1979-07-17,WINN," Mr Chairman, I have a feeling that we may have more of an iceberg here than we like to think Intervention alone won't [work] and probably is too expensive [if our aim is to achieve] a turnaround I am a bit sympathetic to [taking action] a little earlier rather than later because we can reverse it A discount rate change and a slight fed funds rate [increase seem] appropriate But I think the question we need to ask is If the first move in this direction doesn't stem the flow, are we really prepared to go further along this line? Apparently the answer to that question is more uncertain I think I'd have a tendency to march down that road much earlier than later, however, thinking that we'll know very quickly [as we undertake] that move "
1181,1979-07-19,WINN," Mr Chairman, I urge that we follow the directive and permit the funds rate to rise to 10-1/2 percent And then I would urge that we change the discount rate In the announcement, however, I would focus on the behavior of the aggregates That gives us the flexibility to back down in response, hopefully, to better behavior [of the aggregates] and the underlying economic situation But I think we have to give some signals to the international markets if we are going to stem this dollar inflow We certainly can't peg [the dollar]; we shouldn't peg it anyway But we can't peg it, I think, just by direct intervention with no signal or we are going to find more funds flowing in than we can possibly handle  I feel the way Paul does I'm not sure it makes that much difference, Mr Chairman, but I can't oppose it    7/19/79  Murray, this is Willis Winn Will you call me at home after 930? "
