,Date,Speaker,content
1696,1980-11-18,WINN," To step back a little on the economic picture, Paul, I am concerned about two things One is the energy situation While at the moment we are faced with a glut of storage space for oil  -24-    11/18/80  in this country and temporarily have a big supply hanging over the market, trying to get a fix on what is happening in the Middle East is extremely difficult I came back from there with reports of from 3 to 10 years to put things back together In this country we are talking about 3 to 10 months I don't know what the truth of the matter is, but I think we are more heavily exposed to energy problems than we have been in the past If [those problems materialize], the price implications are very scary for agriculture and [many other sectors] because of the energy situation Things are happening, and we have had an interruption of supply And not to try to get a better fix on that is a serious mistake  They are talking about big increases in prices this time, and that really scares me My second observation--and this is perhaps a sample of one--is that I can't help but be impressed by the amount of military supplies that are being moved to the Middle East And that makes me think that defense expenditures in real terms are going to be much larger than anything we see in the budget figures today I realize that the expenditures have gone up but it seems to me that the assumption built into the models needs to be questioned seriously And this could alter the budget figures, resulting either in offsetting [cuts] in other areas or again an uncertainty in the picture that hasn't been completely built into the forecast for next year  I am afraid we are going to get both [higher] energy costs and a big increase in defense expenditures  Tighter, sir  Yes, I came back very much depressed about the inflation picture over there and the complacency with which they face it--the efforts to index it and then to juggle the index, the whole problem of what it is doing to the economy, the brain drain that has set in and the implications of that I think it's a complacency that we just can't buy in this country  Israel and Egypt  But don't we have to consider the trajectory effect on 1981? To take the end of the year as the horizon with regard to where we want to be I think is the wrong [approach]  -40-    11/18/80  What do you consider to be the normal rate at this time? "
1736,1980-12-05,WINN," Paul, this is Willis I haven't any objection to the statement of the principle I would feel a little more comfortable if we [lifted] the federal funds range and told the Desk not to go above 18 or 19 percent, except temporarily "
1753,1980-12-12,WINN, Winn Okay 
1781,1980-12-18,WINN," Mr Chairman, what sort of rules do we have with respect to moving the other way with this deck of cards in our hands? Is there a tendency as we pile up more reserves to want to peg rather than to smooth or whatever? I'm not quite sure what either of those terms means, but--  Scott's comments are what scares me in the sense of the profit and loss being confused with the intervention issues It seems to me that's the danger of large balances--that one starts to use them in the profit sense of the term rather than stabilization I'd like to hear the pros and cons of establishing swap agreements when we're not under pressure as a way of doing this intervention versus the holding of large reserves  Well, we protect ourselves with swap agreements so we can get funds if we need them rather than--  That's right  -20-    12/18-19/80  Paul, this morning I feel as if I have been sitting with a group of blind people describing a passing scene and I'm starting to lose confidence in my seeing-eye dog I would like to try not to repeat what has been said [since I] share many of their feelings But I'll pick up a little on our credibility problem in trying to find how we go from where we are to where we ought to be [in terms] of having a realistic target It seems to me that several things might be said on that score First, we are where we are and there's no use trying to assume some other basis; we have to go from where we are But we could aspire still to get back into what we think would be appropriate target ranges that have some relationship to what we've decided in the past The critical issue is the time period that we say it's going to take us to get there It may not be within the year; it may take us longer than that to work in that direction But that at least should be in our statement Second, we should recognize that we are dealing with a number of variables here We tend to concentrate on the Ms And I think the shifts that Jerry was talking about have effects on the velocity of money and at least we ought to get that more into the conversation, not that we understand what's happening on that score We have price developments and we probably should pay a little more attention to some of these than we do For example, I got nervous about commodity market developments and the speculative activity and the credit being used in some of these areas Maybe we should be somewhat more vocal on some of these things rather than ignore them  No, it's not that, but maybe we should take another look We don't have control over the margins in all areas, but I'm not sure those are all proper in this kind of environment On the output side, I have a gut feeling that the year may turn out to be stronger than we're expecting rather than weaker I say that for several reasons One is that we may have a sharper decline in the first part of the year than some of us are expecting But what strikes me is the underlying demand that is building up in a number of areas, from autos to office space and certainly housing If attitudes change and the environment changes, we could have a sharper snapback in some of these areas than many of us are expecting  So, I would still stay with trying to address our concern about prices through our targets I would not try to confuse people by shifting, although I recognize all the shortcomings of the present measurements that we have I would build the targets from where we are, but with regard to what we thought our targets zones would be And I'd accommodate the concerns of Henry and others in this area; maybe we ought to think not of a symmetrical zone around the median point, but [aim] somewhat on the lower side--perhaps 2/3 below and 1/3 above it That may help us a bit in terms of the kinds of pressures that will build externally should the numbers fall short during the early part of the year And hopefully doing it that way will avoid some of the pressures for a very sharp reduction in interest rates should the quantities fall short of [our targets] I'd talk a little about our hope to be back in that zone over a period of time And that doesn't have to be fourth quarter-to-fourth quarter; it could be somewhat longer You will recall, Paul, our visit with some business people [in my District] I interpreted them as recognizing the pain,  -52-    12/18-19/80  but they didn't really see any other show in the works that would help us relieve it While some of them were feeling [the pain], they weren't suggesting that we remove it In spite of the outcries we're getting in other areas, I think we ought to try to balance that with [unintelligible] across the board  Are these numbers internally consistent?  You're going to specify the borrowing at-- "
1819,1981-02-02,WINN," Mr Chairman, I would like to join John in complimenting the staff for what I thought were the right procedures of really looking at what we have done and trying to learn some lessons from it One of the technical developments last fall, particularly, was the development of excess reserves Did we really ever focus on what happened on that to throw us off in terms of--  Well, I tried with our banks, and some of them that suddenly have acquired branches or tried to consolidate their holding company operations really got fouled up in their calculations But we didn't find a heck of a lot in our District; I've tried that And many of them who denied that they held any excess reserves, when they really got into their figures found that they had them So, sometimes it's a matter of their not knowing what they're saying  Paul, could I ask one more question? If we looked at our cyclical experience in the past where the fluctuations were wider than we would have liked, do you think we could have used various types of smoothing techniques, such as subsidiary targets-- whether you used credit or nonborrowed reserves or any of those things? Of course, our experience is very short lived But you do get some smoothing effect from that On the other hand, that's a [unintelligible], and other problems could arise  To try to eliminate the fluctuations In addition to using the procedures we had, if we had had a subsidiary target with respect to nonborrowed reserves or credit or any of those things to modify considerably your intervention points--  You get different intervention points  I don't know what we're voting on  The forecast falls out from our model and I think the question we need to ask is How good are the assumptions? One of them, as I understand it, is that you have assumed that there is no real change in the international situation I'm not sure that's a fair assumption, although I'm not predicting as Henry is that it's going to fall apart on us But that's one assumption Second, I think we've overlooked a rather basic change, which Ed Boehne referred to, and that is the change in psychology that has occurred in the last month, which may turn out to be false expectations I would mention the fact that advertising sales are really quite high The television chains report that they have sold out for the first quarter, which is really a rather surprising development given the pessimism in certain areas That has been a pretty good leading indicator in the past; it may not prove to be this time But if you talk to business people whom you would expect to be distressed and depressed, they're fairly optimistic Whether this is based on the psychology of a change in government and what is going to come out of that, and if it doesn't quite work out that way we will get disappointment in reaction, I don't know But the first half of the year could turn out to be a lot stronger than any of us expects Automobile sales could be stimulated by the [higher] energy costs rather than depressed, for example So,  -94-    2/2-3/81  I think one could make a case for a somewhat stronger outcome than the model  Well, you have quite an expository problem The only advantage I see is that now instead of targets [unintelligible] the Shadow Committee [unintelligible] I think continuity in exposition requires that we keep our numbers in line with last year as a starting point The only thing we can do honestly is to promise adjustments and information as it develops I think we have to give them, for instance, what the adjusted range would be at the moment in order to compare it with the figures as they are published because that's what people are going to judge them by And I think we have to be on record as recognizing that these targets are on the old basis--I don't see any way we can avoid that--and then promise that as adjustments and information develop you will be back to indicate what that means To me the difference between alternatives I and II is really not as important as is the recognition that we still are faced with the problem of trying to reduce the ranges I find alternative I acceptable Because of the continuity and exposition problem, I'd reduce the M2 and M3 ranges at this point We might have to go back and change that, however, as things unfold So, I'd be inclined to start with alternative I [for M-1A and M-1B], with 6 to 9 percent and 6-1/2 to 9-1/2 percent on M2 and M3 For bank credit we probably have to raise the range a little in light of market developments  In this wonderful world of exposition that we're faced with, are you troubled by the imaginary targets that we're setting out and then an imaginary short-term target that's above the ranges that we prescribed? That seems to me to become a difficult problem  That's why I'd like to come in at least between ""B"" and ""C"" I'd put a restraint on the funds rate being over 20 percent instead of-- "
1841,1981-02-24,WINN," Mr Chairman, this is Willis I have two or three things One is that we have one method now of addressing our base drift problem with these developments and we really didn't address that in our previous discussion Second is that loan demand is not off as much at the small banks, I think, as it is at the large banks with the shift into commercial paper, given the lagging prime rate And third, a technical way of achieving the same purpose--although I think it would be far more difficult to explain--would be to drop the band but at the same time raise the discount rate That would do almost the same thing, although it's more difficult to explain, that we'd accomplish with raising the borrowing assumption above the $1 billion base--    2/24/81  I think that's right, Paul, but it's another way to do it  Immaterial to me, Paul "
1867,1981-03-31,WINN," Mr Chairman, I feel that we're really trapped or tripped up by our own procedures We built in the expectation that we've lowered the ranges and yet we make no allowance for base drift in our targets  That's right That would be my point We're in the upper end of the old range even though we're below the range for the--  Well, that again is where we've tripped up If we start to adjust the aggregates for the transaction part of money market funds, that is clearly one thing It's not the total money market funds, but we see the transfers going through on our check clearing operations, so they are being used Second, we have RPs and Eurodollars and one can argue how much of that belongs in the picture And if we adjust the aggregates on a real M-1B or transaction type basis, it results in a much higher figure than we're reporting So, not only have we got our targets out of focus but the bullets [with which] we're trying to hit the targets all seem off to me We really have two major sources of confusion for which I'm afraid we're going to get beaten over the head no matter what evolves Add onto that a look at the economic analysis We have inventory certainly tight or under control; we have consumers who certainly have behaved far stronger than anybody thought they would, but they're continuing to do that; we've projected construction expenditures in office buildings, apartment houses, and hotels that really are starting to jump in a very big way; and we have the stimulus from the deficit that's certainly a pretty big one And we ought to recall that we've been projecting declines since 1979 Now, one of these times we may get that, but we're not sure we're going to get that So we're higher in the range than we think we are We're much higher if we adjust the aggregates And we may have a stronger economic picture than we think we are facing All of these factors give me pause as we start to set our objectives for the next three months  Oh, no, ""B"" to ""C,"" or something like that "
1889,1981-04-28,WINN," Paul, what does this do to M2?  Paul, do you get any indication of institutional stresses and strains?  I was just wondering if the interest rate pickup is going to cause panic in certain sectors  I agree "
1934,1981-05-18,WINN," One of the interesting areas is the steel industry, which is running currently almost at capacity How much of that is inventory building is not quite clear, but think about what would happen if automobile sales should pick up or--this is hard to determine--if defense orders start to flow to a greater extent than they have previously We'd have a really tight bind with respect to steel The second thing is that if you look at retail sales across the board, and they have been very strong, [our sources] all report that it is for top-of-the-line merchandise The bargain stuff isn't moving very well This is not a feeling of weakness in my judgment in terms of what is happening there One has to watch this comparison with last year--which is how retailers report sales--because of the credit crunch and the difference in when Easter falls and other things But retailers thought sales would tail off after Easter and they are continuing quite strong even through last week, which is a rather strange phenomenon The third point I'll make is that on John's point about office building and other kinds of activities we may have a bit of a booby-trap in this area in that most of those have been financed on construction loans without take-outs in some instances And the question is With the change in interest rates, what kind of take-out set-up are we going to have for some of these things? They went ahead with the buildings thinking that if they couldn't find financing, they would sell them We may have more for sale here suddenly than some people have expected And this is a financial booby-trap out there that may or may not snap at us  But that's with no change in the rate of flows in and out If we have any kind of increased disintermediation, that would precipitate it in a heck of a hurry  Mr Chairman, there are several things we haven't really talked about this morning, including the international situation, the Middle East, and a number of other things that certainly could alter the outlook very quickly A second point is that I'd be very happy if somehow we could get away from the check writing privileges on these money funds, because I think we are exposed there with the funds investing in issues that could go sour on them We may have more volatility built into this than we are thinking about The third is that we talk about targets as if they were fixed and we forget base-drift and a whole lot of history that goes into them I'm not sure that hitting the midpoint of our new range is what we really ought to be doing A little miss on the low side might be more helpful than misses on the high side I'm disturbed by the M2 and M3 figures, which tend to go on the high side in this set-up On the other hand, I have some sympathy with Lyle's point of view in that I'd hate to see us run the rates up and then run them right back down again That would not be very helpful in terms of our longer-run objectives To take a stance at this time, I would be content to be able to hit somewhere between ""B"" and ""C"" rather than to set a target and then be all over the lot in terms of our performance I, too, would be inclined to raise the borrowing objective to help move in that direction; I'd go to $21 billion or something in that neighborhood as a first move  Is it through June or to June, Paul? I'm worried about the lack of [unintelligible] "
1974,1981-07-06,WINN," Mr Chairman as I listen to this and think back over what we've had to read, I become more and more impressed with the fact that we are hung by our own petard in the M-1B concept If one really tries to convert that to a deposit category, and makes any allowance for the money funds and for repos, then the whole perspective changes One's whole interpretation and thinking about this changes I just think we are hanging onto something that is not very real I know the difficulty of trying to get rid of it, but it certainly--  It really alters one's whole perspective on this to think about it in a realistic sense  Well, I think one understands it a lot better if one thinks of it in terms of the behavior being somewhat different than reported  Sure You get a much higher growth rate if you convert this We talk to people who are using money funds for their deposits; they're banking the rest of it Something has to give  My thought is that if you change the measurement of what we call [M-1B], then you get a different behavior path And you get a different outlook on this whole history as well as on current developments  That's right  Mr Chairman, we've mentioned very little about wages, but we have the backdrop of the air traffic controllers, the upcoming post office [negotiations], and baseball as another indication of the popular mood on wages  I don't see much easing of inflation occurring It may show up But at the moment, with utility rates going up and the possibility of food [price increases], the mood in the public toward inflation easing isn't very evident Everybody is looking more for it to hold [steady]  My second point is that in talking around--I've been in the building game a little recently--builders all complain that they haven't had a chance to increase their prices in the last two years because of the status of housing They are all sitting there with [price hikes of] 20 percent or more ready to go anytime there's a little uptick in the housing area Now, this may be wishful thinking, but they certainly are not psychologically adapted toward holding the line Finally, all our scenarios suggest a smooth process developing I just think about all the uncertainties and the questions I don't think we have a year to go on the thrift industry before we start to see some major shifts of funds I don't know whether it will be people getting scared and shifting funds, or an acceleration [of flows] into the money funds, or a money fund going kaput Then we could wake up with $100 billion more looking for a place to go We may have major problems from crises and movements of money, which are going to impact institutions in a way we don't foresee And that's going to be the biggest psychological change to take place in the period ahead  Mr Chairman, I'm impressed with the power of the number We should remind ourselves that [when] we were sitting here a year ago and thinking about the future we forgot base drift in setting our targets If we go back and adjust for that and secondly if we adjust for the changes that have occurred in M-1B--and the Michigan survey, I think, does not include corporations' use of money funds in the transactions balance set-up--the adjustment probably is in the other direction [If] we were sitting around the table at the moment faced with the fact that we were over our targets, not under our targets because of the base-drift problem and the adjustment of M-1B, I wonder what our reactions would be I think we can get trapped by the numbers we're playing with here if we're not careful  Second, contrary to the view most people have expressed, I'd be very strongly in favor of changing our targets at the moment I think we're going to get trapped next spring if we don't Suppose we're successful in the sense of coming in at the lower end or less; that becomes our base, if we use precedent on this score Think what kind of adjustments we're going to have to make and to explain at that stage to make this fit any kind of economic analysis related to those that we've heard If we're not careful, we're going to be increasing our numbers in February I feel it's much easier to try to explain it now Also, if we set targets, we ought to try to shoot for the midpoint When we set targets and say we're going to shoot at the lower end or less, I think we're playing games a little Moreover, if we have to make an adjustment, I think it is easier to make it now and then not make one in February I think we have ourselves trapped by this annual review, particularly when we base it on where we are rather than on having some continuity in the series over time I'd be in favor of making the adjustment now and, if we're lucky, that would bring us closer to the midpoint of the adjusted range Then we would not have to make a change on an annual basis to make a continuous effort to achieve our inflation objective It seems to me that we ought to avoid getting trapped into basing our ranges on where we are and do it rather on a continuous series over time  I remind the group that we come back together in about six weeks, so we are not casting this in cement for the next six months I'd be inclined to somewhere between ""B"" and ""C"" with the funds rate range of 15 to 21 percent or something of that nature and $14 billion in borrowing "
2013,1981-08-18,WINN," Mr Chairman, we have been sitting around waiting for a recession to happen now for a good many years, and I couldn't help but notice driving down yesterday that Lordstown, which is one of the large GM operations, had probably the fullest parking lot I've seen in the last five or six years in terms of employees' cars  That's right This may just be a temporary build- up, which could be shut off quickly when the cars don't sell, but I was interested in the obvious employment there Secondly, I am surprised in talking with my business friends how few of them appreciate that the corporate tax benefits are effective in 1981, not 1982 They were effective on January 1, 1981 and we may have some realizations on that score that give rise to some activity in the fall On the other hand, when the realization hits of the size of the deficit inherent in the present tax and spending programs, we may get some reactions the other way based upon the amount of budget cuts that still have to be made, if they are going to be anywhere close to it  Just one comment, Mr Chairman I'm not sure I understand completely the economic implications of the redistribution of the retail sales figures, in which the upper end of the price range is the big factor in supporting sales and the lower end is having a real struggle When you add on to that the implications of the tax bill, I think we're seeing a rather widespread shift in the distribution of income and I'm not sure I understand all the economic implications of that "
