,Date,Speaker,content
490,1977-08-16,WINN,"  Was I the recording secretary?  Maybe I missed my role in this setup  I’m  not sure that I’m summarizing our meeting, Dave, but I have been impressed that the press  sometimes influences the thinking of businessmen [more] than their own appraisal of what’s  happened to them  I was interested particularly--when we were sort of probing with the steel  people, and they said, “Well, business is quite good but profits aren’t  But the order rate and the  tonnage and other factors are really quite good”  Now I don’t know how much of this is due to  the fact that the ore people are out on strike and it’s thought that the coal people will be out on  strike, but they have--    Earningswise--     But the volume is surprisingly good    Well, they hope to turn it around, of course  But if you don’t have volume  either, then you’ve really got problems     8/16/77 - 4 -            When you sort of probe--you can’t rent warehouse space, for example, across  the country  And part of this is this inventory increase, but there haven’t been any warehouses  built for the last three years or so  And my guess is that, if sales continue to grow, you’re going  to see a big move in this direction     Second, there are five major buildings downtown in Cleveland that will be going on the  board here in the next six to eight months  There are talks of office construction across this  country in various spots  And apartment [construction] is just on the horizon  But very little  available space  And with some change in rents and other factors, I think you’re going to see a  rather major move in the construction of multifamily homes  [To] pick up on what’s happening  in terms of the housing factor, I can’t see growing from this level, but probably it will hold on  this sort of basis  But I--    Yes  One of them is a state building; Standard Oil; the two banks; and a  private development    Just one  And so this is really a major change in the construction outlook, in  this sense of the term  They are all cautious when they talk to you in one sense of the term, but  you probe about their own business and it is surprisingly good    All of them are well fixed financially  They’ve really protected themselves  against the squeeze, so you’re going to get the expansion without going back into the financial  market  Their positions will take care of it    A question and a comment, Mr Chairman  We’re finishing the third year of  an automobile boom which has characteristically run in the threes  Now I don’t know whether  the change in the financing and the possibility that next year is the last year of the large car may  help sustain that to a fourth year  But if you go back in history, at the end of the three years of  successive increase--I don’t know, Bob, whether you have any feeling on the automobile market,  but their inventories are in pretty good shape    Yes    Yep  [unintelligible] term ’75 to ’77 is the end of the three-year cycle     A comment on the [stock] market, Mr Chairman  You’ve had the first boom in the early  ’70s; it was an individual boom  The second one was an institutional market  I have a feeling  that now you’ve got an insider market--that explains part of this sloppiness and a very great--     8/16/77 - 16 -            My guess is that a very much larger proportion of trading is done by people  that used to be on the floor and have gone upstairs and are trading among themselves  The  market itself is in very much disarray [as an] organization and you’ve got strange--I don’t know  all the answers to this, and the market is concerned about it, but they’re not willing to spend the  money to find out  A large part of the margin credit, I suspect, is insiders tied into the option  setup, and that’s a more explosive thing than I think any of us realize, what’s involved in this  leveraging  But a greater proportion of the trading is done by what I would call the professional  trader rather than the individual or the institution    Peter, do we have any feeling as to what the foreign sellers were doing with  the proceeds of sales of bills?    Mr Chairman, I have been studying the new math here, too, this morning,  and I must confess the relationship between the funds rate and ranges we have been given either  have no meaning or we are in a strange posture  Because should we pick the 0 to 6 as our range  for M1--that’s a median point of 3, which as I understand it would really call for a [6-3/4 to 7-1/4  percent funds rate] range  It’s just that if you got a 4 median, then you’ve got a 6  A 3-1/2 gives  you 6-1/2, and then a 3 median would give you 7 as the midpoint of the range, generally    So if we are going to be consistent at all, maybe we shouldn’t be, but it  seems to me that the relationship between the funds rate we are talking about and the quantities  we are talking about are inconsistent with the first presentation we had here this morning     I understand     8/16/77 - 46 -            I understand    Yes  Well, that’s a probably an accurate one  But I wanted to show what our  consistency would be--the 0 to 6 with a midpoint of 3 would give you a much higher funds rate  direction than we are showing here  My own feeling would be, stay with the B numbers and  quantities, spread the fed funds rate range to 5-1/2 to 6-1/2, with the realization that we would be  outside before we made our moves     I would take advantage of the market acceptance of what we’ve done and be prepared to  move the discount rate by a half [point]  I think we shouldn’t reward our sharp-pencil friends  who are taking advantage of us at the moment, not extensively, but I’m not sure this is the way  we ought to pass out the rewards  And I would like to see that [discount] rate moved first before  we did much to tamper with the funds rate above the 6 area, and see if we get any impact from  the first move  If we’re wrong, I’m prepared to move it down     I think it shows great flexibility in the quantities we get  We’ve been very successful  [with] the upward range, with a relatively [strong] market confidence being shown in it, and I’d  be prepared to push that if necessary with the discount rate moving first  And I’m like Mr  Kimbrel--I would have done it last week rather than this week, but that’s neither here nor there    A half, that’s right  And you’ve still got a differential there of 1/4 point   You don’t really have any market impact, except for a psychological impact showing that we’re  resolved to continue our fighting in this direction  And I’d be prepared to move that first before  I’d move the funds rate above 6, because I do think we need time to see that the impact has  worked its way through  But I’d keep the funds range there if we need it, and if we go out of  control again, I think you know the confidence that we built up can be lost just as quickly  "
516,1977-09-20,WINN,"  Mr Chairman, the two big uncertainties that hang over the forecast as far as  I’m concerned are with respect to the energy bill and with respect to the tax bill  The unknowns  in the energy bill have really held up major investments in transportation, mining, a whole series  of activities that really would give a tremendous impact if they could be unleashed  The whole  electric utility company construction [sector] has really kind of ground to a halt here  The bill  seems to be deteriorating as it goes through  I get more questions about this in certain sectors     And then the unknowns in terms of the tax bill really are showing up in investment  decisions, both financial and real, and I don’t have any idea when that’s going to be clarified     But those could be two major impacts to affect our projection  Some concreteness could  be added to this, and I gather you haven’t factored it into your fiscal projections or anything else  in terms of looking ahead    Yes    And I haven’t any idea how that’s going to come out, but there’s really more  discussion of this in terms of the consumer sector, the capital gains area, and a stimulus for  investment; and these are going to be major developments to affect the outlook       9/20/77 - 16 -   The third thing I’d mention is the status of the steel industry  Business is really better than  they talk about, in terms of their physical volume  [But] the profits are terribly poor  They are  facing up to fact that they have a very obsolete plant  And yet funds to provide the investment,  the incentive to provide the investments, and so on--now they are focusing completely on the  import situation, but I really don’t think that’s addressing some of the basic problems they have   The threats of really major shutdowns in Youngstown, Cleveland, and other places are very real   And as you know, there have been substantial cutbacks in employment in this area  So the fact  that the picture looks as good as it does [despite] some of these negative factors, I think is really  an underlying source of strength    Mr Chairman, thank you  To try to resolve the conflicting forces that we are  dealing with, and at the same time as a historian looking at our records, I had trouble getting  away from last month’s actions, with the economy not being that much different in outlook from  what we had  And so I would recommend an M1 range of 0 to 7, indicating some change,  recognizing reality  Keep a 3 to 8 or 8-1/2 on the M2 again, thinking of last month’s actions   And go to 6 to 6-1/2 [federal funds rate] [with a] 6-1/4 median, with the opportunity to use that  in the period if these ranges are not met  "
543,1977-10-17,WINN,"  Mr Truman, what element have you factored in with respect to the challenge  of steel dumping?  The possibility of some change being--    The last 30 days has seen a marked upturn in demands for motels, hotels,  office buildings, apartment houses in the insurance industries  Demand really has gone up  A  shortage, which we don’t talk much about, is the fact that the union bottlenecks with respect to  electricians, pipe fitters, plumbers, and that sort of thing  Before anything is started in  Cleveland, they’re reporting now that they’re fully employed  They’ve had a big hiatus, a lot of  people have dropped out of the unions, and you’ve got a big bottleneck here in the labor factor in  terms of construction    To a degree, but it’s always at a price and slow, and they’ve got some  problems--they shifted off in different areas  Our unemployment figures are very deceptive   There’s a big structural problem that’s not going to be cured by pouring money in there  And  then some of the other shortages--I think they’re going to take time to work themselves out     In the ghetto housing area, there’s real problems  We’ve used the mortgage device, I  think, quite foolishly, and we’ve financed people that really shouldn’t be in the private  ownership of homes  And people with incomes of $300 with 5 children haven’t any business  with $30,000 mortgages, in my judgment  I think society is going to have to find a different way  to house them, and there’s problems ahead for us, I think, in that sector of the mortgage market    Mr Chairman, just one comment on the consumer area  In the tire business,   the shift to radial tires led expansion of capacity  It’s also led to a rather high-priced tire  Now  the tire industry today is faced with big demand for tires both for new cars and for replacements   And the replacement demand has shifted rather dramatically toward the old bias tire, and they’re  now on allocation while your radials are evident  You see this, if you look at Sears and Roebuck  advertising and their failure to sell a high-priced radial  You see it with a major tire company in  terms of their sales here in the last two months  Now does this represent a shift in consumer  preference towards lower prices, or [a decision that] a [used] car that only goes 20,000 more  miles doesn’t really need a 50,000-mile tire?  But it’s a strange market     A comment, Mr Chairman  In terms of all the projections, you really  haven’t factored anything in with respect to the so-called tax revision law, or what have you, in  terms of--    One more comment  Several of our major companies in the area have at long  last released their string on capital expenditures after running overtime and a very tight ship and  all other means to avoid making the expenditures  But their demand has been so strong that they  are now planning rather major capital expenditures, and this is a change in the last 10 days    These are a couple of our major firms    Well, they’re electronic equipment and machine tools, this general area, auto  parts business    Yes, these are going to be plant expansions  They’ve done everything with  respect to improving tooling and that sort of thing to increase capacity, and they’re just faced  with market demand that they can’t meet without breaking water     10/17-18/77 - 18 -          Probably several years    Mr Chairman, I think my optimism is in part based on the hope that some of  the psychological malaise may be lifted  It’s a kind of a commentary on our times when last  week a New York Stock Exchange seat sold for $35,000, and a taxi medallion in New York sold  for $52,000  So our out-of-work brokers can’t even buy a cab  But I have a feeling that the  current market malaise is in part psychologically affecting attitudes in a whole range of areas,  and somehow I think that both the Washington scene and the New York scene may be clarified  before the year is out  And with those two lifted, I see greater strength than has been indicated in  some of these numbers  Now, if I’m wrong, they may pull down a greater segment of consumer  expenditures in some of these other areas and factor them into our forecasts    Mr Chairman, I’d like to note to the Committee that this is the period in our  discussion when time is standing still     I’d like to follow Chuck’s comments--    I’d like to join Chuck a little bit in looking backward, in the sense that we are  now making projections on assumed relationships, and yet we really haven’t accepted these  relationships in terms of the overshoot, in terms of any kind of future economic or price behavior  that I saw in terms of our projections that we talked about last night  And I think that raises  some questions for us  In view, however, of the process we’re going through, I’d like to urge us  to take a real thorough look at what’s gone wrong in our activities--that is, a reexamination of  our estimation procedures  I think we ought to take another look at our lagged reserve  procedures, and I don’t attribute a great deal to this, but maybe this is part of our problem here in  terms of control  Take a look again at our federal funds spread that we prescribe  Velocity has  impressed me as a rationalization for what happened, but I don’t find it a very satisfactory device  for estimating the future because I don’t really understand it in the sense of the term  So I think  we need to take a thorough look in this area  And in view of all the emphasis that’s placed on  the quantities, and in view of our overshoot, I think we owe it to ourselves to take a real  thorough look as to what’s happened, and I don’t feel we’ve done that     With the uncertainty with which we have factored in comments about our overshoots with  respect to future activity--whether it’s economic activity or prices, what have you--it seems to  me that we’re really focusing on the real issue as to whether perpetuating this is the right way to  go  But since we’re sort of hung with this at the moment, I would accept your recommendations  on M2 and M3  I would like to see a little recognition of the overshoot in the sense of a small  change in M1, just to indicate that we are cognizant of it  We’re really not changing; we’re  staying with what we were--all the uncertainties, but recognizing the overshoot    Mr Chairman, I am perhaps out of order, but I am concerned about the  behavior of interest rates in the period ahead and the implications of that, and yet I think we have  to react to what’s happened in the aggregates area in the past as well as our concern about what     10/17-18/77 - 63 -         the future projections would be  And I’d like to urge consideration of the use of this discount  rate as a way of buying some time, without basically changing the rate structure, [to get] a better  feel as to what some of these magnitudes would be down the road  Specifically, I would take the  B suggestions; I think I would prefer the [federal funds] rate span of 6-1/4 to 7, with action on  the discount rate first as a way of trying to temper this until we get a better fix with an aggregates  directive  "
569,1977-11-15,WINN,"  Mr Chairman, I concur in the feeling--explore the alternatives available to us  here to postpone our decision  But I join with Mark [in] a feeling that conditions have changed   We ought to think through more than just the directive problem, if this requires release, but the  implication  I have a feeling that the public interest in what we do goes far beyond the directive   And to the extent that we make that immediately available, then the whole discussion is going to  be required  And then the political activities involved in our deliberations, I think, will be highly  intensified as a result of this move  And we ought to think through what are the other  implications, not only just the directive aspect of what we release, but what this does to us in  terms of the economic anticipations behind this, and to what extent, then, you get greater and  greater focus on our activities from other groups as a result of this    Mr Chairman I think I am a bit more optimistic than the staff with respect to  the first half of next year  It seems to me the pickup in retail sales, and what we get in the field  in this area with the very tight inventory controls currently in effect, gives rise to a typical kind  of inventory cycle for next year to fill up the early part, together with the projected tax cut being  factored into people’s thinking as a prospect for keeping the consumer in our economy as a  strong factor for the first half of the year And [unintelligible] for the plant and equipment  expenditures to pick up, I think is a sobering cloud, and that probably will have to be dependent  on the last half of the year to have an impact  I think the first half of the year has a stronger  element in it than the projection    Could I piggyback on that question a bit?  Again, looking at this demand for  money and trying to use what evidence we could--using the demand deposit survey data, it looks  like consumers have been very stable in their holdings in this [unintelligible], with the very  violent swings in the financial corporation area  And you sort of scratch your head to see what is  really happening on this     11/15/77 - 33 -          Mr Chairman, I really have nothing to add  I would be in favor of widening  the [M1] range a little bit, 1 to 7--use this as an opportunity to get it expanded a little bit and stay  with the aggregates objective, not a money market  "
596,1977-12-19,WINN,"  I guess my comments are in the same direction, Mr Chairman  But it seems  to me that, with the small range, when we’re forced to move it, since we tend to be reluctant to  move until we are sure of the aggregates, that you’re going to get your next adjustment  instantaneously  And if you want to try to smooth that as a set-up, you are going to add more     12/19-20/77 - 19 -         reserves, which adds more to your quantitative movement, and I wonder if we don’t have less  flexibility in terms of really meeting our objectives  I would assume that your next step would  be up just another 1/4 point centered around the midpoint of where you’d reached  And you’d  actually get that instantaneously because the market realized that we’ve really gone beyond our  objectives in order to make the move  And then you’re going to get that, it seems to me, almost  at once unless you intervene  If you intervene again, then your quantity problems start     Well, wouldn’t you get it almost all at once this time?    Mr Chairman, in the energy area, I hope you’ll take another look at our  policy with respect to the export of reactors; that’s about a $9 billion market    But this is big for our domestic employment as well as for the balance of  trade    Oh, more than that     I think they have a much bigger figure than that    And then you’ve got $9 billion in export trade involved      That’s right  That’s all going to Germany and France; it’s going ahead     12/19-20/77 - 42 -          What about a 10 percent increase    Mr Chairman, I associate myself with being somewhat more optimistic than  the staff in terms of the outlook, with a couple of flags, one of which has been mentioned--the  automobile area  The parts people and the accessories people are not as optimistic as the basic  manufacturers in the outlook for automobiles, and I think that’s something we need to watch   The second problem I’d mention is the inflation problem, which may be underestimated by the  staff in terms of what’s happening in costs--steel, coal, and a number of raw materials are  starting to go the other direction  And then the basic Social Security, minimum wage, health  costs  It looks to me like state taxes may be going up, too, rather substantially, because of school  and other problems across the country  And I wonder if the cost-push may not hit us next year   We have been lulled a little bit by our favorable inflation experience this year, [and] this is of  concern, I do believe, as we look ahead      Mr Chairman, I’d associate myself with John’s comments, that I would be  happier if we could lower the range of the aggregates a little bit; but I find your suggestions  acceptable  I’d like to make one point, however, that we’re placing an awful lot of emphasis on  the aggregates numbers  And I must confess, I get nervous when we get a decline during a  period of rapidly expanding loan volume and rapidly expanding business activity  And  somehow, intuition makes me wonder about our numbers even more this time  And yet I have  no way of--    Yes, that’s correct  I mean, when you see this expanding loan volume and  expanding business activity, and here we are getting a negative number, which makes me--    I know, but it still makes me nervous    I know; it happened in reverse  That makes me nervous about those  numbers, too    I don’t know    I hate to interrupt, but would you care to comment just briefly on the legality  problem in the discount rate area?    It has to be corrected, that’s all  "
637,1978-01-17,WINN,"  Mr Chairman, I have several comments  First, I’d like to urge us not to get   trapped in the traditional kinds of statistical reporting--particularly in the housing area, which has  been quite crucial to developments to date, with home modernization and repair still representing a  rising and major portion of the total  To the extent that new housing starts may turn down, I think  it is crucial to know what is happening in modernization and repair because it’s really the total  expenditure in [the housing] area that determines what is happening  As you know, the figure is  now $33-35 billion in [the modernization and repair] category and I think we just ought to  incorporate that into our thinking about what’s happening in this area     My second comment is that I haven’t any quarrel with the sort of traditional kind of approach   we have for an analysis but I suspect it won’t happen that way  In the last two weeks, I have noted  perhaps the biggest change in sentiment, if psychology means anything in terms of future behavior  I can’t tell whether it’s the weather, the stock market, the foreign exchange market, newsworthy  developments, inflation, or concern about what’s happening here in Washington, but there’s a very  marked change--with people who didn’t think they would cut back on plans, planning to cut back at  the moment  Now, to the extent that [sentiment] can swing that fast negatively, it can also change     1/17/78             30  the other way   And, unlike Phil’s view, my feeling is that we may not get quite as robust a first  half in spite of the momentum we have  And if psychology changes as a result of the market  outlook or peace in the Middle East or a thousand external events that really aren’t factored into  these [forecasts], you have the basis, I think, for maybe the reverse--for the second half [to be  stronger] as contrasted with what the economic analysis will tell us here  I’m surprised and  puzzled by the very sharp change in sentiment that Mark reflected in part in his comments, but the  feelings are quite sharp and they tend to spread very quickly, as you know      Mr Chairman, in attempting to follow what’s going on, I got lost over the   year-end  Was there any change in the way we calculate these numbers?     Yes, the money supply     I didn’t know whether we lost part of the year-end in January or it came back to   December or what  I wondered what happened there  This was probably my ignorance, Mr  Chairman      Yes, maybe  I am concerned about the disintermediation as an adjustment   factor here ahead, so I think I’d be inclined to go with “B,”--3 to 8 and 5 to 9 percent [for the  aggregates ranges ] and 6-1/2 to 7 percent [for the funds rate] this month, with an aggregates  emphasis    "
