,Date,content
214,1988-03-29," I have just a couple of comments, primarily based on some conversations I had with people in the auto industry Friday and yesterday As I looked at the general statistics, I thought the consumer looked as if he or she was pretty tight-fisted Certainly, the retail sales look that way; the consumption numbers for the last five or six months have looked that way, I believe People point to auto sales as some sort of exception, but at least the people I spoke with in the auto industry are not putting that kind of interpretation on this What they are saying is that they had to put incentives on 75 to 80 percent of their lines because they were sitting on this tremendous inventory, the dealers were squawking, and they had to help move the inventory out In connection with all this effort, they actually reduced inventories by 58,000 units between the end of January and the end of February We seasonally adjust and we multiply everything by twelve The dealers who are holding the inventories are paying interest on actual numbers; they don't get seasonally adjusted Anyway, there is this feeling that they have to move these things and that there is a big advantage these days to keeping your production lines running because your workers are happier and your suppliers are happier The auto industry has excess capacity these days, and therefore, the pressure is really on them to do everything possible to move these units I sense that there is real fear about what might happen if and when they remove some of these incentives; they don't  -49-    3/29/88  seem too eager to test the market real soon In connection with this, the production schedules are looked at each week They did announce some higher schedule amounts for the second quarter They look at these on an ongoing basis, though, so they are not stuck with the higher numbers if they don't believe the numbers are consistent with the sales results Also, in the context of the room in this economy for producing for export, when you nail down some of the numbers, it makes me think that we have more room than some people realize For example, one automaker is talking about a big increase in export opportunities for a certain make that we export to Europe 400 units this year and 1200 next year That's a mammoth percentage increase; I can't do it in my head But, in fact, getting 400 units this year and 1200 next year on the kind of base that they're talking about here is not going to cramp anybody's style or their production facilities Finally, I checked with two of the big three automakers on the price pressure issue and said ""I'm reading all this stuff in the paper; what's really going on?"" One of them, who had just talked to their purchasing agents last week, said that in terms of what they are actually paying, they're not seeing this I think the difference is that we are confusing what is happening to some of the list prices and what sharp purchasers are paying  My final point is this let's say the price of copper rises by a nickel That is a tiny percentage of the total cost of a lot of products There are all sorts of things that we [consumers] pay for, like utility bills and labor and so forth; so I think you have to keep this in some sort of perspective before you assume that the increase in copper prices will be approximately the increase in the CPI I am still not convinced that we are about to go lickety split at 90 miles an hour I hope you can convince me that there is more strength there than I am able to find so far "
239,1988-05-17," I'm in favor of ""B"", including the idea of adding $100 million to the borrowing target eventually, for many of the reasons that the Chairman mentioned The main reason is, again, that we have had these two tightening moves in very recent weeks and I'm not sure that the markets have fully digested those moves I'd be very surprised if the real economy has taken them into account or if the monetary aggregates have begun to reflect them Also, as I mentioned before, I think we ought to pay some attention to the stock market I think there is a lot of nervousness still there, at least among a lot of institutions In many cases, institutions and small investors have taken a walk I haven't heard anyone mention the thrift industry, but I think that that's a disaster area, and something we have to pay attention to Bob Boykin, I'm sure, can speak to that, as can a number of us; and too much tightening too soon, I think, would make it a greater disaster I can't imagine that the LDC debt situation would improve dramatically if we tighten too much Also, as I read that table on the growth of the monetary aggregates, it seems to me that those aggregates are expected to slow whether we go with ""B"" or ""C"" And I still think that some inventory correction is in the cards I don't know when it will be--I'm not that smart; but I think there is some excess there that is going to be worked off In fact, when interest rates get higher, it just gives business people stronger incentive to run with less inventory I could live with the asymmetric language as well I think that summarizes it   I just have one question   I read these papers with great interest Would it be possible to run something like this off the shelf? In other words, not publicly announce that we're going to change, but act internally here as if we were trying it for six months, and just sort of simulate what the decision-making process would be?   [We could try it] between now and, say, the end of the year or something like that; and if it did turn out to have real working potential, then put it in the Humphrey-Hawkins [report] next February   It's better than looking backwards, which is what you're doing statistically   Yes   Well, it's just an idea   Probably three days "
287,1988-08-16, So move it   Second 
288,1988-08-16," Mike, could you elaborate a little bit more on the interest rate outlook pattern? I know you mentioned fed funds are expected to reach 9-1/2 percentby next spring, and I think you said long-term Treasury bonds, 10-1/2 percent It's hard to hear this morning at this end of the table, but I think you said 10-1/2 percent by next spring Are you suggesting that this will be the peaking of rates for this cycle or that this is just sort of a run?   How about mortgage rates? I noticed in your commentary you indicated that you think housing is probably number one on the hit list, as we tighten further But when I went through and looked at some of the forecast numbers I didn't see really major downward revisions So, maybe you can tell me what kind of mortgage--   12 percent   Big tax increase   I have just one comment and a couple of anecdotes that I've picked up in the last few days The comment involves the drought-adjusted real GNP growth figures I too found these very interesting, particularly to see the amount of deceleration that it shows over the fourth quarter That's really dramatic--from 38 to 18 percent So it does paint quite a helpful picture Also, one thing I haven't heard mentioned in connection with the drought is the  -22-    8/16/88  fact that it motivated the people down the street here to rain about $39 billion on farmers in the form of cash That ought to do something for somebody  On the anecdotes, a number of people in home building have expressed to me concern about the latest upward move in interest rates I would say that their numbers are somewhere around 100 thousand to maybe even 200 thousand starts a year more pessimistic than what we are showing Also, one of the things that has been pointed out to me involves defense spending and the impact of this investigation that's going on here in Washington--looking at the [unintelligible] and procurement process--and what this means as far as the slowdown in the actual granting of new defense contracts and also the payout of some existing ones This may help your area, Frank; it gets a lot of this money up there  Also on the export side, a number of manufacturers are very concerned about this rebound in the dollar because they were just really moving forward to emphasize exports and to gear up for producing more products for export And now, as they see the dollar rebound, they're concerned that maybe they'll get geared up just in time for the market not to be there I think that that is something certainly to look at, particularly any increase that's above today's already higher levels And the final thing I've picked up is in the consumer area I was talking to a couple of days ago, who told me that the only strong area there was sales of air conditioners; you can all figure out why that has been the case And the sales of lawnmowers have been very weak   Snowplows are coming up   But it is sort of interesting that that was the exact comment made This person also mentioned the concern over the consumer debt burden and what that may do in the future, particularly if economic growth does slow dramatically I believe that some retailers are looking at this variable-rate loan issue and whether or not the higher interest rates in the market feed back into the consumer budget more rapidly, because even though ARMs are often adjusted only once a year, the variable rate credit cards and the home equity lines often are adjusted monthly Therefore, we would get a more prompt feedback And I know there is some concern out there that that would be another source of restraint on consumer spending So, that's just a little bit extra on anecdotes for you Thank you "
289,1988-08-16," I can certainly accept targeting a borrowing figure But it does concern me when the fed funds rate whips all over and then that confuses market participants But I think the way to fix this--maybe we can discuss this issue at some future luncheon--is to release our minutes more promptly so people will know what we are up to Then they wouldn't have to be going through all these little subtle signals trying to figure out what it is we are really doing And, you know, if the fed funds rate goes to 9 this afternoon at 300, some people are going to suggest probably that it's there because we put it there They won't know I think that getting the information out more promptly about what our policy moves are would help to calm the markets down and would really eliminate some of this confusion   Well, I guess I'm a ""B"", $600 million today It's not a new [unintelligible] First of all, I think the discount rate hike did catch almost everybody in the markets by surprise Everyone is on vacation, and I don't think that we've had the full impact, particularly in the stock market Also, we've had several rounds of tightening so far this year and I'm not convinced that all of those have been felt in economic activity yet Also, I think the foreign exchange markets are very, very important to this process And I would want to be sure that we didn't get the dollar moving so rapidly north and get it so strong that it would impede our ability to fix our trade imbalances I think it's important to get that done over the long term  I do believe money matters and I think the monetary aggregates--particularly M2--have been looking quite good, behaving very well In connection with that, I would go along with Wayne Angell's idea that we move it up I'm not sure that today I'm willing to put it in spot number one, but I am willing certainly to move it up [in the directive listing of factors] Some of the indicators of inflation and inflationary expectations, I think, look better than they did a couple of months ago, particularly looking at prices of    8/16/88  such things as gold, oil, certain commodities And I realize we have a weak producer price index and some of those, but I think the more sensitive price numbers are not looking necessarily worse As I said, I would go for a $600 million borrowing target, and I guess I would prefer a symmetrical directive, but I can certainly live with an asymmetric one "
339,1988-09-20," I have basically two questions One is, if we don't get the dollar coming off from existing levels, what will that do to our ability to produce these kinds of net exports?   Do you want to do them one at a time or do you want to do several?   Some business people are concerned about their ability to be competitive at existing levels, but maybe that's not a predominant view My second question is one involving a statement in the Greenbook that staff continue to believe that additional pressure in financial markets would be required to slow the expansion, etc And I guess this goes to Mike Do you think you've seen the full impact of the tightening moves that we've had to date?   Thank you   Can't be or you'd get in trouble   The most intriguing information I've had since the last meeting didn't come from an economist or businessman but from a psychiatrist who happened to be sitting next to me on an airplane coming back from Boston He was writing madly and I could see the word depression, so I thought he was one of the crackpots who writes the doom-and-gloom books about the end of the economic world After a few minutes we got to talking, and I discovered that he is a psychiatrist specializing in depression But the useful information to me was that as he counsels people, one of the first things he asks them is for information about their spending habits, particularly the spending that they do using little pieces of plastic And what he's discovered is that this is one of the early signs of depression--that people go out on these big spending sprees They buy cars--no, seriously--that they can't afford   I'm not smart enough to make this up They buy cars they can't afford, do all this spending, and run their cards right up to the limits--and this is just before they go over the edge So we decided that based on what he saw and what I had seen in the statistics that there are a lot of psychos running around   Yes, that's right, he's doing okay In that con- nection, though, anyone I speak with other than him suggests that consumers as a whole aren't on a big spending spree So I guess my view of the economy is a little less optimistic than the staff's  Also, on the housing side, some of the realtors I've spoken with suggest, first of all, that the recent increases in mortgage rates haven't all been felt; and, secondly, that consumers are beginning to react to the high prices on new homes Also, in certain parts of the country, like Mr Parry's enlightened California, there are these tremendous restrictions on growth; and it's very difficult to get lots on which to build houses despite the whining about the housing shortages So I think that our forecast on housing starts might be a touch high  -16-    9/20/88  Finally, as I think I hinted in my discussion with Mike Prell and Ted Truman, I'm a little less certain that we're going to get the export improvement that we are forecasting I would certainly like to see it because, while certainly some companies are still competitive at existing exchange rates and in [scenarios] that involve a slightly cheaper dollar, I don't think everybody is And that concerns me So those are the three areas where I guess I differ from the staff Thank you "
340,1988-09-20," You can include me, too I just want to mention one other thing that I haven't heard commented about this morning, and that is the risk to the thrift industry That industry is already very weak, with many institutions on their backs And a further significant upward movement in interest rates, as the Board staff presentation yesterday showed us, would add significantly to the number of insolvent institutions around So I think that's just another good reason for sitting tight Thank you "
402,1988-11-01," I want to make a different point, because I don't know how presidents feel, not being a president But I can tell you, if this were done right now, the media would pick this up and say the Governors are trying to get rid of Bob Forrestal because he's a ""meanie"" from Atlanta And we're changing this arrangement to get rid of certain people I can just see it   I didn't say whether that was true or not    11/1/88   Seriously, the media would just love to pick up this us-versus-them routine, and while I haven't seen the us-versus- them at work [on the Committee], this would be something else that they would seize on--on top of whatever other considerations there might be So I'm sure you can't keep this quiet   I just have a question; I hope it's a fair one What if you had done this project 40 years ago, and ran it and established your equations, and so forth, would that have given us good guidance going forward?    11/1/88   So this relationship would pick that up? Because often I see econometric models that cheat They have the advantage of what has happened, and they go back and say, well, this really would have worked Whereas in fact if you had done it earlier, it wouldn't have worked But this doesn't--   Thank you   I just want to make sure I heard you right This is the first time I believe I've heard the election introduced into this analysis of what's going on   But I haven't heard us discuss that here in terms of what, in fact, it would be   Okay   Yes, but I'm just saying that this is the first time I've heard this even   That they expect some tremendous change after the November   Well, that's the day of the election   Thank you   I'll move it   Second   This is just a fundamental question The day that this bridge loan was announced in the newspaper, I happened to have breakfast with a Congressman from the House Banking Committee and he said, ""What in the world is the Federal Reserve doing in that? Why would they be involved with the bridge loan?"" And I didn't know how to answer, I'll be honest with you And then, secondly, there were a couple of articles in the newspaper shortly thereafter that indicated the conditions surrounding this loan were so much different from the bridge loans in the past I would like comments on both of those   Well, I guess he thought the Treasury would be involved; I don't think he thought it was inappropriate for the country   Thank you   Yes   Well, maybe this is what we're talking about!  SPEAKER(?) It doesn't look too great, like the economy certainly-- "
403,1988-11-01," Just two quick questions On the assumption about where we'll have to put interest rates over next year, you said plus one percent on fed funds between now and the end of next year, is that right?  -28-    11/1/88   Okay, how about the long rate?   Also the same, whether it's long governments or mortgages?   Run this by me again I think I asked this question last time; I'm getting more dense by the minute What are the underlying demand forces now that we're really trying to dampen, knock in the head?   I guess I just have a slightly different view of life in the streets Thank you   I read the Beigebook this time with great interest and all the comments about signs of slowing business I certainly agree with that I also think it will slow next year even without additional tightening I have been checking a great deal with all kinds of firms that actually deal with consumers, and the story is consistent that consumers need tremendous inducements to buy, a lot of coaxing; competition is fierce all over Also, if you look at the inventories expressed as inventories-to-sales ratios and do it in constant dollar terms--I'm thinking of the chart that I get from Goldman-Sachs all the time--it shows inventories are not in quite such good shape as I think we're assuming they are Also, if the sales part of the ratio weakens much, then what look like acceptable ratios can quickly become a touch high Also, with regard to business spending on equipment, I'm again hearing more and more decision makers comment on the uncertainties they have over future tax policy as we hear more and more talk about fixing the deficit and I think that that in and of itself is going to put a damper on this kind of activity Also, questions [they have] about sales prospects in their own businesses I think will tend to support that sluggishness On the housing side, I agree that sales of existing homes have been strong, but I also know that many realtors have been out beating the bushes telling their customers to buy now because home prices are going to rise and buy now because mortgage rates are going up And I think that there's some of that in these good results for the last three or four months  Also, I'd just like to take a minute to report on an interesting meeting I had yesterday with some Fortune 500 kinds of business people They had an interesting main topic of conversation, because they chose the subject of corporate takeovers That was their big interest, and I guess I shouldn't be surprised that one of the interesting things that came up was the notion that there are almost con-man types who are out running around and will actually go and approach management at very big companies and tell them if they go for one of these deals we will guarantee you so many millions of dollars,  -37-    11/1/88  etc And so these people are actually trying to play, I guess I'd almost call it matchmaker, before there is any action of another type taking place But there is great concern and the more thoughtful ones I believe were also talking about these two recent heavily publicized deals and saying that, sure, the debt can probably be serviced but that would mean that the cash that they thought they were going to have for R&D expenditures, privatization, etc, would be drained off from those good projects and would have to be used for debt service I think they were quite concerned about that The second big topic of conversation was this new National Economic Commission and they were very eager I'd say for that group to get its deliberations done and announce the results on December 15th And I think their expectation is very high, in fact so high that afterwards a fellow who works for  and has been attending these NEC meetings with him came up to me and said ""I just want to warn you, don't be too optimistic because first of all they're not going to have the report by December 15th; secondly, there's no guarantee they'll even agree among themselves on how to do it"" And, therefore, he thought that there might be some disappointment with the results And then finally, some of them did express some concern about the outlook for next year and whether or not the economy would make it through a seventh year of recovery But overall it was very, very illuminating   Did you talk to your retailers?   Did you talk to your retailers?   Oh, okay   Okay "
404,1988-11-01," Yes, I'm certainly willing to stick with alternative ""B"" I would note that my remarks about signs of less robust business growth and the performance of monetary aggregates have been pointed out by some others as well I don't think anyone has mentioned that there are financial market participants who thought, as of a couple of weeks ago, that we had tightened monetary policy somewhat when they saw the federal funds rate creep up to 8-1/4 percent or above So I think I can vote for alternative ""B"" but I feel fairly strongly that there should be symmetric language rather than asymmetric And if the $600 million borrowing target were to mean a federal funds rate of 9-1/2 percent, then I would have a problem with that   I wasn't sure   Yes, can I abstain? No, last time I went along with it and the asymmetric language even though I didn't want the asymmetric So, this time I'm willing to go along except that I have such a problem with the asymmetric I think I will dissent, since I can't vote 50-50  -50-    11/1/88 -51- "
458,1989-03-28," How about Cleveland?   Is New York okay for a second choice?   Second    3/28/89   I just want to make sure I understood your comment about intervening and the Ministry of Finance Do we have a deal with the Japanese that we will not intervene unless they [agree]? What if we reached the point that it was in our interest to do so and the Ministry of Finance was still balking?   It was too subtle for me   Just looking at their gigantic trade surplus vis- a-vis our own situation, it seems that at some point we'd have to ask ourselves what is in our interest rather than having the Ministry of Finance decide   There was an article in the paper about Salomon Brothers taking big hits in their government trading   Given their level of expertise, etc, and what you said about the people in the markets expecting us to tighten further how could they possibly have taken such gigantic loses?   The only reason I mentioned Salomon Brothers is that that was the firm that happened to be featured in the news item But I imagine--   Thank you   Second   I would have "
459,1989-03-28," Maybe you can get rid of some confusion I have I always thought that the housing industry was very sensitive to credit conditions and interest rate movements, and so forth I see what has happened to interest rates in the last year and I hear the forecast of another percentage point to be tacked on, yet I see housing starts for the calendar year 1989 actually estimated at a touch above calendar 1988--if I'm on the right line, it's 1-1/2 million versus 149 million And then the following year it's 144 million, with the weakest quarter not being any worse than 143 million I guess I just need to have that put together for me How, with these interest rates, would you think that the home construction will not be any weaker than that?   Assume everyone's moving to California--is that it?   Yes, but the others-- "
