,Date,content
460,1989-03-28," My preference is for no change, which I guess is ""B"" with symmetric language As has been said by a number of people, we have had a substantial tightening over the last 12 months or so; interest rates have risen rather dramatically Because of these known lags, much of that tightening has yet to be felt by the economy Also, as Manley said, there have been some signs of slowing I personally would argue that there's going to be some more coming, particularly in housing and in the auto industry I haven't heard it mentioned but I think that the thrift situation is something we should be aware of, if for no other reason than we could easily do something that would make the cost of the bailout quite a bit higher Also, despite the Brady plan, I don't believe we've solved the third world debt problem; maybe it's coming but I don't think it has been done Too much additional tightening, I think, could negatively impact those third world nations Finally, I'm very concerned about the dollar perhaps not performing as Ted and his people think it will--that it will stay strong and that that will prevent this export expansion that we all want which, in turn, will make it even more difficult to narrow our trade deficit So, for all those reasons I would prefer to sit tight and have symmetrical language   That being the case, I'll say no "
523,1989-05-16, I will move them   I'll second it for you 
524,1989-05-16," I have three questions I may have missed the answers On the technical adjustment of the borrowing target from $500 to $600 million for alternative B, what do you think the fed funds rate would be if you didn't make that adjustment and you stuck with the $500 million that we currently have?   Sure   Do we have an alternative for no change in policy? It seems to me that what we have is an easing, which is ""A;"" a slight tightening, which is ""B;"" and more tightening, which is ""C""  -33-    5/16/89   But without even looking forward, doesn't the fed funds assumption in alternative B, at least in a relative sense, represent some tightening? I say that because we've already seen, as I read the numbers anyway, quite a significant decline in short-term rates And if you--   I'm sorry; I was up [on the Hill], having had a date with a couple of my Congressmen   I think you answered my third question when you talked about what the market impact might be in the future if they, in fact, are expecting an easing If it doesn't materialize--or I guess even more importantly if they're expecting an easing and then something registers as a slight tightening--I would imagine there would be even more of a market impact   Right   Thank you   I'm for no change and, again, I'm trying to figure out what that is To me it's either ""B"" with $500 million borrowing or something between ""A"" and ""B"" anyway, with symmetric language The main reason I feel this way is that, as I read the economic statistics for the last couple of months, I think there are growing signs of some sluggishness or slowing, particularly in housing and auto sales The first-quarter figures for real GNP are expected to be revised downward, according to the staff's briefing yesterday The second-quarter [growth rate] is expected to be coming in below 2 percent, which I don't view as particularly strong Also, we've done quite a bit of tightening over the past year or so but I don't think the tightening moves--particularly those taken at the beginning of this year--have been completely felt by the real economy I think there's some chance that fiscal policy is going to move at least modestly in the direction of restraint As for the monetary aggregates, Don Kohn yesterday told me that I can start paying attention to them, so I'm going to; and I think they look sort of weak, both currently and looking forward, based on their growth from the fourth quarter of 1988 to date Also, I haven't heard a lot of discussion of it, but I'm very impressed with the terrifically strong dollar--the fact that it's at its highest in over two years I'd like to see some manufacturing survive in this country and, therefore, I would hope that we don't do anything ourselves to make [the dollar] still stronger Thank you   With $600 million? "
582,1989-08-22," I just have one question about profits As I've read some of these profit reports the last couple of weeks, basically, it just seems to me that for the second quarter of the year there are a number of very soft stories that came out Now, maybe they weren't  -17-    8/22/89  any softer than we expected; I don't know But I just wondered if in fact there is a significant deterioration showing up, particularly in the high-tech area That was the one that surprised me the most And I wonder if the aggregate numbers forecasted here are sufficiently weak to reflect that   I know you don't like me to look at quarterly numbers, but I'm going to do it anyway It seems to me on a couple of these quarters looking ahead that you actually show a slight increase in profits--for example, in the fourth quarter of this year I don't mean as a share of GNP; I'm just looking at the corporate profits with IBA and CCA adjustment   Yes, I knew that   Right   In the third quarter of next year, also, you have the decline stopping and a bit of a rebound--or more of a rebound than in the fourth quarter of this year   Don't you think, though, that this profits story is tied into the inflation numbers? Many of these higher costs-- whether they're wage costs or something else--because of the competitive environment are having to be eaten by the organization And where it's coming from is out of profits   In addition to just the cycle [phase]   Thank you   It hasn't yet?   Oh   Are you talking about cops?   I'll warn you that my views were colored by conversations with my brother last week who happens to be in the construction business I asked him how things were going and he said pretty good The latest big project he had signed on for was a new bankruptcy court in southern Arizona! Anyway, that aside, I do agree with the comments around the table about the deceleration that is showing; certainly, the Beigebook referred to it and the Presidents here have alluded to it, and a number of individuals I've spoken with suggest the same thing I have a little difference of opinion about where we're going I think we are going to see more slowdown, despite the fact that there have been some upward revisions and some surprises in certain of the statistics for the last month I don't think that establishes a new trend by itself A couple of things concern me greatly and one is in the housing arena Again, I realize that starts have shown some uptick the last two months but the real estate markets in more and more parts of the country are weakening Builder friends tell me that eventually that does show through to new construction It certainly impacts the attitudes of developers and builders Also, I'm sorry to be unduly cynical, but I have an awful feeling that when the RTC gets rolling they are not going to make this any better The markets are already having problems and I think the RTC is going to turn it into a worse disaster and probably create new problems where there weren't problems   Well, okay In the auto area, once these new 1990 models come in, if any people can be pulled off the streets into the showrooms to look at the cars, I think they're going to fall flat on the floor when they see the stickers I understand the adjustments that were made in trying to price the comparable options and accessories I understand all that technical stuff, but for the average person who walks in all they know is that the bottom line is that they are going to have to write a bigger check to get a car-- whether they want air bags or not they get them And I think that will discourage numerous people Also, there have been a lot of cars sold in the last 5 or 6 years and there doesn't seem to be any real demand stacked up that has been unfilled When I read that sales of light trucks are now starting to show some weakness, that gave me some concern because they have been extremely strong We had some plant closings announced in the area of heavy trucks--Si Keehn alluded to that One of the major producers of heavy trucks, had a pretty negative report out on what they were experiencing And I personally believe we're going to see some more of that looking ahead  -38-    8/22/89  Even using our own statistics on exports, it looks as if they are not going to be exceptionally strong I believe we're going to see less strength there because I'm not convinced by Ted that the dollar is going to perform as he thinks Even though we have the trade deficit reaching its low point in the second quarter of this year and then getting worse, I think it will probably get even worse than what we're showing Putting this all together, and also adding to it the concerns that Mike Kelley mentioned about the impact of a recession on many of our other problems, I certainly think we ought to be very, very sensitive to what's happening and to balancing these risks between inflation and recession--particularly when the inflation numbers do seem to be looking better I really believe that there have been some major behavioral changes out there in the real world that are going to help to make the inflation numbers come in even better than we're now talking about Thank you "
583,1989-08-22," I can support ""B"" if it has asymmetric language with the tilt toward some slight ease between meetings, because I do think that the economy is going to move in one direction or the other from where it is now and is slightly [more likely] to go toward the weaker side rather than the stronger Also, I'm convinced that we don't want the dollar to strengthen a lot more, even though it might produce good inflation consequences It would be very bad for our export industries and our ability to cut our trade deficit "
644,1989-10-03," I'll move it   Balance the budget, of course, Jerry   I just want to say two things, primarily because I've been one of the people concerned about the strong dollar--not because I don't like strong dollars on the face of it--but because I've been concerned about the impact on our manufacturers' ability to produce or to export But having said that, I don't believe the way to get the dollar down is to bomb it through intervention I think the best way to do it is to deal with it in a monetary policy way even though the [unintelligible] said we don't believe in that, I do In terms of Manley's concern over the possible market impact of this bombing effort, I think the reason we haven't seen it yet is that there are many people in the markets--maybe not in New York but in other parts of the markets--who really do think that there will be some monetary policy follow-up to this bombing And if that does not occur in the next couple of weeks, then I think we're going to get the bond market impact etc, in spades So you can write that down as woman's intuition speaking Thank you   What happens if they are not ratified?   Just abstain "
645,1989-10-03," Is that because   I thought he supported all expenditures that went into that area   Oh, excuse me   I can't worry about where we're going in two years because I don't think most of us can forecast even two quarters ahead let alone two years ahead Looking a couple of quarters ahead, though, I do think that the slowing that we have seen is going to continue What concerns me greatly is the weakness that I see in various manufacturing areas And the weakness in manufacturing, I think, is more serious than the overall weakness The Purchasing Managers' Survey for the last five months or so has indicated this slowing; I have other sources of information as well Just to repeat a couple of things that Si Keehn said about the auto industry using the current production schedules for the fourth quarter this will be the weakest fourth quarter since 1982 and you may remember that 1982 was not exactly a hot year for autos Even if you pick up the transplants which, of course, have become very big and very important over this last seven years, it still will be the slowest fourth- quarter production since 1982 Frankly, one of the reasons two or three of the auto manufacturers have announced incentives for their 1990 models even before they are readily available is that they are so nervous about the weak demand In some cases, they do not have enough orders even to start their plants running to produce the 1990 models So, I think the people who looked at the August auto sales numbers and read them as a sign of strength got the wrong message It was end-of- year close-outs that they really pushed It's just about 180 [degrees] away from a strong story; it's a weak story  Also, if interest rates actually perform as the Greenbook assumes--if short-term rates are basically flat during the year ahead and long rates rise slightly--I'd be very hard pressed to expect housing to improve Maybe I'm missing something and maybe consumers are interested in buying more, but the builders--at least in the builders' survey that I read--are feeling rather negative That's particularly true in parts of the country that have been alluded to here earlier The export situation really has to be watched I think the strong dollar that we have seen over much of the year, until the [unintelligible] began recently, has had an impact on export growth; I believe it's going to have an additional impact because there are long  -34-    10/3/89  lags involved here Also, there has been a rather significant deterioration in profits going on The IBM announcement a couple days ago of disappointing earnings in the third quarter and expectations of disappointing earnings for the full year, I think, is a great concern They have announced that they will offer early retirement to some more people, which is not exactly very IBM-like If you read the press release carefully, it mentions that the strong dollar was one of the things contributing to their deteriorating profits because of the translation problem--the profits that they are earning abroad and then bringing back into their consolidated earnings report for this country It's my personal observation that when a company experiences profit deterioration, that eventually impacts on its willingness and ability to expand and even to modernize dramatically So, I'm probably a touch more concerned than the average around the table And if the stance of monetary policy is what we're assuming in the Greenbook, then I think I would be a lot more nervous than the average here Thank you "
646,1989-10-03," I favor alternative ""A"" because I think we do need a slight degree of easing; actually, I believe the difference between ""A"" and ""B"" is basically a slight one   Yes I don't think the 25 basis points is going to pour rocket fuel into our engine Anyway, my main concern, as I indicated, is in the auto area and possibly in the capital goods area In regard to the impact on the foreign exchange markets, I think the demand situation there is one of great strength for the dollar, which is why we had to be in there doing this heavy intervening and selling of dollars along with the other central banks If we drop the interest rates slightly, then that would allow Sam Cross' people to take two days off and maybe that would be good So, I don't think that that would be a real danger Finally, just thinking back to our discussions here earlier this year about inflation, the actual performance of price indexes has been far better than any of us dreamed And I don't think the apparent shortages that were so worrisome are there now While I don't think inflation has gone away --and I say that so Lee Hoskins will understand--nevertheless, I don't think it is accelerating either So, I would be more comfortable with alternative A   I'm sorry, I meant 50   No, it wouldn't "
700,1989-11-14," I just have a couple of comments I think this quarter and the next two are probably going to be quite weak, possibly even turning in some red ink performance I believe the weakness will be centered in manufacturing--because we already have seen that--and also in construction to some extent Some of my contacts in manufacturing indicate that in their view manufacturing is already in a recession or within a gnat's eyebrow of being there To use autos as a specific example, I have been talking to people in the last few days in that industry and they are the most negative I've seen--not since 1985 or 1986 but since 1982 That is probably because production is running about what it was in 1982 While they expected a payback from the sales spurt in August and early September, which of course was a result of the very generous incentives, they didn't expect this much of a payback The very weak October and early November sales performance has come as an unpleasant surprise, at least to my contacts There were a couple of things I heard mentioned for the first time from these folks One was the complications coming from the weak financial condition of a number of the automobile dealers, including very large dealers The statistic given to me was that about half of the auto dealers in this country are losing money in 1989 We're not just talking about a small marginal group but a very major group And that tends to lead to an unwillingness to carry the same size inventories as previously because the dealers just don't have the wherewithal to fund it Therefore, at the moment you're seeing a very poor flow of orders to the producers from the dealers It's a combination of the weak consumer demand for cars and also the efforts of the dealers to cut back their existing inventory levels There are still apparently quite a few carryover 1989 [models] that they would like to dispose of but haven't been able to  Another interesting thing came up in the comments of He said a number of the dealers were  telling him that some of their would-be buyers of Cadillacs are saying that they are knocked out of the market at the moment because their ARM mortages had adjusted upwards and, even though they're ""in the bucks"" so to speak, they are finding their monthly payment going up-- these are people who don't live in shacks like I do--by $400, $425, or $450 and apparently that's just enough to discourage some of them from going ahead and buying a new automobile at the same time That's the first time I heard that comment Also, this unpleasant surprise is forcing a basic analysis of how much manufacturing capacity they really need Chrysler is looking at this and so is GM I think GM has four plants, although they haven't identified the exact four or five, that are going to be shuttered for good Believe it or not, we've been concerned about capacity constraints; well, on autos we've had excess capacity and new capacity coming on stream all the time So there are going to be these more permanent adjustments taking place--not in Roger's District; he's very lucky But the assembly  -24-    11/14/89  plant down the street from my old apartment in Detroit is getting it February 2nd So, I would change places with you if your business is too strong down there Also, I heard mentioned [by my contacts in the auto industry] concern over the strong dollar and what that is doing in the high-priced end of the market, particularly because expensive German cars are now coming into this country at sort of bargain prices And this is making it more difficult for the American manufacturers to compete with them Also, the rather feeble efforts of Chrysler to do some exporting of cars is now being impeded by the stronger dollar this year  Finally, I'd like to mention just a couple of things I've been picking up about construction and housing One is the sad impact of the FIRREA legislation on the ability of builders to get loans because S&Ls apparently haven't had the kinds of lending limits on individual loan size that banks have had Now with FIRREA they do; it's 15 percent of their capital So, a number of developers are having a hard time getting loans of the size they need to do these developments Also, the HUD parade of homes march is on and the competition from the foreclosed homes, at least in some parts of the country, is very significant And that is tending to keep discouraged builders from putting up new homes So, my personal feeling is that we're going to see further problems in both the manufacturing arena and in construction I hope I'm wrong We'll find out by fourth of July next year "
701,1989-11-14," I hate to be odd man, or woman, out again, but I feel fairly strongly that we are running the risk of a recession And if we are worried, as I am, about the waning strength of the economy going into next spring, say, the steps have to be taken now to influence it at that time because of the well known lags involved If I were convinced by my illustrious colleagues here that throwing us into the recession tank would solve our inflation problem I probably would vote differently But I don't see that a recession is going to offset the impact of unwise legislation--by our friends under the dome down the street here--that would put upward pressure on business costs I don't think that a recession is going to solve the medical care costs and the nursing shortage Maybe we ought to deal with recruiting more nurses and getting rid of some of the excess lawyers who are chasing ambulances and getting big settlements which are driving up costs and not try to deal with it through a recession These are the kinds of things that are contributing to inflation I have a hard time seeing at the moment that it's excessively strong demand and shortages of capacity So, having stated all that, I would prefer alternative A Actually, when I look at the difference between ""A"" and ""B"" as described here by Don Kohn it isn't as if the one is going to produce monetary growth double the other You're talking about really rather modest differences but sufficiently great, I think, to make a difference come next spring I would go for ""A""   It must be bonus time!  SPEAKER(?) It wouldn't be so bad "
764,1990-03-27," I'll move it   I just want to make sure I'm listening correctly to what you said about Drexel When a firm is a primary dealer do I understand that that gives us the authority to advise them on what they do in the area of corporate finance as well as securities? Is that what you're saying?   Right   Where do we overlap the SEC then? Isn't that their basic responsibility to oversee these firms?   Well, that's why I asked to see if I was understanding Peter's comment about junk bond financing correctly Because whether or not they choose to underwrite junk bonds is--   Second    3/27/90 "
