,Date,content
3061,1986-02-11," I hesitate to make Governor Seger incorrect on that point I feel as if I am the boy from the farm After listening to all of these big city reports, it makes me aware of the fact that places like Boston, St Louis, and even Minneapolis are big places when you come from the farm There is a different perspective in the rural areas that [stems from] the immediate emotional impact of all that has happened and continues to happen Those forces tend to affect people's willingness to take on debt because the entrepreneurs all have run for cover and besides that the lenders don't want to lend So a really different mix is occurring and I suppose that gives a different perspective However, I must admit that I have been very impressed by Jim Kichline and Mike Prell and their staff and the reports they gave Looking at my forecast and comparing it to theirs, I come back with a question that I want to be sure that I am right on before I proceed Jim, I understand that your projection has built into it a decline in interest rates over the year of what--75 basis points?  With that kind of projection on interest rates, then, I guess my forecast wouldn't be so different from yours I must admit that I made my forecast based upon a continuation of the present level of interest rates If we get that kind of movement in interest rates, the timing of that certainly would have something to do with what the forecast might be I admit to having probably the lowest inflation prediction of anyone here; I'll claim the 2-1/2 percent inflation number I don't mind doing that because I've been around economists for some time and they all told me how inflation was going to be higher than it turned out to be; so I don't mind having been on the right side of this issue for the last five years and continuing to be on that same side  I think Governor Seger is correct in analyzing the foreign sector in regard to the competitive level there Their economies are very price and wage flexible and, consequently, they are going to take the steps necessary to continue, or maybe to add to, their position in our markets But the impact of the deflationary environment is certainly there, and I just don't see any signs of any change in inflation psychology Now, I see the expectations there; but if the inflation expectation remains above the actual rate of inflation it seems to me that we are going to see that in such areas as inventories The forecast of the inventory accumulation that might occur is not going to be very plausible if the actual rate of inflation is lower than the anticipated rate In the area of oils and chemicals and farm products, it seems to me that with the declining price scenario one would want to hold fewer inventories, not more inventories So I have some questions in that regard  I am also somewhat hesitant to believe that equipment is going to do as well in this kind of environment as some might expect, but that might be influenced in part by my own perspective in regard to equipment in the farm sector I don't know when John Deere has their wage negotiations, but they probably coincide with the auto industry and it seems to me that they are a long way from re-entering that market My last comment is in regard to the natural rate of unemployment I don't know what it is, by the way; but whatever it is, it seems to me that it's falling faster than unemployment is falling In fact, it may be dragging the unemployment rate down so that any margins that we had are still there I do not see any wage negotiations that indicate we are getting closer to the natural rate of unemployment than we were  I prefer to keep M1 as a target I think the range should be maybe 3 to 9 percent With velocity at a negative 3 percent, the staff's dollar nominal GNP forecast gives a 97 percent rate of growth in Ml I believe the marketplace would have a better understanding if we really communicated the range that we think is plausible That would give us the opportunity on the quarterly short- range targets to specify [our objective] more clearly as economic events develop and as the velocity of M1 becomes better known I keep being reminded of the events of 1917 to 1946 when Ml's velocity fell from approximately 4 percent to approximately 2 percent So it seems to me that it is entirely possible that velocity may not always have a long-term rising trend and we should accommodate that [possibility]  Mr Chairman, my preference for the 9 percent was strictly in response to your query That is, it seems to me that if we raise the limit and don't mean anything by the new limit, we haven't accomplished much We've increased market uncertainties I would prefer to go to the 9 percent because I think that's enough room I do not believe as much financial innovation change will occur in 1986 as we had in 1985 So, it seems to me that 9 percent will provide us reasonable opportunities to stay within the range and then we could take the language out, which I believe is confusing and could have adverse effects upon [market] views of the dollar I would prefer [providing] some more certainty to the market If a real emergency occurs and is recognized, that would have to be dealt with  You really get tied to it But if we want to express to the markets what we mean, it seems to me that that is the least risky path for us But it would be a mistake--    2/11-12/86  Well, I think velocity like last year is rather unlikely I don't see why money demand would be apt to increase at a rate faster than last year, and it would seem to me that financial innovation changes ought not to contribute as much as they did last year Mr Prell, do you have any idea what proportion of our growth rate last year was due to the deregulation?  I agree with Mr Corrigan  Yes, I would prefer that  There seems to be a consensus  There is no economic incentive  I am afraid I am with the consensus in regard to wanting us to stand still, provided that stand still means standing neutral Unfortunately, we are in an environment in which we don't have M1 targeting that can really be a policy guide as it was in periods in the past Since we don't have M1 targeting, we don't have any way to let interest rates respond to economic forces So it seems to me that we have been pegging the federal funds rate When I try to factor in a change in the price of oil from $28 to $18 over a period of time when the funds rate has been pegged at 8 percent, I do not get the same responses in the real sector that I would get if we had some other way of running monetary policy I'd note that the market's judgment during this period of time has been that interest rates ought to come down Market forces have brought rates down other than the rates that the Federal Open Market Committee controls It seems to me that unless Messrs Axilrod or Kichline or Prell can tell me otherwise, I would tend to view actual policy as being pegging interest rates Now, I don't mind pegging interest rates temporarily during a period where the income velocity of money so misbehaves that we don't know what we are doing But to run through a period, for instance, of a $28 to $18 change in the price of oil, natural gas, coal--the entire [unintelligible] of the whole economy with pegged interest rates seems to me just to be repeating exactly what happened in the 1970s when we had oil price increases and largely had a pegged and somewhat discretional policy--an adjusted pegged policy It scares me, and I do not have enough foresight to be comfortable in this environment If Messrs Axilrod, Kichline and Prell can tell me that my concerns are unfounded and that the model really works--that the real growth occurs with no interest rate responses--I will feel much more at ease because I have a great deal of respect for their judgment  I don't have more confidence in my ability to set the peg I am expressing--  Well, would you explain to me what it is? I just don't understand  But it seems to me that--  If oil prices were to move up from $18 to $28 and interest rates stayed the same, I would--  It seems to me that it's a very big factor  I would guess so  The models that I have run and can think of-- unless someone can point out another model to me--would suggest to me that the path toward expansion in the real sector is through a reduction in interest rates When you run a model of oil price changes and keep interest rates the same, then in that model I don't see how any real analysis is going to operate  Well, I never use such models  But I don't subscribe to popular views that we should have been accommodative during periods of price increases for oil I would have thought we should not have been accommodative  I cannot be satisfied with standing pat if it means that we peg interest rates at the current level  I would hope that we might be able to have some reemphasis of Ml targeting and that we might be able to watch commodity prices and see how they behave If commodity prices behave by moving upward due to the exchange value of the dollar, and with the commodity price impact of the oil price change, I would want to take cognizance of that  I think I've expressed my view  Mr Sternlight, what would happen to the fed funds rate if economic growth came in somewhat weaker?  So, lowered economic conditions, lowered inflationary pressures, provide ample opportunity--  And in view of this policy that we're looking at, under those circumstances the members of the Committee would accept the market's sense of adjustments in the fed funds rate and the other rates that might be relevant?  Well, I can accommodate to that kind of policy if it would appear that the fed funds rate would be sensitive to market forces, particularly if the oil price decline turns out to be as great or greater than we anticipate I lack understanding as to how the fed funds rate has remained as stable as it has over the past seven months, given even some wording of a slight change in pressure  But I haven't seen two-week averages in the 9 percent range nor at 7 percent "
3087,1986-04-01," It seems to me that the uncertainties certainly outweigh the facts we know in regard to the future It's important that we look at the day-to-day numbers; we may not want to believe them, but we ought to look at them and keep track of them The monetary aggregates certainly have rebounded in March If those aggregates continue to move at the March pace, I think that might tell us something different than if growth falls back to the January- February level I think it's very significant that in the global economy and the domestic economy as well we have dramatic price changes We end up with winners and losers Before one concludes too quickly regarding the impact of these kinds of changes, we have to recognize that sometimes the marginal propensity to consume for the winners isn't always the same as it is for the losers And it seems to me that we do have a severe danger of encountering a world trade contraction in this kind of environment If that occurs, that's going to impact the export markets and undoubtedly put more pressure on the deflation of international commodity prices Commodity prices are moving sideways to slightly downward with oil excluded If those commodity prices pick up speed on the down side, I think that is a very risky pattern It's a risky pattern not just for agriculture and oil interests in the United States; a lot of the third world countries are commodity sellers And if we continue to thrust the third world into a position of not receiving any kind of a return on what they have to sell, they're not going to be buying as much as we might expect them to buy But it seems to me that if we don't stumble, eventually these real balance effects will take place I'm somewhat concerned that oil prices at some point in time might not do what we want them to do I suppose all of us would prefer that they move up a bit and stabilize But we don't have any guarantee of that  It seems to me that we might need some rather dramatic moves if oil prices were to rebound sharply So, I think we have to watch things very carefully I would indicate that I'm much more optimistic--I like to be optimistic about something--than the group now [and] as much as six months ago with regard to the inflation front It seems to me that it's imperative that we get our inflation rates down in the 2 percent or 1 percent range during this oil price move If we end up with our staff forecast of inflation, I think that's very bad news for the dollar and our future So, I'm somewhat optimistic that if there's any indication that prices are going to move in another direction, we could be in for one heck of a deal  -16-    4/1/86  Have you taken into consideration any change in desired inventory levels due to a period of falling oil and energy prices?  Over a period of time, the inflation rate in the services sector is going to be much slower to adjust to monetary scarcity than it is in the commodity sector because we have too many established techniques for maintaining these rates of inflation, not the least of which is government There continue to be areas in which, unless you put pain on government, you don't stop the wage increases in government  The next step is that, over a period of time, the private services sector is going to adjust those rates of inflation to the others, as soon as they believe them But how are they going to believe them when our own staff and our own FOMC don't believe the rate of inflation is down? I don't understand how we can lead the way to lower inflation when we keep saying it's going to be higher  There just isn't any basis for an easing policy right now Alternative B clearly is in the right ballpark I am a little concerned about the 7-1/2 percent [Ml] number It seems to me that velocity may be on a different path than we anticipated In previous periods of history it has been on a downward path for many, many years and changed inflation expectations may very well mean that we've got negative velocity I'd anticipate negative velocity of more like 4 percent for the second quarter And if we have 4 percent, I don't know that 4 percent nominal is too high, so I would be much more comfortable with an 8 percent than a 7-1/2 percent on ""B"" I am not concerned about the reserve positions as long as the Desk is astute, as they have been during the time that I have watched them, in regard to managing that account  Would you want that even if that meant that fed funds rates tick back up?  Most of that seasonal borrowing may not recur this year simply because there is liquidity there and the seasonal borrowing privilege has not been used At least that has been our experience  It seems to me the most likely event that might necessitate tightening would be an oil price move; that probably would be more likely in this quarter than robust growth  Well, yes And it seems to me that if we had an oil price move upward and it appeared to some that a cartel move might be effective for a while, with the money the public seems to want to hold in transaction balances we might have some wider shift in expectations that might require some tightening It seems to me we should be prepared for such a policy if that were to occur  Yes  Yes, that's why I'd like to have 8 percent on the Ml I just think that if the economy gets weak in the second quarter we're apt to see the March M1 numbers go the other way  Except that it intends to imply a range And I don't know whether that's--  That's what I'm saying  But with the staff's estimation of a negative 3-1/2 percent velocity, that means we want a self-fulfilling prophecy of 4-1/2 percent or 4 percent nominal and that's not much  What comes out at 9 percent?  Okay  Well, it seems to me that if Ml and the other aggregates were on a higher path than we anticipate, we could accommodate some upward move in the fed funds rate If it's lower than we anticipate we ought to accommodate some downward movement I don't think we should pinpoint the fed funds It seems like--  Yes  Put ""together with""  Together with "
