,start_date,content
21335,2001-12-11,given tenur weekend day look inform will pretend date seri expert around_tabl want bring tabl observ note anecdot perspect busi commun bank commun main concern regard busi_cycl busi_invest side reason believ got recess drastic drop invest certain key technolog sector feel optimist inventori correct sector actual begin stabil sale consum realli kept economi go cycl can hous auto_sale though believ lot recent auto_sale repres time differ due attract financ program consum use refinanc home increas dispos incom month know pool mortgag can profit refinanc consum dwindl fact argu recent uptick refinanc mortgag normal term mortgag_rate begin astut refinanc jump lock rate believ hit low believ go much increas spendabl incom come consum obvious other threat terror damper consum will unemploy worri sector concern light recent person experi state_local govern due financi stress current place particularli area depend great_deal sale tax revenu revenu tie employ situat entiti spend substanti sum support respons potenti terror activ final corpor execut talk feel littl abil rais_price time fact feel pressur cut price alreadi discuss deal inventori_accumul excess capac find littl pressur inflat moment
21409,2001-12-11,support_recommend support comment peopl begin signal last eas action
21578,2002-01-29,mr chairman_support_recommend struck don kohn comment definit weak hope can signal talk growth economi significantli consid potenti want peopl infer risk_statement expect doubl dip recess come along can clear word statement comfort
21659,2002-03-19,thank mr chairman inform last_meet indic recoveri fact question word recoveri appropri event realli recess clearli shallow think shape bit saucer focus manufactur trade inventori inform surpris fast inventori liquid occur importantli coupl peopl alreadi mention inventori sale level earli month begin slowdown impli busi inventori posit good shape think industri_product alreadi pick respons common governor gramlich fiscal_stimulu packag make wonder exactli target recess uniqu caus excess busi_invest select area encourag spend area alreadi excess invest seem peculiar type recoveri medicin base anecdot_report busi_peopl_talk travel bank meet attend wonder lot excess capac appear excess capac perman shut will come case page will implic invest go forward perhap importantli product idl capac like involv product resourc consum_spend continu_grow adjust unusu wave creat fourth_quarter_quarter due automobil sale promot consum dispos incom look good incom tax refund run last_year reflect think tax_cut withhold consum incom fell product improv fourth_quarter way show busi surpris level final_demand quarter normal recoveri product increas pessim final_demand ceo shown throughout period reason product strong ceo believ control top line meet profit goal deal expens line fact policymak use word recoveri think will tend ceo busi_peopl pessimist obvious none around_tabl believ recoveri period slowdown will anyth recoveri typic recess ceo expect bounceback compar experienc past recess go sore disappoint final term employ unemploy peak suppos signal start chang direct peak find interest discuss unemploy_rate percent term nairu percent echo comment esteem colleagu presid feder_reserv bank boston suggest determin page appropri polici stanc move forward_look nairu percent term_inflat_forecast run percent
21708,2002-03-19,support_recommend particularli comment polici_accommod
21822,2002-05-07,meet continu believ consum mainstay economi dispos incom near pre level expect consum continu mainstay though earlier day consum_confid fragil given news polit front unemploy real_gdp_growth agre forecast much slower_growth quarter inventori reduct appear end recov economi widen trade deficit final_sale growth will slow somewhat quarter increas feder govern spend remain higher_level state_local govern continu restrain spend meet fall revenu last half_year gdp will advanc faster pace expect continu_growth final_sale requir busi meet demand product rather inventori liquid fact manufactur product risen month time late year expect product_growth ahead given level excess capac lack price_power busi expens control will driver profit recoveri will continu keep product employ_growth will lag busi_confid restor result wage cost advanc slowli inflat remain percent rest year time feel need chang_polici stanc past meet longer_term concern though becom increasingli worri lack busi_invest eighteen month much product_growth enjoy current due innov invest cycl associ extrem level invest late begin year lack current invest go slow innov invest cycl turn will harm sale growth relat product innov introduct will set stage slowdown product due busi process improv type invest cycl year becom effect plan invest implement enjoy full fruit invest pessimist believ caution ceo express profit will continu limit abil willing term invest turn mean sever_year go abil harvest product_gain will growth busi_invest extend period point recent level product_growth fear will drop substanti closer histor trend given accommod monetari_polici moment real_fund_rate zero worri point go rais interest_rate product will slow
21880,2002-05-07,support_recommend
21941,2002-06-25,discuss hear today consist beig book summari character econom_growth modest uneven schizophren earlier late last fomc_meet forecast revis growth estim upward last_meet see forecast remaind revis consum slow pace spend busi_fix_invest show_sign sustain recoveri employ averag weekli hour work stabil echo concern express time alreadi today issu integr corpor earn continu overhang market consum expect posit side look increas labor_forc particip continu inventori liquid sustain final_sale busi brought inventori_sale_ratio histor low_level product grown month pace necessari maintain low current_level inventori hous continu bright spot econom_activ fiscal_polici continu stimul inflat remain extrem low_level ceo continu lament limit abil increas_price slow pace employ activ pressur profit continu drive product strong level sustain lower valu_dollar will increas_inflat_pressur degre thu modest pace econom_activ low_level inflat warrant chang econom polici today
22005,2002-06-25,support
22092,2002-08-13,alreadi note economi_continu_expand slower pace earlier_year note prior meet revis downward forecast spring stage hard identifi major risk_inflat intermedi term thu focu strength econom_activ real_gdp_growth report slow percent quarter percent greenbook_forecast growth move_toward term potenti growth_rate unusu growth import quarter significantli reduc real_gdp_growth conclus inventori liquid provid basi continu expans industri_product final_sale advanc survey measur consum_confid fallen recent report corpor fraud fall equiti valu real consum activ survey continu resili cycl hous auto_sale remain near record high due partli thirti year low mortgag_rate incent auto manufactur car afford today thirti year consum usual major purchas outlook futur realli dim rather persist growth_real dispos incom slow claim unemploy insur serv provid foundat continu though perhap uneven increas consum_spend today retail_sale number support view real focu pessim corpor ceo drop busi_invest led recess lack convict futur revenu growth continu slow recoveri invest commit growth equip softwar sale last_quarter time six quarter industri_product grown month year drop ism index declin hour work rais_question strength recoveri concern pace busi_invest becom concern overal outlook pace econom_growth
22125,2002-08-13,mr chairman_support_recommend think perspect differ presid_pool realli want tie hand right concern weak believ respond go market rather implic term consum busi behavior initi congress pass quickli aggress action individu commit fraud concern problem linger furthermor restor confid market_think will longer_term impact busi financ consum invest prefer shift balanc_risk weak know peopl go react unusu time signal given uncertainti risk outlook today downsid
22223,2002-09-24,go summar remark echo comment heard around_tabl today believ econom data see recent continu show mix sign strength recoveri echo concern express other direct forecast go begin year staff_forecast fourth_quarter_year continu revis downward past_month product worker hour averag weekli hour declin know manufactur weakest sector recess recoveri see industri_product slow expand inflat_forecast continu revis downward level give concern base discuss meet posit side inventori liquid appear level forecast sale increasingli come product fourth_quarter busi_fix_invest appear near end seven quarter declin sustain_growth forecast begin next_year equip softwar invest alreadi begun grow hope support continu_improv product nevertheless share concern mention experienc capit shallow length time gone without increas invest risk_forecast appear increasingli downsid though econom_growth forecast euro area revis downward problem region indic weaker support expans abroad struck intern meet countri seem wait unit_state pull around retail_sale especi big ticket item durabl automobil appear depend heavili discount rise hous_price sustain consum wealth posit fall equiti_market declin hous_price signific impact consum_spend hous memphi sale inclin believ widespread bubbl laughter
22225,2002-09-24,oh ye
22229,2002-09-24,overal believ concern mention around_tabl increasingli come forefront economi appear fragil bring question abil economi absorb futur shock come variou sourc talk today robust recoveri summari believ risk slower econom recoveri inflat hover around percent move close time must consid rate cut
22280,2002-09-24,mr chairman_support_recommend guess anxiou presid_parri get concern lack momentum robust recoveri despit geopolit situat think_need pay close attent happen data releas next week
22414,2002-11-06,agre comment remark alreadi expans appear lose momentum slow move ahead last_coupl_month manufactur_activ order auto_sale gener retail_sale slow prior pace capit_spend show upward momentum compani continu cut cost achiev earn growth especi atmospher increas uncertainti geopolit econom risk plu side hous continu_strong level governor kohn mention cost capit compani rise continu set record low household sector think_reason see growth busi inventori final show_sign growth six quarter liquid plu busi_fix_invest discuss alreadi show mix signal depend set number look base talk corpor execut disconnect partli execut think expens run statement huge wave capit_spend fulli amort book firm actual can increas outlay declin expens overal tone recent econom_activ disappoint littl indic strength major economi elsewher world evid economi can much boost outsid sourc know monetari_polici oper lag eleven month last chang fed_fund target rate look staff_forecast time notic quarter half output_gap widen point tell wait longer rebound gap actual potenti econom_growth bigger last_meet thought close call reach point need eas data receiv meet tell time right must move meet
22465,2002-11-06,mr chairman_support_recommend basi_point fund_rate_think_need show ahead point economi find littl harder balanc_risk_statement reason use word vincent handout talk forese futur group come conclus economi sort inflect point_think weak short_term go forecast_period strength can support balanc_risk_statement think_import indic forese futur beyond next_meet peopl tend look risk_statement signal like polici stanc next_meet can talk past short_run press releas think help
22612,2002-12-10,go borrow term presid_minehan use earlier introductori sentenc note think bumpi period right news last_meet mix indic evid good_news bad news scenario product strong result unit_labor_cost fall holiday sale start initi unemploy claim continu move neg side privat payrol industri_product declin last_month elect think chang fiscal_polici realli know exactli chang like happen larg tax_cut gener assess situat today stuck soft spot mr stockton think la brea tar pit yet want comment littl perspect product data talk lot last_month recent occas meet group senior corpor financi execut discuss product number promis use term multifactor product continu talk laughter quickli went cfo jargon got along fine obvious profit squeez realli cannot rais_price demand term volum growth modest consequ focus particularli expens reduct felt compani quit bit potenti cut expens sever reason late compani lot acquisit aggress get product line open store plant focus extern side support sale littl done intern term ration busi process basic go busi process redesign amaz went around_tabl number talk elimin step almost busi process bill procur radic reduc infrastructur cost lot chang requir much capit_invest either form softwar equip get big payback type adjust intern process redesign manufactur line get hard nose final elimin effici plant store meet revenu expect moreov gener sens cost cut can quit felt run steam yet continu push type restructur improv bottom line view realli good_news term enhanc longer_term product_growth cost structur ration thing will happen point demand get stronger will throw money bottom line boost profit import will gener free cash_flow will allow fund bigger invest acquisit time right financi offic feel posit view current period break sort allow look intern way improv product pictur sens thought run idea fact thought endeavor energ everybodi compani posit outlook product next_quarter
22655,2002-12-10,agre mr chairman follow comment mayb bank minut know rollov minut next time
22799,2003-01-28,factor underli momentum economi_continu split say around_tabl household continu show optim busi continu find way expand consum bought car christma hous start reach sixteen year high mortgag refinanc suppli addit cash_flow spend help pay consum debt declin time year core consum_price_inflat run percent peopl shop bargain job declin person_incom continu_grow modest pace yet busi activ continu show_sign weak industri_product fallen last_month employ product hour work level inventori fallen last_coupl_month expand summer earli fall term structur problem becom promin given slow expans go though name sever key industri economi struggl excess capac look compani announc restructur plan know weak sector go continu quit time futur concern immin war unknown repercuss terror affect financi_market concern provid excus busi expand side other mention know potenti tax reduct congress act probabl will happen sever_month impact will felt late year staff_forecast modest expans final_sale expect stimulu tax reform leav output_gap wide know economi soft vulner outsid shock think_need vigil come week regard uncertainti war economi will abl will respond appropri event transpir
22823,2003-01-28,support_recommend
22909,2003-03-18,want talk littl financi sector includ bank contrast happen real sector bluebook point commerci bank unit_state record earn record earn year record earn commerci bank system recess period rel slow recoveri period interest_rate hit forti year low character unusu liquid circumst fund came bank system think thing find difficult oper environ uncertainti bank realli learn manag risk asset liabil manag process bank initi fine tune clearli show can major interest_rate cycl whole improv earn net interest margin fact actual widen last_year credit side saw bank manag credit look number loan loss provis percentag return asset basic flat compar previou year bank much better job manag credit risk remark bank earn achiev record return asset done financi leverag bank fact deleverag last_year record year return equiti bank achiev record earn stronger fundament better risk manag look broader financi_market especi last_meet volatil excess credit spread observ last_year continu_improv mention earlier debt spread wider histor spread move much hear bank credit offic credit market folk say extent uncertainti part debt spread remov upset everybodi end prime credit go immedi bankruptci happen love call oper risk credit real issu bankruptci due account scandal manag fraud compani deterior time mart handl tradit uncertainti go regard factor contribut widen debt spread invest grade market seem come materi event type last_sever_month compani restructur know lengthen commerci paper longer_term debt corpor cash_flow improv unfortun part make capit_invest consum continu refin restructur debt staff shown household debt servic actual coupl_year_ago household financ good shape bank sector corpor balanc_sheet household financ debt market stronger equiti_market know shift neutral realli happen disconnect improv financi sector weak real sector fomc_meet optimist news continu_strong data came remark alreadi suddenli began question happen snowstorm southern actual buy pair boot thought help retail_sale heat oil natur ga cost took toll peopl spend talk uncertainti regard go iraq mayb countri appear prey consum busi hard evalu risk decis period uncertainti decisionmak affect real econom_activ creat job_growth resourc slow almost halt realli know situat iraq sure can deal uncertainti monetari_polici concern involv war mention alreadi aftermath war unlik situat kuwait go reinstal govern help creat successor govern therefor think uncertainti go continu time natur uncertainti uncomfort make chang right direct polici thank
22928,2003-03-18,support_recommend
23102,2003-05-06,thank mr chairman prepar meet start look previou forecast presid_minehan governor ferguson note past_year forecast economi will better half_year miss time terrorist attack time corpor govern scandal know optimist pessimist happen third time hope chairman public compani account oversight board might effect risk
23105,2003-05-06,ye brilliant chairman concern though start year soft spot unlik last_year stronger growth half_year hour work continu declin soft period employ fall product manufactur_sector particular show_signific weak main impetu recess weak busi_fix_invest forecast bfi revis downward greenbook meet agre comment alreadi around_tabl corpor cautiou inact signific improv inventori control advanc product increas liquid firm move longer_term fund cash_flow risen improv profit_margin look pictur rel pessimist go happen spark busi_confid tend believ risk bias toward weak especi given accept forecast econom_growth will potenti beyond forecast_horizon outlook inflat front sever peopl alreadi remark greenbook assess probabl deflat end next_year percent clearli statement catch attent know staff work confid interv variou measur_inflat measur bia work show major inflat measur top confid band percent end next_year concern need deflat disinfl get inflat_rate percent signific enough issu lot talk busi_confid invest concern rais govern issu think lack confid relat continu outlook weak price_power busi manag tri commit marketplac compani will show earn growth commit expect type top line revenu growth sit expect econom_growth forecast_period potenti inflat percent mean corpor make seriou commit growth small margin error cash_flow top line growth provid robust level incom revenu compani abl risk invest busi line plant open outlook continu sluggish econom_growth overal inflat percent effect confront disinfl risk world point cumul slow_growth go forward therefor support comment presid santomero import avert disinfl psycholog period ahead concern risk front right risk real_growth potenti quit time risk disinfl consider stronger think can identifi bia risk balanc unbalanc view phillip curv situat think neg face
23162,2003-05-06,can support statement fact broken risk explicitli vote reduct fund_rate target today look much market move fed_fund futur rate last_meet market price rate cut matter side inclin believ market upset eas action today will along recommend wait futur inform develop look_forward discuss next_meet indic earlier think strategi signal want send move lower_inflat world experienc time_think will help improv commun consid care term plan low_inflat period can plastic surgeri swan
23279,2003-06-24,came meet feel similar presid_guynn express get readi today meet look note last_coupl meet found alway verg rebound econom_activ obvious war erupt creat discontinu expans will use presid_guynn ground hog day movi analog miss obvious busi capit expenditur hope hero ground hog day ceo will begin messag start focus extern instead intern can happen mayb will happi end movi spend lot time look data busi sector go point steve earlier thought analysi excel term describ statu busi expans number nondefens durabl_good order morn sign point glimmer hope past discontinu associ war hand realli see evid robust movement ahead concern european central_bank lower forecast growth euro area point staff reduc expect_growth intern rest year suggest go lot support foreign sector start glimmer hope employ statist employ weak privat payrol look begin stabil fall earlier_year optimist staff regard outlook forecast bottom rang fomc submit concern look forecast_horizon output_gap sustain given inflat measur worri deflat concern persist disinfl clear bank sector sector move_toward risk base price credit go work worri consist low_inflat environ might financi sector rememb last_time type situat regul prohibit payment interest lot deposit bank sector persist output_gap consider much downsid_risk tri encourag expans get kick notch lean toward view ahead littl insur meet
23307,2003-06-24,mayb go wait discuss commun thing struggl read bluebook word exhibit bottom left box part inflat_risk downsid worri disinfl signific risk worri inflat road inflat around percent worri risk rise_inflat_risk alway impli someth worst outcom rather direct given regard inflat wonder impli concern inflat move direct rather risk go get governor bernank comment commun view inflat import unusu situat think direct word might better word risk
23352,2003-06-24,mr chairman can support_recommend sever other torn basi_point huge stimulu come tax packag effect accord tradit econom theori provid impetu econom_growth project greenbook reason comfort cut rather basi_point right support presid_moskow direct think regard talk thing moment world ceo everybodi els worri risk impli opportun growth percent risk seem best choic word might want find better word convey messag will encourag growth necessari econom perform potenti use excess capac human resourc think_time look tri address comment governor bernank
23463,2003-08-12,thank mr chairman go focu coupl issu governor bernank discuss mention name commun polici view issu face today want talk point view dictat mission statement potenti growth economi inflat thing find strike convers peopl particip bond_market differ percept regard particular recoveri sever peopl mention earlier market tend believ recoveri begin fed go away punch bowl start tighten interest_rate right away realli engag profess feder_reserv tri fight inflat system focu unusu economi emerg term secular problem exceedingli inflat_rate_inflat within near rang might want set term_inflat target result tri achiev secular declin inflat focus cyclic aspect believ street realli differenti issu issu reason inflat low product_growth significantli fact product number came earli stage busi recoveri believ product will stay somewher term trend pickup inflat normal like occur hope inflat will current greenbook_forecast_inflat remain significantli find comfort certainli uncomfort inflat_forecast percent issu look risk_forecast address altern scenario greenbook call prolong subpar invest root caus recess begin slowdown busi_fix_invest creat recess consum driven busi_invest pick expect output_gap will wider inflat will continu drift lower capit expenditur increas compani hear robust plan capit expenditur compani releas earn report think peopl around_tabl today hear mix report capit_spend intent share doubt express busi go surviv world continu low_inflat limit price_power sure can achiev earn growth next_year number earn forecast go give go resum capit expenditur order achiev growth continu extraordinarili pace growth product altern without capit deepen will continu go last_coupl_year reorgan shut plant restructur_product line summari concern strength capit expenditur rel staff_forecast biggest risk go forward term commun love find mayb can talk peopl understand differ mode term regard inflat product result output_gap will larg econom_growth short_run thank
23502,2003-08-12,mr chairman_support_recommend look_forward discuss commun
23577,2003-08-12,mr chairman sort split last sentenc think final sentenc paragraph price_power realli good addit lot part last sentenc troubl phrase without ultim stoke inflationari_pressur talk phrase make uncomfort light admonit humbl can maintain accommod stanc consider period without ultim sound extrem posit suggest might want end sentenc put period word period
