,start_date,content
23672,2003-09-15,thank let start ad mr stockton sever other forecast_greenbook compar forecast privat sector look compon forecast focus product must talk busi_peopl realli believ sea chang product comfort greenbook_forecast duplic comment other talk particular aspect current situat remark similar governor ferguson mention earlier inventori manag give littl differ perspect base hear busi_contact obvious pessim earn growth among ceo busi_peopl gener stem concern inabl rais_price order increas revenu feel constrain regard excess capac competit environ caus realli focu cost reengin work process use resourc effect concept continu drive busi decis hear busi plan budget strategi next_year will continu talk bit much inventori_sale_ratio drop comment heard sever folk talk servic industri relat measur inventori look ratio inventori sale tend involv manufactur wholesal retail part distribut process realli good data inventori sit insid servic compani major worker product incom growth gener countri servic compani gotten around last_coupl_year develop kind procur polici manufactur wholesal retail use contact point day individu depart big suppli cabinet suppli room depart order suppli tend hand excess suppli everyth fax machin server paper everyth els happen accord contact reason busi buy fewer suppli reengin effort larg corpor central procur offic depot becom suppli cabinet basic firm make chang term equip compani longer backup forklift equip sit around wait equip need measur compani chairman greenspan briefli left room mr ferguson act chairman point inventori within servic busi decreas work improv effici fewer time handl item inventori creat big effici cost structur let shift point want talk employ pictur comment reflect natur optimist viewpoint tri find someth good dismal employ number see talk peopl leadership role nfib small_busi group thing focus continu dichotomi establish data household data employ know seri diverg time contact point lot time energi peopl employ sole proprietorship previous fact shown greenbook chart latest monthli survey show hire plan small_busi bear mind recent time seri level record mid expans outsid contact remind job creat small_busi time sever_year optimist small_busi go sourc growth structur kind layoff see big busi will drag event see sign small_busi begin grow hire peopl famili member work extraordinarili hour optim real employ gain will occur sector go forward
23721,2003-09-15,thank mr chairman_support_recommend keep fed_fund target rate percent time quit concern downsid_risk_inflat mainli forecast_greenbook belief product stori written other comment prefer leav last sentenc statement last_time_last sentenc think tri want remain accommod sentenc relat balanc_risk alreadi state predomin concern continu risk_inflat becom undesir low think_need end next sentenc worri chang word accept languag sentenc rather awkward realli prefer leav word
23822,2003-09-16,thank let start ad mr stockton sever other forecast_greenbook compar forecast privat sector look compon forecast focus product must talk busi_peopl realli believ sea chang product comfort greenbook_forecast duplic comment other talk particular aspect current situat remark similar governor ferguson mention earlier inventori manag give littl differ perspect base hear busi_contact obvious pessim earn growth among ceo busi_peopl gener stem concern inabl rais_price order increas revenu feel constrain regard excess capac competit environ caus realli focu cost reengin work process use resourc effect concept continu drive busi decis hear busi plan budget strategi next_year will continu talk bit much inventori_sale_ratio drop comment heard sever folk talk servic industri relat measur inventori look ratio inventori sale tend involv manufactur wholesal retail part distribut process realli good data inventori sit insid servic compani major worker product incom growth gener countri servic compani gotten around last_coupl_year develop kind procur polici manufactur wholesal retail use contact point day individu depart big suppli cabinet suppli room depart order suppli tend hand excess suppli everyth fax machin server paper everyth els happen accord contact reason busi buy fewer suppli reengin effort larg corpor central procur offic depot becom suppli cabinet basic firm make chang term equip compani longer backup forklift equip sit around wait equip need measur compani chairman greenspan briefli left room mr ferguson act chairman point inventori within servic busi decreas work improv effici fewer time handl item inventori creat big effici cost structur let shift point want talk employ pictur comment reflect natur optimist viewpoint tri find someth good dismal employ number see talk peopl leadership role nfib small_busi group thing focus continu dichotomi establish data household data employ know seri diverg time contact point lot time energi peopl employ sole proprietorship previous fact shown greenbook chart latest monthli survey show hire plan small_busi bear mind recent time seri level record mid expans outsid contact remind job creat small_busi time sever_year optimist small_busi go sourc growth structur kind layoff see big busi will drag event see sign small_busi begin grow hire peopl famili member work extraordinarili hour optim real employ gain will occur sector go forward
23871,2003-09-16,thank mr chairman_support_recommend keep fed_fund target rate percent time quit concern downsid_risk_inflat mainli forecast_greenbook belief product stori written other comment prefer leav last sentenc statement last_time_last sentenc think tri want remain accommod sentenc relat balanc_risk alreadi state predomin concern continu risk_inflat becom undesir low think_need end next sentenc worri chang word accept languag sentenc rather awkward realli prefer leav word
23972,2003-10-28,thank mr chairman want comment current condit talk bit longer_run part greenbook_forecast struck look greenbook_forecast regard busi_invest expans inform capit_spend get variou busi survey much includ greenbook materi alreadi note corpor cash_flow strong begin firm busi_invest respons qualit question ask survey clearli show busi reluct expand nevertheless think tone see floor begin slump invest slump root busi slowdown governor olson mention word start turn posit vigor corpor expans yet hold think recent inform show clearli worri look much stop economi last_year greenbook_forecast assum real shock come number shock past_year last_year busi inventori grew shock war spring start stop recoveri littl longer prove stabil busi expans mode versu replac mode clearli financi strength extraordinari corpor cash_flow earn number come quarter look strong think longer_term forecast head struck wonder optim greenbook_forecast compar outsid forecast want comment aspect sort mind extraordinari run product last_quarter yet look_forward product_growth last six quarter greenbook_forecast fall recent number understand big part product perform cyclic project drop product_growth come right economi realli pick tension forecast_think employ grow extraordinari job_growth product slow yet inflat trend tail end forecast_period street market observ talk expect factor commun polici employ start expand inflat go pick go challeng face believ greenbook_forecast fact altern scenario result inflat_rate within hail distanc percent due fact peopl inflat_expect higher actual inflat basic forecast depend inflat measur will year inflat number start extraordinari period low_inflat psycholog observ mindset part busi recoveri model marketplac need think talk issu go forward
24017,2003-10-28,support_recommend
24143,2003-12-09,thank mr chairman last_meet news econom_growth peopl around_tabl alreadi much stronger point note happi growth balanc term come sourc longer reli total consum_spend busi capit_invest resum continu amaz inventori fall leav room expans inventori rebuilt suppli sale growth moreov intern economi pick support modest expans export busi spend continu_grow worker will ad payrol will support consumpt extent offset lower impetu tax_cut mortgag refinanc futur look risk regard econom_growth risk assess growth_rate risk upsid look economi perform rel level potenti_output_gap signific peopl alreadi mention estim output_gap hard come greenbook_forecast unemploy continu run rel assum percent full employ nairu perspect dave stockton alreadi mention standard deviat percentag_point unemploy_rate rememb late unemploy got percent without inflat_pressur talk human resourc execut sever corpor manag peopl today optimist wage_pressur will continu mute might past busi today much flexibl manag human resourc manag tend compens peopl use incent pay employe earn money either product target met revenu come sale commiss busi accept practic outsourc contract employ function core organ contract organ much product effect handl particular function can work much lower cost compani continu look throughout organ opportun sale improv technolog allow servic busi suppli access labor resourc intern longer confin worker servic mitig factor lead look_forward concern impact compens forc drive inflat short_run except larg jump product saw third_quarter like sustain especi grow busi_confid lead hire factor think pace product_growth continu run histor level governor ferguson believ product_growth_slow much greenbook baselin_forecast corpor profit third_quarter significantli higher recent fact profit level record quarter boom year interestingli consensu forecast corpor profit run twice level expect begin year inflat inflat appear turn remain low_level greenbook continu forecast core_inflat will low percent rang next_year nevertheless dave comment respons presid pianalto question probabl inflat get danger zone percent run consid signific risk unwelcom inflat substanti cost economi market privat economist differ forecast_greenbook outsid forecast tend much lower growth much higher_inflat interest compar today blue_chip forecast blue_chip consensu begin year project real_gdp_growth move_basi_point expect_inflat move_basi_point closer greenbook show
24164,2003-12-09,mr chairman uncomfort polici commit propos word feel much better introductori phrase inflat quit low resourc use slack make condit statement drop languag wrap assess balanc_risk think help will support_recommend
24314,2004-01-27,thank mr chairman comment come end around go repetit view express earlier let summar view agre comment around_tabl recoveri move phase move stage busi_cycl economi driven mainli consum busi share foster expans balanc growth go forward give much confid recoveri leg want focu comment busi side today know uniqu kind cycl driven busi side consum side consum_spend continu_grow whole recess busi_fix_invest inventori_invest fell major engin slowdown saw inventori side gone period includ quarter fall inventori period expect inventori grown fourth_quarter last_year forecast strong inventori growth go forward begin survey busi becom comfort inventori level fulli expect inventori_sale_ratio will continu push envelop lower busi firm continu_improv procur manag resourc think busi begin express confid sale level sustain compani begin increas inventori support level sale come capit_spend side equip softwar expenditur turn around last period earli part recess saw consum_spend outpac equip softwar spend half began pickup pace latter growth sector half realli iraqi war saw forc expans survey accompani beig book show survey reinforc busi begin plan increas equip spend come year side busi_invest pictur particularli strong busi debt pictur household done whole lot mend balanc_sheet continu run debt level busi clearli substanti progress flow fund data show regard financ gap last_quarter cash_flow due strong profit cover capit expenditur busi undertaken provid leg support busi_fix_invest keep recoveri balanc ground think financi_condit give strong hope member point part balanc recoveri stretch abil understand employ stori data give mix signal payrol number continu show disappoint result light fast durabl spend believ due product earli stage improv busi_confid will bring peopl work look littl indic improv employ condit name data come sourc particularli self employ incom last_year incom peopl self employ grown percent growth overal person_incom much formal busi expans self employ incom creat multipl leg recoveri show household establish survey profit major busi forc nonfarm proprietor incom reason peopl either necess laid corpor restructur lifestyl choic choos self employ differ type labor_forc go forward think will wait data end result go either think show small_busi tend lead employ_growth
24344,2004-01-27,thank mr chairman_support_recommend rate glad languag refer consider period go away can support_recommend word chang patienc presid_moskow prefer use patienc languag will rid feel much comfort go includ statement kind forward commit sort faster can elimin consider period refer patienc better will feel
24454,2004-03-16,thank mr chairman want start acknowledg rang forecast staff provid think realli will help awar variabl outlook can someon spend lot time worri basel ii advis banker need understand variabl outcom glad walk talk put fomc materi thank last_meet data mix net forecast littl weaker term gdp employ inflat unchang overal pace recoveri strong slow look tri focu bit differ sector economi end spend time look corpor sector notic half last_year corpor profit level rise quickli corpor cash_flow strong fact intern gener cash_flow greater capit expenditur sever quarter busi increas invest equip softwar pick spend area think gap spend differ facet oper come coupl interest aspect financ throughout whole period corpor pay equiti net overal balanc_sheet strengthen leverag gener profit can use therefor retir stock observ corpor net issuanc debt quit larg recent fact number last_coupl quarter amaz lot debt issu governor olson note paydown bank loan commerci paper compani lengthen liabil take advantag period low interest_rate help strengthen financi last_month data see chang begin time commerci loan growth bank system commerci paper growth financi_market actual net expans debt far quarter part due start inventori build modest corpor effect tri maintain profit_margin fact data greenbook can street expect doubl digit earn growth corpor next coupl_year extent compani lean top line revenu growth particularli limit abil rais_price revenu growth struggl maintain bottom line odd thing corpor financ wider profit_margin harder work keep cost order gener earn growth think part happen firm show wide oper margin street street extrapol earn growth firm find scrambl harder expens side realli make uncomfort govern sector household sector busi sector net save today sector corpor sector corpor sector turn net saver net investor pessimist get rapid_growth go forward
24491,2004-03-16,mr chairman_support_recommend prefer keep slight bia emphas possibl disinfl thing make uncomfort make chang go comment fan chart inflat fan around percent person think percent low number econom consequ go compani manag earn statement financi institut oper extrem low interest_rate implic economi plu fact data actual evid stabil inflat lead prefer retain bia toward weak
24568,2004-05-04,thank mr chairman will opportun last_time guess agre presid_broaddu prepar meet found chang last fomc_meet signific look differ indic track saw chang quit time want talk aspect data end focus inventori employ variou inflat indic let start inventori growth think surpris littl inventori grew last_month greenbook estim look histor trend inventori sale inventori consumpt ratio remark downward trend ratio began continu except slight flatten wholesal manufactur inventori recess fact greenbook_forecast inventori_accumul year base recent chang gdp number suggest level inventori will held compani despit doubl digit sale growth interven year happen compani inventori manag practic recent opportun financi offic sever differ type busi thing found anecdot commentari mix particularli among manufactur industri lot caution tend firm suffer lot industri real pressur profit perhap compani presid pianalto talk worri build book sale tri inventori hand folk retail industri told stori continu path substanti chang integr inform system across compani go prospect book sale forc order book inventori manag lot accomplish regard financi offic felt signific way continu_improv manag inventori manufactur firm start cautiou side retail talk improv inventori manag process term employ glad time growth payrol littl pessimist real job_growth clearli indic sure hope will show sustain_growth go forward payrol incom move lot last_coupl_year person concern tax refund play year slow pace equiti extract hous due rise mortgag_rate will need signific payrol growth order sustain strong level final consumpt final inflat number amaz meet indic inflat came suddenli show revers trend saw month twelv month rollov measur rate_inflat continu fall realli chang anecdot mention previou meet come bear look variou piec inflat pictur focus question alreadi ask someth fundament happen attribut unusu event clearli issu commod see worldwid demand driven price chang overal amaz price good side gener stop declin declin obvious help lower overal inflat_rate last_coupl_year true everyth use car apparel raw materi commod_price side though rate_inflat servic rel last_coupl_year continu come take medic servic particular clear rate_inflat servic continu moder servic big part economi trend continu believ will help offset lack price declin good side forward materi use mr reinhart append transcript appendix put togeth posit believ inflat_risk final balanc echo comment earlier chang statement order allow much flexibl possibl can respond whatev data show next coupl_month can appropri step need
24659,2004-05-04,thank mr chairman camp prefer commit statement idea express speech polici_accommod remov struggl interest listen around_tabl word measur outsid tri read messag word sure know mean tri signal slower pace gradual moder pre emptiv pace guess come word know mean idea go determin pace fact come will determin level time_think perfect word necessarili think mean aggress know relat averag number vincent provid know magnitud talk measur concern realli want signal go determin move fact come realli want signal gradual pace
24661,2004-05-04,guess ask pace polici_accommod will remov will determin econom event unfold prefer someth rather use code word measur
24663,2004-05-04,hear lot differ interpret around_tabl
24665,2004-05-04,ye
24803,2004-06-29,thank mr chairman econom_growth increasingli becom broad base believ sustain capit expenditur whose curtail caus last recess strong employ_growth last_sever_month realli come life manufactur show real strength time rise capac_util employ_growth consecut month retail_sale continu_grow solidli inventori increas continu manag compani inventori_sale_ratio drop low month turn support expans go forward corpor profit percent last_year forecast continu_strong_growth debt equiti ratio nonfinanci corpor continu_improv peak set third_quarter level last recent flow fund data show fourth straight quarter surplu fund gap busi thu compani financi strength fund continu expans intern access capit market financi institut fund favor term earlier chairman comment profit share gdp versu gnp staff steve particular will amaz number tend look time profit share gdp number actual show extrem peak profit share hit seventi year percent gdp quarter point run averag profit share tend revert mean time impli right know analyst look individu compani forecast earn per share will show mark slowdown growth assum compani will absorb cost pass custom histor profit_margin reduct come rel faster growth labor_cost price reflect part recent revis employe compens cost fourth_quarter_quarter_year product_growth_slow expans progress competit worker intensifi strong employ_growth continu factor increas compens retain best employe competit labor_market will like contribut larger share incom go labor optimist labor_cost staff_forecast variou inflat measur releas last fomc_meet show surpris strength indic improv core crude compon produc price_index fallen month nine month except increas core_cpi eas bit month acceler can point unusu jump price item use car apparel lodg list except get broad enough ask price_power return much wider sens think_time need especi attent incom inflat data sure act promptli limit acceler
24916,2004-08-10,thank mr chairman alreadi talk soft patch go prepar note today main concern soft patch actual go last presid_guynn earlier consum realli kept economi move overal busi expans term get right path question today happen consum concern soft retail_sale last_month though obvious slow elev level hear energi_price concern consum food price coupl retail mention price gallon milk gallon ga rais_question much peopl left discretionari spend price start moder level reach end soft spot home_sale probabl bullish indic real intent continu_strong though sale plateau done record level purchas home clearli term commit hous_market indic degre optim evid retail_sale sector base feel optimist economi will soft patch next_month comment heard retail remind care look year_year comparison sale third_quarter last_year consum get tax rebat check went spent fund especi lower end type retail_sale need mind unusu boost sale year_ago job number indic alreadi clearli creat lot confus came friday weak employ_report row especi revis factor alway data can volatil look indic job differ signal discuss board meet yesterday initi claim fairli stabl suggest job creat household survey point optim part household indic substanti growth employ usual labor_forc grow signal consum optim mix inform happen employ data inflat number find moder last_coupl_month rapid rate saw half look total inflat core_inflat measur use factor like reason soft patch moder inflat want stay measur_pace languag latest statement given data last_meet clearli provid surpris want reemphas commit remov polici_accommod measur_pace depend data evolv
24973,2004-08-10,mr chairman_support_recommend word third revis version better previou draft think chang posit
25078,2004-09-21,thank mr chairman econom indic other variabl last_month net show continu expans though slower pace half last_year begin year governor ferguson mention recent survey show busi attitud larg compani small_busi posit littl optimist last_quarter use coupl anecdot throw tabl hypothet explan happen ceo meet stock analyst sometim mention manag team shift focu final rule came sarban oxley implement audit adapt intern control year_end order compliant legisl activ time manag normal use decis busi expans know expect regard abil compli sarban oxley alreadi begin warn compani total compliant year_end reput risk signific compani interest develop will cite duke survey governor ferguson cfo larg compani expect gdp_growth moder percent next twelv month anticip earn growth compani percent averag get comment past talk cfo realiz live nomin world reason caution spend hire concern can deliv doubl digit earn growth street modest sale moder inflat month ahead bottom line growth control expens comment overal compani stronger indic look pattern chang corpor debt rate worldwid will year debt rate_rise invest grade invest grade invest grade taken six year happen reason credit spread come latest inflat data continu show inflat moder rate record spring health_care notabl except moder rate_inflat thing feel expans like continu though modest pace therefor feel posit taken polici_accommod can like remov measur_pace appropri signal send market signal think help extend expans help term debt market sever alreadi note term debt rate_come though rais fund_rate_think credibl move along materi use mr reinhart append transcript appendix path will keep capit within easi access afford compani confid addit busi_invest
25126,2004-09-21,support
