,start_date,content
14889,1996-07-02,comfort recommend mr chairman extrem hard explain current set fact model use implicitli explicitli intrigu construct frankli none realli know happen seem move tighten_polici demonstr feder_reserv knee jerk reaction growth clear evid increas compens let alon price think mistak tighten economi stronger unclear asymmetr_direct convey ask sever peopl includ got differ confus answer want know exactli laughter person guess will quandari will inform will unsur exactli happen reason admit shock occur intermeet_period caus assum anyway name phone along happili recommend
14939,1996-07-02,basic level seem welcom respect leadership role world mr mcdonough point seem will accord work close possibl major central_bank keep thing keel avoid financi crise purpos seem world get complic probabl go need quit flexibl set instrument quit flexibl set group countri deal differ way persuad staff paper current swap probabl obsolet instrument worri elimin much surer kind structur want go forward think_need rethink care need light coupl set polit sensit set concern friend alli around world worri perceiv unit_state withdraw world believ inward look hell rest_world stanc moment draw foreign aid pay bill due intern organ rid swap line might indic withdraw world think anybodi around_tabl want set polit sensit exactli peopl respond congression set fear somehow go becom entangl structur set relationship think care foreign aid mutual arrang among central_bank avoid world crisi must view give away creat problem anyth extens credit arrang obscur mysteri get togeth central_banker might thought good polit seem sensit set issu work care think thing harm overturn exist arrang though modern one
15097,1996-08-20,support_recommend mr chairman seem move evid slow economi hard thing explain risk differ kind credibl humphrey_hawkin testimoni expect economi slow see suddenli move direct suggest slow clearli risk_inflat remain vigil believ possibl will move think gener view around_tabl gener view seem question rather will know time like will move time economi slow predict greenbook believ time decis
15151,1996-09-24,worri face around_tabl think remind worri best set problem think central_banker around world wish set statist think mike_prell other rightli emphas uncertainti difficulti forecast particular moment overdon bit fact develop intermeet_period reinforc previou intermeet_period given reason confid sens happen economi abil forecast reason short_run thing thought knew economi_grow strongli expans like slow data certainli consist expect slowdown especi consum side although certain noth certain slowdown will last labor_market prove tighter thought tight_labor_market someth want gener speak want incent tight_labor_market creat employ effici possibl employ employe focu upgrad skill worker need badli thought knew wage begin creep tight_labor_market mitig stagnat wage inde begun happen rais cost labor despit slower_growth cost benefit third thought wage_increas begin pass along price_increas slowdown expans begin edg robust economi time keep inflat control thought risk clearli side stand readi move quickli forestal price_inflat economi prove robust thought last_meet might find answer quickli evid around_tabl behavior price peopl point surprisingli good seem situat time_last_meet watch care potenti inflat agre governor yellen danger zone higher_inflat yet pleas fact thing turn understood current situat
15181,1996-09-24,mr chairman strongli support_recommend respect current monetari_polici respect asymmetri intrigu other think disaggreg product data provid partial explan mysteri wage rise profit hold price_inflat go hope will give chanc work think appropri worri strongli inflat advers inform next week think prepar reconsid
15274,1996-11-13,find good situat remark uniform stori around_tabl suggest tight_labor_market potenti make consider contribut run effici economi provid opportun peopl modest skill increas skill move job provid moder increas incom shortag peopl comput skill result peopl obtain comput skill will lot better go forward bob mcteer young interview learn pronounc conserv better job good time slow expans predict littl evid rise_inflat economi gener kind mix signal realli although littl uncomfort forecast difficult tell will happen next build case think expect economi will rebound rapidli mystifyingli proper behavior inflat sever member suggest temporari consum come roar holiday beyond build case excess slow suggest consum remain cautiou face rise debt clearli valu stock_market might head perhap sharpli much depend post elect polit develop strong evid might fairli quickli bipartisan will continu deficit reduct process reassur consum financi_market give lower term_rate solid basi continu moder_growth best gift newli elect candid white hous congress deliv will easi will lot harder progress deficit last_sever_year sum greenbook_forecast look good risk sever peopl point seem lot symmetr time_last_meet expect month look much problem
15299,1996-11-13,support asymmetr presid_jordan feel nearli asymmetr time_last_meet alreadi think move question win formula let stick
15375,1996-12-17,know smart lucki seem bless nearli ideal economi_grow rate close potenti reason quarrel greenbook_forecast certainli reason concern futur inflat given tight_labor_market begin acceler wage_increas think rememb can keep labor_market_tight run increas potenti economi_grow without inflat tight_labor_market encourag train give job experi worker otherwis encourag invest effici equip product enhanc process good_deal evid think happen improv potenti econom_growth without inflat futur wage_increas begin low end wage scale augur sens will encourag transit welfar work hope will next sever_year will give worker job experi clearli worrisom problem horizon stock_market sure will work contribut upward bounc consum_spend suggest signific correct will reduc confid cut spend futur share staff optim prospect budget agreement want underlin fuss six_month pessimist final gotten littl optimist budget outlook think right believ congress presid will togeth next_month work deal will keep deficit rise bring significantli main element medicar agreement reduc reimburs rate possibl mean test part premium aggress action medicar fraud action alreadi seem pay quit congress administra tion hung medicaid sens intens congression republican demand block grant state begin realiz taken lot alreadi actual soften harsh treatment legal immigr welfar reform expect will mean lot spend although eas disabl legal immigr seem_like near_term cut discretionari spend creat realist track time spend previou spend agreement unrealist trajectori precipit declin discretionari spend period close year_think chanc presid congress might tackl longer_run social secur problem take advantag boskin report solv rel easi run social secur problem downward shift cpi adjust probabl percent mayb half futur benefit cut form higher retir age happen admit pretti optimist clear near_term effect spend reduc benefit pare slightli might posit effect confid true consum_spend save worri social secur term retir incom might actual posit effect consumpt
15386,1996-12-17,year includ mean test
15401,1996-12-17,agre especi vice_chair formul reason move moment fine risk clearli side though thought launch asymmetr pattern enough convinc revert symmetri although must find mean asymmetri littl mysteri
15518,1997-02-04,low economist joke laughter
15523,1997-02-04,dearli love someth startlingli differ think live differ countri realli seem accumul evid quit consist pictur strong_growth fourth_quarter strong_growth quarter clearli will continu will follow significantli weaker quarter forth pattern growth statist superfici confus overal get remark consist pictur healthi broadli base econom_growth geograph industri solid pictur think felt six_month_ago roar boom either tight_labor_market report almost everywher wage creep increas benefit cost level growth cost like turn rise sharpli end shift provis health servic manag care product data remain significantli mysteri low increas seem fit indic major quarrel staff analysi forecast might tad optimist prospect rel gimmick free deficit reduct includ someth legisl contain signific medicar medicaid restraint might continu futur certainli desir outcom bond_market probabl respond think incident good_news might threaten passag balanc budget amend agre staff amend like pass probabl good outcom surpris unemploy_rate got quit low staff_forecast indic hand share nervous oil_price might feed slightli higher_inflat staff_forecast question last_time realli can expect favor set indic continu agre risk upsid noth suggest immin danger inflat take wait plausibl strategi realli believ staff_forecast basi almost everybodi articul around_tabl differ much real question take risk wait tighten question remain low_inflat tight_labor_market sustain situat persist kind temporari adjust end normal relationship will reassert latter go occur think ahead normal relationship alway
15585,1997-02-04,support_recommend asymmetr includ strong express humphrey_hawkin testimoni concern sustain low_inflat tight_labor_market believ best inform group american economi possibl assembl anywher benefit best statist analysi real feel economi around countri yet come end gut feel happen feel chang last_meet point evid higher_inflat solidli base statist question sure worri sustain_growth consist price_stabil cannot sure think everybodi around_tabl agre prudent thing someth today move yet reason wait littl longer respect humphrey_hawkin testimoni think lot import thing around_tabl couch commun import sustain_growth worri wast credibl asset think credibl person credibl right write strong humphrey_hawkin testimoni correct equiti_market bond_market will certain come need anyth laughter abl accomplish object without move fund_rate import control economi problem will deal meet
15653,1997-03-25,watch remark economi puzzlement last_sever_month sign strength privat domest economi alway seem mix signal expans might slow strike point sign slowdown nearli absent virtual statist nation_level point continu strength pattern reflect almost uniformli report around nation although report atlanta sound littl differ labor_market_tight employ move labor particip workweek longer initi unemploy claim indic reinforc good job pictur consum_spend strong inventori lean busi_invest hous nonresidenti_construct name look good look economi run steam element restraint feder budget modestli restrict think outlook fiscal_polici probabl biggest differ year remain fairli optimist will budget deal probabl will pressur elect keep congress tri hard finish work home debat will probabl string think budget deal will done without govern shutdown without continu resolut agreement like includ modest cpi fix agre quickli end legisl process regard think overreact presid reject commiss idea due respect chairman need commiss need fix cpi guess will someth
15655,1997-03-25,run effect depend budget legisl includ signific reduct growth medicaid medicar think chanc quit good will nevertheless effect will mostli psycholog possibl particularli strong real effect deal go great near_term neg mention much bigger effect net_export clearli help restrain economi moment exacerb run problem current_account_deficit obviou solut moment case view economi littl robust sustain clearest serv board admittedli small move restrain growth futur acceler_inflat seem increasingli like prolong remark expans seem want much downsid_risk sharper better polici instrument oper immedi certainli afford wait unfortun
15675,1997-03-25,strongli support set move_basi_point symmetr_direct think action terribl import announc next day believ key word want sustain_growth economi sustain abil tight_labor_market enorm benefit see tight_labor_market_think sustain goal support symmetr_direct think signific uncertainti will want move want stack deck
15719,1997-03-25,reaction littl heavi inflat_think want stress quit much
15766,1997-05-20,seem wit impress perform economi everyth around_tabl today quit time testimoni basic strength resili economi abil restructur realli know much go plea tri find last_month economi seem handl tight_labor_market remark need inform exactli happen differ kind wage differ labor_market know lot anecdot convey impress labor_market_tight everywher employ short technic skill especi comput skill peopl go can basic given happen last_month conclud flexibl labor_market flexibl economi compani lot train lot upgrad lot job reorgan substitut capit labor someth right tight_labor_market gotten hand know much met bill mcdonough board includ buffalo board struck comment director think chairman buffalo branch complain columbu ohio held job fair buffalo laughter bad buffalo guess exactli kind thing happen columbu right thing peopl move around employ look employe either recruit come workplac move oper place someth work quit clearli know enough know enough happen product side coin anecdot much posit staff_forecast return trend indic staff quit rightli worri employ dip unemploy pool will skill worker slower product_growth trend sure enough peopl suspect number margin relat overal number worker outweigh happen product gener flexibl economi adjust shortag skill fact know assumpt right go struggl question time come clearli think data fill gap aggreg statist employ cost index tell great_deal anecdot trade around_tabl seem seem almost everybodi risk clearli upsid respect inflat question discuss later meet move move later seem sent valuabl signal name fed awak watch question better send signal watch leav use later final word piec good_news budget deal posit press import deal cynic seem eager cynic point deal involv big cut spend partli done alreadi deficit percent gdp need cut spend much big core piec reduct cut futur rate_growth medicar extrem import effect reduct futur rate_growth third point spend cut extent offset increas spend educ opportun time spend will involv nation govern obvious nation can improv educ train next sever_year will better shape advantag huge opportun present tight_labor_market
15778,1997-05-20,agre think analysi appeal hope right will littl find believ agre risk upsid economi strong probabl will move view psycholog argument much favor move market fed watcher interpret move time end stori especi expans soften will much bigger psycholog effect move point support_recommend mr chairman
15861,1997-07-01,somewhat instinct look minehan anniversari meet speak look meet year_ago greenbook meet follow point gdp grow rate trend rate expans expect slow trend inde quarter growth last_year turn stronger greenbook predict consumpt invest hous describ strong expect slow last_year greenbook tone surpris strength especi consumpt hous labor_market describ tight demand labor expect moder unemploy_rate percent expect level around percent concern express prospect wage_increas employ cost_increas rise minimum wage impact wage gener minimum wage legisl pass yet expect prospect increas cpi actual cpi forecast shade littl basi recent experi addit boldli state stock_market serious overvalu year later gdp experi slow quarter fast one balanc stronger forecast year_ago expect slow trend quit rapidli thought last_year labor_market_tighter anticip actual expect littl unemploy_rate level percent instead percent concern express outlook wage_increas employ cost_increas round minimum wage hike prospect increas cpi forecast cpi shade bit stock_market describ emphat good reason serious overvalu forecast declin stock_price immin learn past_year_think learn cautiou tone current greenbook consider sure year_ago learn economi inflat prone thought year low_inflat can confid expect_inflat will low risk_inflat almost everybodi around_tabl emphas risk think can cost wait prove anticip awar view run time learn tight_labor_market benefit caus peopl use labor effect heard exampl around_tabl meet lot progress toward solv fundament puzzl question wage benefit rise faster job insecur hypothesi propound chairman year_ago seem perhap littl plausibl year plenti job puzzl price rise given labor_cost_increas strongest contribut clearli downward_pressur import_price stem strong dollar effect seem come end good analyt explan anecdot keep hear includ perceiv inabl firm price_increas stick thoroughli domest market quit local market puzzl mystifyingli product remain puzzl circumstanti evid point acceler product_growth possibl associ mainli larg invest comput associ chang product process type capac increas tight_labor_market greater flexibl use labor realli know usual statist help think come contest optimist pessimist tend optimist think vigil inflat inclin ed boehn littl side wait think lot progress analysi will tell optimist pessimist
15899,1997-07-01,rememb think someth morn laughter
15909,1997-07-01,mr parri
15913,1997-07-01,recommend word think simpler clearer
15942,1997-07-01,strongli support_recommend amus yesterday say agnost sound rather agnost moment know actual happen
15944,1997-07-01,fair enough think view uncertainti fact clearli enorm pressur someth noth wise cours risk_side
15995,1997-08-19,unless negoti success lead greater organ success non union compani
16044,1997-08-19,alway optimist think born find stuck paradigm moment help much flow data good featur economi emphas sever meet row believ beyond point get short_run good_news solid econom perform enough quit reassur basic sens strength competit economi good thing continu tight_labor_market without acceler_inflat terrif certainli lot evid increas competit industri home abroad reassur fact export held face dollar realli_quit good thing continu balanc growth across region industri get harder harder figur eye close talk around_tabl report quit uniform top gener good_news agricultur commod prospect growth market abroad keep favor export stori go dollar fail revers cours seem major mysteri go especi product help decid among paradigm actual peter find use organ set box think conclud risk_side much worri possibl economi overheat will face prospect higher_inflat_think know tool question use bigger problem economi reinforc mind humphrey_hawkin experi chairman share larri meyer bill mcdonough problem distribut gain good economi hard refut evid gain heavili concentr top percent incom distribut find worrisom real problem social cohes potenti problem econom stabil strike labor unrest perhap result perceiv success up strike seriou problem seem peopl_talk economi includ perhap especi repres feder_reserv talk good thing happen crow excel economi risk sound insensit touch averag peopl major popul hand recogn problem concentr gain top incom distribut lead reason question regard propos command tool can help can talk gener term kind polici educ train seem care talk economi given limit tool monetari_polici dispos
16047,1997-08-19,mention nairu today
16059,1997-08-19,lunch consequ laughter
16088,1997-08-19,will honorari motion
16090,1997-08-19,can legal move boehn motion
16121,1997-08-19,
16155,1997-08-19,success
16238,1997-09-30,ed boehn other feel move thing paradigm listen econom financi press sometim convers around_tabl get impress possibl explan happen moment economi function realli chang much last_year view economist model paramet fit data last_coupl decad good predictor someth temporari sever temporari factor give favor result right temporari factor turn around everyth will snap place particular inflat low product_growth bugaboo economi late earli will plagu much altern explan era paradigm actual seem mean paradigm view possibl cake eat without worri product inflat former will rapid latter nonexist view economist ignor anyth cautionari overh bubbl asset valu wage outrun product_growth atmospher gotten littl polici discuss earli rememb clearli period call suppli_side economist overwhelm essenti kernel truth thesi incent includ tax incent matter econom perform absurd claim magnitud like effect labor suppli save_rate small margin chang tax rate warn deficit gener cut tax rate without cut spend might lead either inflat respons feder_reserv higher interest_rate punishingli dollar label paradigm keynesian paid much mind help debat led bad polici undermin confid econom profess thing avoid laughter moment seem focus paradigm fact fact economist learn great_deal economi work last decad demonstr function better thought good fiscal_polici good monetari_polici clearli credit accumul evid economi flexibl respons inflat prone use mind gratifi chart greenbook meet meet inventori_sale_ratio chart especi manufactur keep trend suggest manufactur realli learn someth inventori manag fundament surpris thing economi moment uniform activ level across countri across sector economi labor_market seem almost uniformli tight twelv peopl around_tabl almost exactli thing quit close realli understand true suspect flexibl labor_market product locat use worker move job job move worker capit move easili nation intern product can locat expand differ place includ oversea across mexican border readili use heard wonder exampl today minehan bombay offic boston area hospit maquiladora process surpris develop appar increas_product_growth time economi_grow period boom might expect run steam economist alway given reason observ slowdown product peak cycl seem much sens use scrape bottom labor_market bring skill experienc peopl undoubtedli true drop percent percent unemploy_rate big drop unemploy mean increas littl percent employ labor_forc hard believ percent workforc inept inexperienc realli drag product much explan hear effici capac brought line boiler use firm face sever capac constraint final brought line obvious product seem sens period invest accompani rapid technolog chang tight_labor_market current environ actual provid incent increas_product none seem reason argu economist know anyth staff irrelev seem provid rational tent hypothesi economi inflat prone today lot reason relat global inform technolog pro competit develop safeti valv recent immigr might given labor_market econometr use thing inher conserv sens paramet shift equat pick consider lag moment hard defend proposit economist know sens economi oper percent unemploy take seriou risk wage_price_increas oper rang quit either rapid acceler wage_increas_price declin core_inflat temporari factor frequent invok explain dollar fulli plausibl explan economi much open use plea era think sens throw caution wind plea economist stop defens tri figur care staff actual dynam economi realli work
16257,1997-09-30,agre polici recommend bill mcdonough notion talk think_risk upsid think littl convinc will move
16259,1997-09-30,right heard someth stronger odd perhap littl persuad deal much inflat prone economi littl persuad biolog argument part depend fix labor_forc sure labor
16261,1997-09-30,right depend fix popul
16263,1997-09-30,okay question labor_forc bombay mexico much flexibl outsourc call skill peopl distant place argument littl overwhelm guess littl skeptic job insecur explan limit wage_increas put lot explan worker side_think strong disinclin employ side grant wage_increas correct percept economi competit numer reason includ reason talk think_need accumul evid take action polici recommend right today
16340,1997-11-12,version tom hoenig question quit surpris project falloff product_growth forecast gratifi improv year reflect experi estim increas trend_growth big drop increas output percent per_hour can word think will drop much
16342,1997-11-12,movement toward trend line fall
16386,1997-11-12,appli sever ye
16402,1997-11-12,find situat month group record awe wonder continu_strong perform economi vari degre concern futur wage_price_inflat share evolv theori littl increas wage face low unemploy price_pressur share guess chairman use word guess will use publicli anymor laughter okay use
16404,1997-11-12,share guess world thought knew like reappear worri much rest_world except note global competit strong dollar help fight inflat dollar unlik rise much longer otherwis world economi seem perk along inde grow enough buy increas amount export will feed voraci american appetit import month forc remind increas interconnect global economi capit market clich speech interconnect real ad greatli uncertainti econom futur look greenbook find bit optimist greenbook staff domest economi bit pessimist intern situat optim domest economi relat mostli product greenbook assum substanti fraction recent good_news product temporari will revert trend quit forc slow_growth tight_labor_market increasingli think possibl confluenc tight_labor_market invest technolog chang come togeth give sustain spurt product increas sure greenbook seem will need rais interest_rate near_term incident imagin make speech coupl_year talk assumpt greenbook lay absolut right hard speech rais interest_rate tank stock_market cut growth_rate half thought potenti growth_rate rais unemploy ye admit overshot begin lower_interest_rate worri inflat greenbook_forecast quit modest explain although forefront argu cpi overst correct realli mislead leav correct look inflat find hard speech mayb will laughter hand pessim rest_world littl greater greenbook base real knowledg feel great potenti snowbal weak around world immun system unit_state quit good thought might stock_market correct rais interest_rate simpli contagion abroad right might face much greater potenti conflict domest foreign respons time will wonder economi_grow strongli rest_world lot weaker
16436,1997-11-12,
