,start_date,content
16498,1997-12-16,think brave staff produc greenbook_forecast increas uncertainti world event short interv meet certainli widen confid interv quit lot though know exactli confid interv hunch domest economi prove stronger resili greenbook suggest other around_tabl voic feel sens momentum wage_increas especi low end wage spectrum sure declin inflat matter much wage_increas achiev chairman definit price_stabil occur inflat play busi consum calcul skeptic staff minimum wage lot wage_increas inclin attribut increas tight_labor_market true absenc minimum wage_increas go forward will much restrain effect staff seem anticip think health cost_increas ad labor_cost greenbook predict though happen yet especi somewhat_higher wage consum_spend prove stronger project greenbook littl skeptic signific neg wealth_effect stock_market hope will name reflect real earn prospect compani compani drift moder rate kind outcom major neg wealth_effect littl momentum busi_invest staff estim expect slightli stronger economi give significantli higher_inflat cheaper import includ flood good will get asia certainli go hold price_increas_product_growth hold littl_better greenbook suggest mystifi deflat question time speech conclud unlik ed boehn question taken serious ask pose question realli mean often good answer mind someth read front page wall street journal sound good question ask speaker feder_reserv prospect price actual will face normal continu strength economi strike bizarr foreign front thought bill mcdonough analysi extrem cogent spent week europ listen remark japanes financ ministri central_bank offici concern go economi explan reassur european colleagu ask thought understand problem polit will need know great_deal uncertainti can come grip problem cours possibl fall precipic intern conceiv domest intern rout sudden effect stock_market consum_confid kind gulf war phenomenon nobodi expect happen think unlik balanc far greenbook_forecast although confid interv anyth might next week wide
16522,1997-12-16,ted truman credit worst case refer wors case
16548,1997-12-16,support symmetr think case move rate asian problem case move rate sure total persuad case given cpi product inform asian problem know sever effect will seem symmetr right thing
16646,1998-02-03,lot peopl note committe face unusu degre uncertainti true uncertainti today decis harder fact make easier fact immin danger inflat recess make easi justifi leav monetari_polici lever evid accumul bear question might want move uncertainti level mean like face tough decis next_month question direct can live greenbook_forecast can imagin economi prove good_deal stronger staff_project consum demand prove resili project base strong wage growth attract interest_rate financ home durabl car continu strength stock_market yesterday stock_market increas seem irrat best asian crisi bottom current predict slow effect economi rest_world worsen think market behavior irrat inde chairman_think loud vein guarante behavior will continu favor financ gener optim keep busi_invest stronger project economi prove stronger near_term staff anticip face difficult dilemma earli next_month especi big increas eci end turn blip attribut extraordinari bonus real_estat agent stockbrok begin broad base acceler labor compens comment around_tabl seem support possibl decis increas feder_fund_rate difficult defend publicli downward_pressur declin import_price constrain inflat product might exceed expect prospect slowdown economi net_export drag slower inventori_accumul highli like show current data happen will face hard choic rais_rate know come think al broaddu lot lone laughter convers can imagin economi look substanti weaker greenbook_forecast next_month scenario depend larg psycholog factor anyth like pick model list downsid factor includ potenti setback asia lack polit will carri reform korea japan round devalu possibl spark china hong kong give pressur devalu downsid factor might involv spate poor corpor earn report trigger steep drop stock_market fall consum busi_confid neg domest polit develop escal tension middl east trigger precipit steeper anticip reduct growth neg downward spiral threaten world recess view scenario lot like lot danger fed might call act quickli decis contain damag tri restor healthi growth thing world cannot afford right stall engin hard decis especi event prove mildli neg expect will distinguish stall return sustain_growth believ economi recent histori strongli suggest conclus economi lot inflat prone face tight_labor_market use think tight_labor_market import posit effect individu incent work acquir skill experi busi incent invest product enhanc process capit improv henc believ fed prepar act quickli decis limit damag slow_growth rise unemploy
16699,1998-02-03,despit enorm ingenu staff think understand relationship guess understand will much better comfort return relationship familiar might last think optimum posit tell congress honestli understand ms fact discuss monetari_polici term ms humphrey_hawkin meet don kohn duti mention think think monetari_polici think want crusad moment reason stay altern think will involv complic discuss congress adopt particular rang think_good rational chang although move consist set rang rather nice druther consist talk ms
16701,1998-02-03,prefer altern zero practic matter opt altern
16772,1998-02-03,strongli support symmetr best polici moment
16873,1998-03-31,mike excus academ say year_ago
16894,1998-03-31,think fomc difficult spot though expect will much sympathi laughter difficulti bill pool point stem anyth bad happen precis littl bad happen economi perform probabl economi mind boggl thought peopl produc consum work invest higher_level anywher better economi adjust mechan seem work better elsewher capac expand modern time compani learn manag inventori labor_market seem function move peopl need shortag bottleneck strike imbal character boom period past seem evid although look hard find imbal world event support good perform economi especi true bill pool point respect price oil latter seem fallen far enough help oil consum industri industri without hurt oil produc sector much creat widespread problem although bob mcteer point problem hard find villain piec look usual suspect politician seem behav reason report around_tabl quit actual point specul build yet evid boom nonresidenti_construct although lot report labor shortag consider evid respons flexibl target compens increas coupl cost cut nonlabor area report compani leav job unfil expand differ locat rather bid wage stock_market seem line evid investor respond sensibl earn declin particular stock view equiti good run invest might indic investor panic event signific stock_market correct make policymak quit hard job keep good_news flow quit sure economi cannot expand much longer current pace without run worker set process labor_cost_increas follow price_increas insur slow thing tad clear polici instrument will real feder_fund_rate alreadi quit rais notch might rais_rate reason mention might much effect convers danger increas strong signal especi stock_market might induc panic sell signal anyth lean notion probabl much effect guarante outcom might either worri overh staff_project expans slow asian effect reason prospect overh might seem seriou risk will slow labor_cost pressur will build certainli voic around_tabl good_news seem almost evid surpris rapid spurt inflat anyth seem clear economi adjust mechan oil moment unlik surpris sudden lurch comfort decid noth
16947,1998-03-31,sound okay
16954,1998-03-31,mr chairman_support_recommend think remind except bill pool situat chang view outlook inconceiv will six_week someth presum develop asia weaken expans quit sure seem today everyth move direct overli strong economi certainli agre look today lot sympathi suggest announc asymmetri decis immedi think wish alreadi adopt polici someth asymmetri announc today chang announc polici midstream without prior discuss probabl better rais fed_fund_rate today peculiar unexpect thing stress import make polici speech seri polici speech weav remark feel suggest emphasi worri specul loos credit concern peopl can relat rather say think economi restrain worri tight_labor_market poor peopl earn money sound silli sometim come across though real worri tight_labor_market rather object bill mcdonough earlier keep labor_market_tight retain benefit full employ futur
17095,1998-05-19,substanti ferguson sure can case better present difficult problem extrem strong economi_continu_strong extraordinari perform time meet anecdot tight_labor_market begin sign tight sort specul build land price_increas evid kind believ learn thing economi last_coupl_year lead reluct move quickli economi clearli inflat prone low_level unemploy thought reason temporari need watch turn around rise dollar fall oil_price slow_growth cost health_care benefit exert benefici effect inflat go last reason seem much last believ product upshift probabl combin technolog develop manag reform attitud deregul global competit lower_inflat_expect way busi react labor scarciti thing believ learn tight_labor_market lot good gener experienc worker train educ opportun promot incent invest oneself worker invest skill actual happen pay product improv futur low unemploy level seem gener pressur capit deepen unusu payoff present state technolog none mean limit ferguson economi cannot continu_grow quarter pace without run worker gener seriou wage eventu price_pressur worri prospect expans will slow reason set forth greenbook tend think greenbook bit optimist asia rout deterior indonesia korea possibl japan leav stock_market clearli sure anyth might provid good signal signal stock_market appropri use monetari_polici inclin view will correct earn deterior right asia sourc deterior sink join urg wait yet six_week think tighten might prove unnecessari
17115,1998-05-19,mr chairman concur part recommend think move today reason relat asia term impact move asia rather expect deterior situat asia impact economi seem anticip possibl move unnecessari nevertheless agre risk upsid share view presid_pool minehan much risk wait percept economi tight spring readi pop economi lot inertia quit time_think cost wait like
17136,1998-05-19,mayb leav
17188,1998-06-30,eat find
17255,1998-06-30,realli seriou laughter
17262,1998-06-30,around_tabl find greenbook_forecast appeal nice right think forecast turn right find situat extrem interest unusu uncertain difficult mean soft land difficult choic domest respons intern one much good_news last_year nice think_good_news normal domest economi certainli perform extrem demand standard growth strong balanc labor_market_tighter without advers inflat consequ longer thought possibl wage rise yet alarm pace price astonishingli behav far capac increas whatev think perman imperman product increas certainli need help keep wage_increas push either price profit pace growth last_year acceler quarter_year clearli unsustain anybodi measur keep ad payrol rate without run worker end proverbi bottleneck amazingli absent current boom without impend slowdown clearli tempt requir seriou econom analysi use tool slow expans save forecast show growth_rate drop rock combin impact inventori retrench worsen asian crisi hope greenbook right roughli right slowdown will occur inde alreadi occur certainli agre evid point slow skeptic break sharp staff believ guess will domest economi run bit faster think sustain can sign domest inflat worri think dollar like stay strong anti inflationari inertia current potent forc mean low_inflat_expect pervas belief busi commun price_power market_condit competit keep inflat check forecast substanti wrong growth_slow much realli difficult problem problem aris primarili respect central_bank unit_state institut world respons sooner obviou economi_continu run hot seriou dilemma especi world outlook precari precari look can tell best thing world keep economi_grow sustain track therefor better slow rais_rate take risk make world situat tenabl perhap precipit round competit currenc devalu lead prolong global depress attract set choic better hope greenbook_forecast right cours possibl rais sever around_tabl greenbook wrong direct sharp slow cut investor consum_confid stock_market turn ration nonexuber face soft economi rise unemploy unfortun particularli hard manag polici point view world quit happi cut interest_rate
17299,1998-06-30,certainli noth go perfectli clear support_recommend mr chairman yesterday think staff overestim potenti slowdown near_term worri asia possibl gener collaps sever foreign countri think know can avoid know rais feder_fund_rate today appropri measur
17326,1998-06-30,come mike kelley ed boehn chairman easili seem oblig clear possibl across press public follow monetari_polici develop deal hard issu balanc_risk mysteri thing behind wall templ want peopl understand discuss context rather admir brit done get talk clearli seem sometim start notion mayb step announc tilt comprehens signal market signal came conclus realli signal put market difficulti mike kelley ed boehn discuss rather eloqu believ end confus part world chang six_week chang mind good predictor futur polici_action larg often perceiv thing differ time next_meet_think want posit explain everyth els conclud right thing except amend word direct propos right mysteri extrem would might time hear littl difficulti laugh laughter think better mind except harm announc chang decis chang decis polici decis chang treat state decid end meet ordinari rather continu use arcan express committe met
17328,1998-06-30,agre
17330,1998-06-30,cannot decid move feder_fund_rate
17332,1998-06-30,cannot
17334,1998-06-30,think propos deceiv public
17337,1998-06-30,think add percept mysteri feder_reserv
17339,1998-06-30,let tri
17377,1998-06-30,might
17451,1998-08-18,fomc tend concentr happen last met magic period known room intermeet_period find interest littl sometim case went month_ago found impress compliment folk forecast abil staff meet rememb held near end roar quarter prove stronger expect time staff predict albeit somewhat diffid drastic slowdown expans due inventori deceler impact asian financi crisi net_export skeptic around_tabl includ hindsight appear staff quit good forecast time littl quarter stronger weaker anticip basic forecast slow potenti rest year_next look increasingli right call stock_market right far despit reduc earn expect bound occur slower_growth expect modest correct stock_market far gotten evid look month asian crisi prove deeper intract possibl contagi thought month_ago japan deepli mire polit paralysi asian economi especi indonesia desper shape china includ hong kong russia possibl brazil fragil anticip time look ahead seem overh economi like slip categori past worri despit evid shortag construct worker materi mention around_tabl learn last_coupl_year extrem tight_labor_market economi much prone acceler_inflat thought labor_market seem_like eas bit econom_growth_slow necessarili mean will avoid uptick inflat delay reaction higher wage possibl increas health_care cost factor mention inde might bit stagflat happen unfortun live hard imagin rais interest_rate face soften employ econom_growth potenti learn good tool combat stagflat suspect domest overh inflat go fairli low list worri next_month rather suspect will focus keep world economi non european non north american economi unravel mitig damag economi hard imagin world growth instead recov modestli forecast_greenbook might good_deal wors get better recoveri will delay year economi look strong enough weather storm without recess abil depend heavili consum_confid absenc rout stock_market guess will seri orderli correct stock_market stair step valu line realist profit expect market psycholog fragil thing add say believ risk much downsid upsid move feder_fund_rate certainli right polici
17463,1998-08-18,agre mr chairman symmetr_direct make sens moment direct reflect view unlik chang monetari_polici anytim soon move fed_fund_rate wrong wrong argument chang tilt fact much oper signific move around lot risk look littl silli turn wrong balanc_risk along strong argument leav tilt prefer adopt symmetr_direct
17490,1998-08-18,think blame greenspan
17556,1998-09-29,let start world situat other find world economi sad scari saddest part million peopl develop countri asia latin_america thrown desper circumst point begin hope run futur modern world left villag case home countri search job modern economi thrown insecur struggl bare necess idea econom opportun will reopen stress think sometim tend sit around_tabl act though loser investor flyer definit scari part believ strongli rightli power capit improv peopl live know current downslid will end can will effect stop spread contagion alreadi knew cours larg amount capit move freeli search higher return investor can victim excess optim caught wave excess pessim knew capit flow far greater world market interlink financi movement rapid age instant global commun think knew big impact might knew clever self assur peopl place huge bet peopl money relationship guess sooner later guess wrong consequ seriou exuber turn pessim risk avers weak world financi structur reveal knew learn econom policymak industri_countri struggl figur best manag crisi build firebreak hope contain meltdown rebuild can begin difficult job job around_tabl job committe much narrow keep economi_grow healthi rate american can play strong role possibl bring rest_world econom health last_coupl_year inde whole time part group primarili worri unit_state grow unsustain rate sign point slowdown although strike anecdot domest economi lot neg real statist far nevertheless risk shift clearli risk worri unit_state slide stagnat recess although like happen soon will exacerb world crisi think hard choic today need small step direct monetari eas need stand readi step necessari certainli agre feel rush quickli ahead gain littl probabl ned gramlich un fed thing
17565,1998-09-29,know
17571,1998-09-29,mr chairman_agre recommend basi_point reduct view larger move unnecessari like interpret evid fed must realli worri think want convey impress concur propos downward tilt direct despit discuss begin meet morn go announc decis tilt today might inclin toward symmetr_direct worri reaction asymmetri might question reduc rate_basi_point concern
17574,1998-09-29,decid publish tilt today come favor basi_point reduct asymmetri toward_eas
17664,1998-11-17,think evid accumul real_economi run bunch cheer littl elv laughter forecast often togeth okay guy work real hard mayb can surpris knock elv quit good job benefit domest economi certainli shown hearten resili face global downdraft last_year particularli last_month much show resili adapt upward_pressur threat overh previou coupl_year consum_spend cheer buy hous car maintain fairli robust outlook situat role small investor peopl reinforc optim continu buy stock compani whose near_term earn prospect seem justifi purchas elsewher economi effect world slowdown evid agricultur price export suffer manufactur feel difficulti lay peopl begin pull expans plan investor wari riski ventur despit melt frozen capit market week_ago elv job believ sign point greenbook indic substanti slow economi extraordinari respons sure economi linchpin global econom system slow much believ downsid_risk serious reinforc last eas step take today world depend afford wait done enough alreadi world look fragil economi carri heavi load world recoveri asia bare turn russia total disast western european countri seem quit myopic preoccup affair revis forecast latin_america discuss seem extrem fragil hope mean certainti stave disast brazil round contagion seem worri lot side littl downsid domest risk worri much respons world inflat near_term threat although wage_increas stock_market clearli concern might encourag investor much believ experi notwithstand ration will reassert stock_market earn fall think close question today comfort thought cannot lot harm balanc_risk downsid especi intern feel special respons serious
17699,1998-11-17,mr chairman_support part recommend interest lunch will elabor
17788,1998-12-22,let gener point situat find year_end continu sterl perform economi realli remark go worthi seriou scholarli attent time come year_ago press economist gather meet fomc full talk possibl era endors talk tri explain labor_market_remain tight without caus wage inflat acceler other suggest combin herald unreal impact inform technolog product plu competit manag economi higher product trend got distract worldwid econom crisi effort maintain island prosper midst global turmoil world sake distract economi_continu chug along pump good servic make better better use limit labor suppli reward skill wage provid incent acquir skill hand bonus perform shift mode gener wage inflat moreov good product_growth continu manufactur demand slacken payrol fall urg modern computer remain robust face macroeconom forecast might prompt retrench earlier era economi realli seem work better use work flexibl inflat prone good perform remark longer continu point possibl thing thought knew monetari_polici unlearn name oper lag guynn refer opposit direct think say anyth inconsist remind full effect polici_move last_coupl_month yet felt someth need remind year_ago expect effect complet incorpor yet use think central_banker big leap dark polici instrument power run affect economi period month find tool seem work faster action credit strengthen sometim credit overh economi current_quarter mention prospect half next_year reason increas import equiti_market financ busi expans importantli enhanc consum wealth think wealth_effect go temporari will becom import prosper longer lifespan combin increas portfolio averag famili true europ yet sure will come decad elsewher around world learn accept wealth impact consum behavior increasingli import aspect monetari equat phenomenon cut lag grow import consum credit home mortgag eas refinanc home mortgag home equiti loan make transmiss monetari_polici_move consum behavior direct faster growth global equiti flow sensit global market inform magnifi effect polici_move world import central_bank name soon creat ecb hotter instrument hand use better use third point world scari place will argu greenbook_forecast believ will lucki come pass upsid_risk mention seem risk mostli downsid brazil uncertain russia chao possibl world commun seem absolut paralyz japan worst lot time possibl spiral deflat countri around world focus uneasi knowledg whatev blow next turmoil will spread rapidli world market unpredict way despit optim fundament home think better look care world troubl hope know enough use increasingli short lag polici tool appropri
17808,1998-12-22,mr chairman concur chang symmetr_direct think_risk_side somewhat differ natur upsid_risk probabl emerg gradual surpris virul downsid_risk think like reflect big chang materi although probabl smaller
17811,1998-12-22,will sneak jordan alreadi factor laughter
17847,1998-12-22,support option take come_month reason governor kelley presid_broaddu state slight prefer get rid monetari_aggreg sentenc feel strongli
17971,1999-02-02,glad stimul research atlanta interest see coupl meet ago refer cheer littl elv run economi kick prove cautiou forecast wrong thing can econom news last_meet elv score heard estim fourth_quarter gdp like percent wow offici estim turn percent possibl upward_revis perhap percent elv clearli work overtim gotten ingeni figur control weather temporarili keep product_growth increas reason elf suspect reengin restructur computer done done alreadi amaz seem figur keep unemploy_rate_lower nairu enthusiast time drop dead rate wage_increas actual deceler inflat seem danger present elv clearli begin undermin confid oppon greenbook_forecast laughter start doubt model get littl defens perhap doubt common sens sure greenbook sophist fall elv brazen gimmick weather ploy bounceback auto strike perhap extraordinarili low oil_price think cannot sustain boldli forecast rel quick slowdown trend acceler price point time stock overvalu stock_market like come greenbook say stock overvalu last_time look although expect profit declin expect stock_price fall will move sideway can explan fear elv right often greenbook embarrass caught wrong besid nobodi can predict stock_market question elv run trick can beat game time rest_world bet elv sure speak portugues sure can move brazilian polit system higher gear fast enough reassur nervou world market sure elv ingenu can control mood swing intern investor control contagion might flow collaps brazil major neg event yet unpredict despit histori left think greenbook actual win time though must admit thought atlanta falcon laughter risk economi prove stronger earli part year greenbook_forecast doubt increas oil_price will much think hand greenbook overreact elv stock_market underst chanc neg wealth_effect domest front risk upsid downsid surpris around greenbook_forecast approxim balanc intern risk princip downsid possibl quit seriou fomc believ watch game care comfort seat sidelin resist get action right action indic possibl action like harm good
18033,1999-02-02,much question plea perhap differ structur problem next time around think differ world depict chart interest becom dramat assum stay polici impli time know world chart chart ask decid silli can know focu given know truth like somewher cost make mistak move mistak know help think believ need think next sever meet
18066,1999-02-02,strongli support_recommend mr chairman reason abli state vice_chair bit cautiou send signal humphrey_hawkin testimoni littl inflat sure will anyth near_term convinc move soon
18159,1999-03-30,care listen will rememb comment littl elv kick confound expert model doomsay make economi perform bit better folk imagin read thing elv score front driven enemi field write greenbook laughter
