,Date,content
708,1978-04-18,"  [Statement--see Appendix]     4/18/78             2       Well, I haven’t seen--  We had one day or two days on which the dollar rose  We do consider the disorder in the context of time  We have been discussing at the Desk--and I  have discussed with members of the Committee--the possibility of our initiating a program of mark  purchases  And this would be done in the context of a firming dollar  But I did not detect any  evidence yesterday or Friday of a disorderly market as far as the dollar was concerned       We have been buying for correspondents and in fact one of the big orders  that we had where there is a question of diversification was 250 [million] marks  We put half of  that into the market and kept [half of] it  There is a judgment that we can make as far as  correspondent businesses are concerned whether we put it into the market or not  We have not  gone out into the marketplace and bid for marks  We have considered it  I was prepared to do it  yesterday if the dollar had continued to rise--again, with the disorderly market consideration  It  had risen at one stage by over a half percent from the fixing range, but things quieted down in the  afternoon        Not in theory, but in the world that we are in right now there is a basic  judgment on the part of the US and German authorities that the dollar is oversold and   undervalued--each individual country uses a different term--or that there has been a movement of  the rate too far in one particular direction  So to the extent that the dollar rises, then this would be  more consistent with underlying conditions  But I am prepared, if the dollar rise becomes too  [sharp] and we have the kinds of conditions which are in the marketplace [unintelligible] I’ll buy  marks  We did on a number of occasions [unintelligible] but we are doing a two-way operation       Mr Chairman, the paper characterized the market yesterday and on Friday as  being broad  Now, perhaps the paper was incorrect  The foreign exchange market was strong and  broad; there was active trading     4/18/78             3       We’re still in losses  Our average rate on our swap drawings is 2125 and  the current rate in the exchange market is 205  That is one of the reasons why I am reluctant to  buy heavily at this stage       I didn’t say euphoria; I said that they are just less pessimistic than they were  before  The exchange traders are still very bearish toward the dollar  They have the same kinds of  analyses that are in the Greenbook  I feel rather surprised that this demand for dollars keeps  coming out of the woodwork  And as I say, it is largely the leads and lags which are being  unwound, which we may not see in the actual transactions  The transactions that are done before  that would not appear in the market now       $304 million       The second renewals  But I have a list of first renewals that I still have to  ask for here before we--       Not yet  As I say, they came to the point where the next generation would  have had to be SDRs  They began to buy some of the marks that we were picking up  So they     4/18/78             6  have a cushion of $60 million worth of marks  They are not interested in making repayments at  this stage but are rather eager also to start buying marks in the market  It’s a first [unintelligible]       As Henry mentioned, we are awaiting specific proposals from the  Bundesbank on the swap repayments, so I won’t go into that  During the month of May, the  System has nine maturing swap drawings on the Bundesbank totaling $304 million and four on the  Swiss National Bank totaling $50 million  These are all first renewals  I recommend that the  Committee approve that these swaps be renewed    "
748,1978-05-16,"  [Statement--see Appendix]       It’s 60-40  [Statement continued]       Well, we haven’t had too many days on which the dollar was rising in what  we would technically call a disorderly market  Last Friday we did have almost a 1 percent rise and  that was the day on which I bought marks--almost $40 million worth of marks       In the market  We went in the market and we used some techniques similar  to those we had used on the downside  That was our first occasion  Now, my sensitivity is that  we’ve gone through a period since last June in which many people in the market were persuaded,  from all of the things that had been said, that the United States government wanted the dollar down  And the massive effort we have engaged in both in the market and through our public relations  techniques--and even now the gold sales--to reassure the market that we don’t want the dollar down     5/16/78              2  has helped  But if we appear in the market in a way which would suggest that we are holding the  rate down now, it would reconfirm a lot of those earlier fears  I think we are in a better position  now to buy in the market than we were a month ago or a few weeks ago  And as far as I’m  concerned, whenever a mark comes in my direction I want to take a look and hope we can take it in  for repayment  I’m prepared now, in these nonmarket transactions, to take everything that the  Bundesbank offers to us  I think with rates at these levels we can pull out all the stops in  repayment, including [buying] in the market  We’ve had the question from the Treasury this  morning, should we buy marks today  The dollar is up 30 points  Should we go in to a market that  is not in any sense disorderly or frothy and buy simply to repay?  That’s the hard decision; I am  prepared to buy more quickly now than I was       Not yet  They’re wondering where we got the marks       Actually, Governor Wallich has just reviewed the three major points, so I  won’t go into them unless people have questions on this  The only action needed by the Committee  in this procedure would be to [vote] on the renewals of the swap drawings as they come due  through the three renewals out to 12 months  But so far with our repayments, we’ve been able to  liquidate the swaps that would run out in October and November  We’re taking the oldest swaps  first, thus gaining two months’ time before we face the 12-month deadline  For today, we have five  swap drawings for a total amount of $257 million equivalent coming up for first [renewal] and I  recommend that they be renewed for a second three months       I’m prepared to take all of it now       It does have a domestic monetary effect       But there is a domestic monetary effect  They are trying to absorb domestic  liquidity through this mechanism  Governor Partee is correct  And they did exceed their monetary     5/16/78              5  target early this year; it was 8 percent and they were running 12 to 15 percent  Now, they pulled it  down to 7 percent in April, largely as a result of these operations, sterilizing marks--pulling marks  out from, let’s say, capital export conversions       But in billions of dollars, they add up       As I noted, we reduced our net open position in the last period by over $300  million  It’s just under $15 billion  And indeed, last Friday we even had the satisfaction of having  to request the Subcommittee to approve, pursuant to the procedural instructions, our continuing to  buy marks as we approached the $300 million limit on changes in the net open position between  meetings  That was a pleasure       Oh no, that’s fine  No, they were   But it’s a pleasure on this side  Now,  late last year and early this year, as we moved more deeply into debt, the Committee approved  additional leeway for operations under the authorization  The net open position had been raised to  $225 billion, I think back in March  And now $225 billion gives us more leeway than we  need--$750 million--so I recommend that the Committee reduce the net open position to a limit of  $2 billion       That’s music to my ears    "
775,1978-06-20,"  [Statement--see Appendix]       $879 million       6/20/78                2     Dollars       That=s why I stressed that we bought $200 million worth of marks in the  market and that we=ve acquired over $100 million worth of marks through our agency, the BIS,  or the Bank of England on days in which the dollar was steady or firming in the European  market       We=ve been in a period in which the dollar has been declining on more  days that it was rising so I think it was maybe five, six, seven days--or a quarter to a third of the  days       No  I was just saying that we would work this out in close consultation  with the Board=s staff  Remember the day on which we did exceed the gross transactions limit?   We had consulted; we had informed the members of the Subcommittee that an operation was  under way that would lead to substantial operations  We just didn=t pin it down by asking for an  approval    "
800,1978-07-18,"  [Statement--see Appendix]       Unrealized is about the same  Our average rate is 207; the current market  rate is around 206-1/2       Yes  In the Far East, the Japanese came out with some more trade figures  that suggested they would have a bigger trade surplus in June--$23 billion  But we have a case  where--that’s why I pointed to interest rates here--the dollar tends to firm up in our hours  The  dollar was up just before the meeting       Over the course of last fall and winter, many of the corporations did cover  well in advance their needs in currencies that they thought would rise  They were, in effect, short  of dollars, and that position built up rather substantially  I think a good bit of that was either run off  or covered in March and April  Some good [sources] in the market who have contacts with these  people think that most, if not all, of it has been run off  I would say that quite a bit still remains to  be done  That is, we have leads and lags that could shift in our favor should the dollar continue to  firm  This last monthly period has been a very delicate one for these people  They didn’t know  whether suddenly, with the EC meeting, the Bonn conference, and the dollar declining, they might  not go into a new series of selling dollars forward to cover on the expectation that perhaps the  dollar will continue to decline  We haven’t seen that  So it’s a tenuous situation but at this stage I  think if the dollar were to start rising, there would be more covering and we’d have a sustained rise  in the dollar and a technical reaction on the favorable shift of leads and lags  But there’s still some  to be done     7/18/78              2       Well, some of them have been [doing that] in recent weeks  But when you  tip a table and something starts rolling down, the question is how much suddenly slides off  When  the market balance tipped against the dollar, some of it did slide  We know of some covering that  took place  That is, the selling of dollars forward did take place but it wasn’t the massive amount  that we had last fall and winter       Yes  It’s simply that in August we have coming up for maturity ten  individual swap drawings in the amount of $315 million equivalent of German marks  These will  all be for second renewal, which is agreeable to the Bundesbank in view of the progress that we’ve  been making  I don’t know if we’ll be able to pay them off by the time of maturity--but we’ll do  our best--so I recommend that we renew them    "
825,1978-08-15,"  [Statement--see Appendix]       I think at this stage very little  It comes back to the question of how the  marks are pulled out of the market  That is, the marks that we have acquired have been directly  from the Bundesbank, which itself has been absorbing marks from the market in connection with     8/15/78             3  capital export conversions  We have not been buying in the market itself and we have not been  perceived as a buyer of marks in the market itself, so that would not influence market psychology  So I don't think it has had an effect       We've announced it, yes       Well, there are a number of ways you can look at it  As I say, these rates  have moved [substantially]  The Swiss franc has moved practically 50 percent in the past few  months and the yen the same--just in terms of how far the rates have moved in a very short period  of time  Yesterday the Swiss franc moved by 5 percent  And to the extent that anyone goes to  these countries and finds how expensive it is to do anything--in terms of inflation differentials or  those kinds of analyses--I think you'd find that the dollar is currently undervalued relative to these  currencies  As I say, I am essentially trying to report to you what people are telling us from the  market  These are the people who are selling the dollar       Well, in fact it is, but I don't want to interpose my own views because, as I  say, we have been inundated with calls  People out of retirement have called and said, we want to  find someone we can talk with to express our concern about what is happening to the dollar  We  think the situation is ridiculous, it’s overdone and we want to see what can be done at this stage to  turn this thing around  It’s hard to follow the market and to do what little intervention we've done  while getting all of these other phone calls from people who want to talk for half an hour and  explain their frets         Well, under floating exchange rates, Mondays are usually the bad day  because everybody--at least outside of New York--has newspapers to sit and read and Sunday  newspapers tend to pick up all of the tag ends of [the news]  And when there's bad news for the  week, that's the time when money managers begin to mull things over in their minds as to what  they are going to do  So, quite often Monday is an exaggeration of whatever problems we had the  week before and, therefore, we had a more serious problem, I think, to some degree  Phil Coldwell  asked last month whether the corporate treasurers were moving, and we had a feeling yesterday that  the corporate treasurers were now moving in bigger volume to sell dollars to cover their positions   [They apparently felt] that the decline of the dollar had gone so far that they could no longer sit  tight and say this will blow over  We had been describing this as a professional market--traders  dealing with each other--but we are running into the situation now where there's more money  coming in from treasurers outside       We had a big volume  Anything we wanted to do could have been done  We could have done $1/2 billion, if we wanted, in intervention  That would have satisfied some of  the pent-up demands for other currencies  If you're not there, then not so much will go through, but  the rates will move further       But it’s not a final sell-off; these things can go on for a longer period       But it’s a climatic situation       By all [means], when the Swiss franc moves by 5 percent       Well, the dollar was lower and now there has been a technical rebound in  the last half hour  The Swiss government is having a cabinet meeting tomorrow and, as I say,  people worry about their Draconian measures  The Swiss have taken several Draconian measures  and people worry about them before they are taken and after they are taken  They say, well, that  won't work and then they buy Swiss francs anyway  The Swiss went and                                                               this last month by, as I say, creating                        worth of Swiss francs, which  turns out to be about       percent of their monetary base, simply as a way of trying to flood the  market with Swiss francs and turn the thing around  But the Swiss franc is up about 15 percent  So  anything they have done has been thrown right back in their faces and they are rather frantic at this  stage  They do have their own economy to manage under these circumstances       Right  On the renewals of German mark swaps, we have four drawings,  totaling $246 million, coming due in September  These are second renewals and the Bundesbank  has agreed to renew them  And I recommend that the Committee approve their renewal       I'd like to add that Mr Gleske of the Bundesbank has written to Alan  Holmes with some points that the Germans would like to reconsider in the basic swap agreement  with the Bundesbank, which would be up for renewal in December  They are raising these points  now so that we can consider and discuss them in due time      First, they suggest that the even sharing of exchange risks on drawings be dropped so that  we would bear all of the risk  They are prepared to accept that drawings be at their interest rates,  which are currently 4 to 5 percent below ours, rather than at US Treasury bill rates  So there is a  tradeoff that's involved in that point  Second, they would like to have any renewals made at current  rates of exchange rather than at the rate of the original drawings  This would mean, in effect, the  booking of profits and losses on individual swap drawings on a quarterly basis  Finally, they would  like to have the language tightened up on the mode of repayment, making clear the principle that  first efforts to acquire marks would be in the market      I have nothing to recommend today in this regard  All of these points require study  But  we are preparing a memorandum to lay out the issues before the Committee  Some of these  proposed changes are of a fundamental nature, such as the 50-50 loss sharing and would have to be  extended to the swap arrangements with other central banks as well as with the Bundesbank  We  have to consider them carefully       No       No, not on the Bundesbank swaps  They are doing it for their own  account       This would be a rewriting of the swap [arrangements]       Right       Any time is fine; moving to 8 percent is not going to have much effect       It would add to the package, but if it came earlier that would be fine, too  The market is waiting for something       It's not in, but they've indicated that they'd be very quick to agree       Hopefully, yes       Now that's a bigger complication       That would change the nature of the swap arrangement that we have with  the Bank of Japan and would be a difference between the swap arrangement we have with them  and those with other central banks       Well, the magnitude can be very big  The Japanese themselves did                    of intervention in March, as the rate moved against them  And many people felt that they  were just sitting ducks  Each day they moved, you’d throw another $100 million at them and  they’d move again  You’d take your profits and then throw another $100 million  They were  sitting ducks because they were alone  As far as the market is concerned, if the United States is  prepared--just the gesture at this stage--to provide its resources to support whatever the Japanese  are doing, not necessarily the rate, [it would change the psychology] just that we've got this  agreement between the United States and Japan  The isolation of the Japanese at this stage in the  exchange market is very important        8/15/78             38   So, we can talk in terms of big numbers, but you're frightening me a little bit in how big  they are because my objective and the type of negotiation I have in mind is to talk to them as we  have with the Swiss  That is, all right we'll intervene in New York and commit our resources  because it is important for the United States to commit its resources at this stage to get the  psychological benefit in the market that the United States is cooperating  But there will be days in  which you'll want to intervene in your own market and in New York when it is not in the US  interest, in our judgment, so we would not want to commit our resources  [That is what] we have  done with the Swiss  So that some days we're in on a 50-50 basis--half theirs and half the US  authorities, and on other days we're simply operating on their behalf  On a cumulative basis they’d  end up intervening a lot more in New York than we're likely to be because we are very cautious on  the days we bring the System and the Treasury's resources to bear  But we will still have made this  very important gesture, showing that the United States is prepared to do something about this  disorderly market in yen       So we can talk in terms of big numbers, again, for the psychological benefit  But I would  hope that, as we did on July 4, we’d start off with a splash and then if we win on the psychological  effect, we wouldn't have to do very much later on  But that requires some of these other elements  such as the policy actions that Chairman Miller mentioned  And a few people on the Japanese side  have to keep their mouths shut afterwards and stop criticizing the United States  Because if we're  in the middle in the exchange market intervening and we have another one of these comments that  the United States is doing this, that, and the other thing, then there's not much help we can give the  exchange market or the rate that [unintelligible]  So we have to have a cooling of tempers a bit if  this is going to work       We would still have a floating exchange rate and the key element in our  experience with the German mark was not to peg the rate  Once we peg, then we provide the  substitution facility and everybody will come at it  But as long as they recognize that the risk will  go both ways--       That's right     8/15/78             39       Well, it all depends on how the market takes it and what happens  afterwards  The first day or two I would anticipate that we should be there forcefully when the  market tests this  We will be tested by the market Remember, back in January we had a testing  period       In marks, and we may be tested in other currencies, including Swiss francs  So we ought to be thinking in terms of a budget in the first couple of days of $200 to $300 million   If we aren't prepared to spend it then, we'll have to spend it later on  But if that doesn't work--of  course, you'll have other elements in the package, and so hopefully that will do the trick--then we’d  move into the kind of pattern we've had with the other currencies  When we feel it's important,  then we will intervene  It may be $10 million or it may $50 million on a day-to-day basis  But [I  prefer] not to think in terms of an overall budget except [with regard to the limits] under the  authorization and the other guidelines we have, including the procedural instructions       I'm not thinking in terms of billions  But if that is part of the  announcement, then that would help--that the amount that we might have to deal with is credible    "
852,1978-09-19,"  [Statement--see Appendix]      It will be closer than it was before now that we are drawing on the basis of   50-50 but we are repaying on the basis of 60-40  Rounding it off, we have about $700 million left      It's close, yes      This is a very difficult question because the market is now so pessimistic,   so bearish, and so negative on everything that comes out  It's not everybody; many people out  there feel as we do that the dollar is oversold, unrealistically low, undervalued--all of the terms that  we bring out under these circumstances  But there are so many bearish people who have an  economic stake in having a lower dollar  That is, they have short positions in dollars and they're  prepared to throw big money [out there] to maintain those positions and make their profits  It's a  very speculative atmosphere in the exchange market [and it’s] not only the banks  You have the  IMM in Chicago and you have some pretty big corporations in Europe; I don't necessarily see  much from the US [corporations]  And, of course, the last two days there have been rumors about  Middle East money, following the Camp David [meetings]      So it's hard to know  There's this speculative atmosphere  How are we going to persuade   those fellows that they can't make profits by selling dollars?  I think the approach that’s been taken  this time of a sequence of things, which are clearly positive themselves but not necessarily  sufficient, at least has kept the market off balance  The dollar is higher than it was in the middle of  August  The atmosphere is not as horrible as it was at that time  So there is a feeling that the US  government does care, President Carter cares, and the Federal Reserve and the Treasury are taking  steps and have taken steps  But now you come to the hard part of your question  Well, they  haven't done enough  This is where we come back to the energy program and really [coming to]  grips with inflation  Until we have some positive numbers, a combination both of trade and price  figures, I think we're going to have a bad market  In July the market jumped on us when we had  good trade figures and poor price figures; in August they jumped on us after getting good price  figures and poor trade figures  What we need is a month in which both the trade and price figures  are better       I think it will help, and it may give [the dollar] a brief rise  But I'm   disappointed in the reaction of the market to the Camp David [outcome]  They were all focusing  on it, speculating up and down last week  And then when it went through positively, for all intents  and purposes, the dollar is now lower than it was before  So it will help in the long run to get this  whole controversial issue out of the way and in the short run perhaps will give a lift to the dollar  but, until we get some good numbers, I think that will pass very quickly        It was                  in March alone   "
