,Date,content
41,1976-04-20,"  It would have some implications for the yen-dollar [relationship] since  there will be more purchases of yen and holdings of yen, but in our experience the yen-dollar  relationship is independent of the [dollar’s] relationships with [currencies in] Europe, so it’s sort  of in a separate channel  So we’ll not have a generalized effect, as far as the US dollar is  concerned, against other currencies     No, I don’t think so, perhaps over the long run some of the other countries  in Asia might make specific use of the yen as an intervention currency, but that’s a long way  down the road     874-875     When I talked with them, I made it very clear that we would look to their  Fund drawing rights as a takeout if necessary  This is the way we have always handled it,  making very clear what the takeout would be, but not [making a specification] as we have in the  Italian case and, as Alan has suggested, in the British case  That is, not making it a specific firm  condition of the drawing that the funds be there  They understand the background to it, but we  haven’t formally made it a condition of the drawing  "
119,1976-07-19,"  [Secretary's note This statement was not found in Committee records]     That’s right, this Thursday  An exchange of cables has been made  And  we fully expect them to repay the other [unintelligible] at least by maturity     Yes, well, the Mexican situation is stable, but it hasn’t turned [out] as  favorably as they had hoped  They had the large outflows at Easter time, occasionally drawing  on us, and then several newspaper articles in the US suggested they might devalue, which  halted the usual reflows after the Easter period  Now the outflow from Mexico has slowed, but  there is still a steady drip drip of outflows  They’ve passed their election period, they have their  new President, but there remains a lack of a reflow to--     7/19-20/76 - 21 -     He will be inaugurated on December 1, and most of the people in the  financial community are counting every day until that is done     Well, they’ve lost confidence in the current President, and there are  serious labor negotiations that are under way now  The talk is of 15-25 percent wage increases,  which could seriously undercut all of their efforts at this stage to restore stability     Yes, painfully  We have the remaining $824 million equivalent of the  Belgian franc drawing coming up to the 20th renewal for their [unintelligible]  We’ve made  good progress on this one, and with any luck we might even be able to repay the full amount  within the next three months  On that basis I recommend renewal  The Swiss franc swap  drawings in the amount of $11472 billion are also up for their 20th renewal on August 13   Although the Swiss franc rate has stabilized, it is still at an exceedingly high rate, and I see no  immediate prospect of our beginning to acquire significant [unintelligible]  I recommend  renewal there, too  "
144,1976-08-17,"  The snake is essentially a political animal, and if the governments make a  political commitment to continue it, then it will continue  It surprises a lot of people that it has  lasted as long as it has  It’s hard to make any projection simply on a market orientation or on an  economic orientation     The small countries want to continue the snake  They feel very strongly  [about it] and want to have a fixed relationship with the German mark  But the continued  repetitive blowouts in the exchange market make it very difficult for them to continue it  It could  break up     It would be the second time, coming early October     Yes, that would be the end of six months     There are some in dollars as well  "
165,1976-09-21,"  I have a kind of answer to that question  We were talking to people in the  market on that  As soon as they devalued, the Mexicans called a number of the US banks to see  if they could get additional credit lines and did obtain some credit lines with New York banks   Several of the people in New York say that the image of Mexico is somewhat tarnished  [regarding] borrowings  So they may say they’re getting a lot of money, but it’s on the basis of a  major effort they have made, and, as I say, this word “tarnished” has come up     The Treasury still has all that gold that the swaps were entered into to  protect, so the loss that we have now is the value of gold--   ]  Mr Chairman, at the Desk, I have been going under  the assumption that we have no takeout and no assistance from the Treasury  That every  operation has to be self-liquidating in the exchange market, and every swap line liquidated  throughout the operations in this--     9/21/76 - 8 -    "
189,1976-10-19,"  I hate to break the mood with my usual list of horrors from the exchange  market here       [Secretary's note This statement was not found in Committee records]     In order to resolve the current situation, yes  But I wouldn’t know how far  to go in order to resolve the current market situation  I think more depends on the other  measures that have been taken over the course of recent months to deal with the underlying  problems  the tightening of monetary policies, the tightening of fiscal policies  There have been  a number of measures in dealing with the basic wage cost push that these countries have  But  they had hoped to buy some time with this; I’m not sure that they did--that they bought sufficient  time     Yes--that they paid us and that they drew on the Treasury line  "
228,1976-11-16,"  It’s a goodly number, I think 10 or a dozen     Right     No, I think the swap arrangements, as they are set forth now, cover the  ground well  I think in the context of the recent experience we’ve had with Italy, Britain, and the  Mexicans, we can, on a case-by-case basis, make the adjustments we need in swap arrangements  to appropriate provisions at the time  We have thought very carefully in New York that there  might be some suggestion of changes in the swap arrangement itself, but at this stage I see no  reason to do so  Rather, I would prefer to continue it as now, on a case-by-case basis, to make  determinations of conditions to fit the situation     And Britain and Italy     No, nothing formal at this stage  Feelers from time-to-time  "
254,1976-12-20,"  We even consult with the foreign monetary authorities     Alan Holmes and I have gone over this document with great care from the  beginning  In effect, this describes an even more flexible approach than we are currently  following  So we are quite comfortable with the overall limits that are placed here  I’m happy to  be securely secured in line because I don’t want to have too much rope to hang myself  There is  enough risk in the operations that we have, so that we want to consult frequently and in detail on  the kind of operations we have       12/20-21/76 - 18 -         We will make every effort, and have made every effort, to consult in advance, and even in  the case that Henry Wallich mentioned, just recently, where Charlie Coombs had to go into  market, he was in the process of making phone calls [at] 15-minute and half-hour [intervals], and  secured what clearance he needed  So this is a fair document  It describes what we have been  doing up to this time  We are very comfortable with it, and we will be operating on an even  more narrowly restricted basis in consultation with the Chairman and the subcommittee and the  full Committee     Taxes  The Europeans find it’s taxes  As incomes rise and time structures  stay the same, the bite out of income becomes greater, then you have the wife more inclined to  go out to work     Governor Partee, it was early in the period when the drop in rates was a  lot more than the drop in the funds rate  Most recently, the funds rate has, in my view in any  event, caught up a little bit, but not entirely, with the drop in the market  The three-month bill  rate started out below the 5 percent funds rate, of course, where the funds rate was at the time of  the Committee meeting, and has dropped not too differently from the funds rate  And most  recently, for example, the commercial paper rate has come up a little bit, so the bill rate again  has dropped more  So I think there’s a little bit of anticipation in the [unintelligible] funds rate  decline, but not a large anticipation  I don’t think we’re very far out of line, we’re just somewhat  out of line with the [unintelligible]     I think so  "
281,1977-01-17,  Yes     It’s using a different instrument     I talked to the Deputy Governor last Friday  
306,1977-02-15,"  All press releases we have had have indicated that it would be done  directly [with the Swiss authorities] to avoid any market impact     No  It is one of three options  And to some degree we are buying German  marks and French francs in the market, which we then supply to the Swiss when they need them   And the other options  "
332,1977-03-15,"  There is an ambivalence there     It was reported in the last Basle meeting, though, that there has been more  investment interest from the United States to be seen in the European gold market--investor  interest, whatever that means  But both from the spot and the futures market  "
357,1977-04-19,"  [Secretary's note This statement was not found in Committee records]     Now by a net of 1-1/2 percent ,and that’s from the December figures  We  started at around 279, got down to 271   "
446,1977-07-19,"  The Bundesbank reaches to the beginning of 1976, and they say it’s on the  order of 19 percent     One of the problems that we’ve had with floating exchange rates is the  tendency to overshoot and to have exaggerated movements of rates  Many people in the central  bank community have been rather pleased that they have avoided some of these wide swings that  we had in ’73, ’74, and coming into ’75  And now, partly [given] the perception in other  markets, but more on the basis of these announcements, we have a very sharp swing effect   There’s no stopping the sharp swinging effect  We’re running the risk [that] other wide  fluctuations will perhaps have to develop later on, which, as far as US policy is concerned,  would be embarrassing  So it’s better to have something that is in line with fundamentals than  exceeding it     Probably a statement by the Treasury that it’s satisfied with the rate  movement would help a heck of a lot more than any intervention     The Treasury could have bailed us out     7/19/77 - 8 -    "
473,1977-08-16,"  [Secretary's note This statement was not found in Committee records]     Yes, 35 plus 43     Oh, well, in the total operation, it had been somewhat over $100 million  between June and July  And $88 million reported last month     I’m building up balances very gradually, dollar averaging as the dollar  rate rises  Buying marks at times when the dollar is rising particular sharply, again on the idea of  avoiding disorderly conditions     Yes, I think the central banks have found that, as we did in the fixed-rate  world, that the last place you want to be is at the upper limit with no flexibility whatsoever, just  taking in taking in currencies or handing them out  And that to maintain the flexibility of     8/16/77 - 2 -           intervention, it’s better to start somewhat earlier, and the central banks in the EC snake group do  intervene in dollars at their own discretion and with the approval of the group prior to reaching  the outer limit  And the practice in recent months has been to avoid getting to the outer limit if  they can  That’s when the big speculative pressures, one-way pressures, are likely to emerge     They have from time to time, but not in transactions outside the fund, the  pooling arrangement  There are all kinds of bonds that are being issued, and so forth, and  currencies come into their hands  We have the odd situation where the Bank of France is now  operating much more in German marks, and at one stage they were buying dollars and selling  marks, trying to position the franc somewhere in between the dollar and the mark as the two  currencies were moving  So there’s a lot more flexibility on the part of the central banks both in  and out of the snake, in dollars and other currencies     Morning telephone--     Yes, well they have consultation calls three times a day  And that’s  working out fine  We, of course, receive a call--from the so-called captain of the day, after they  finish their day--and get the full information  We ourselves make an early morning call, around  7, and several other [calls] during the course of the morning, and pick up the same sort of  information  Now that they know that we are hooked in on the system, it’s working very well     Not full exchange, but much more than there used to be  There are still  some elements, particularly on some of the more delicate intervention operations, which are  passed at a higher level  But we get the information we need     No recommendations     8/16/77 - 3 -          "
501,1977-09-20,"  Are you talking about foreign exchange?     Yes, they do operate in the New York market     Yes, we call them, and they inform us if there is any extra on the next day  "
525,1977-10-17,"  It depends on who you talk to within the New York Bank staff     All right  I’m not a forecaster  I think that most economists would come  up with a forecast very close to what Mr Truman has just outlined  I’m skeptical, myself, of any  forecast on the trade account  In recent years we’ve had errors on the order of $20 billion--in ’75  and ’76     Yes, but the people in the exchange market are following these numbers,  [and] to the extent that the trade balance does improve or weaken, this will influence thinking  about the dollar     We’re about where we closed last night, but the dollar was lower earlier  today and other central banks [unintelligible]     [Secretary's note This statement was not found in Committee records]     It was taken out of context  This was a press conference on other matters,  and someone asked him [paraphrasing], “Well, what do you think about the rise in the Japanese  yen lately?”  And he said, “Well, there hasn’t been much rise, has there?”  And they said, “Oh  yes, it’s gone up such and such,” and got into a discussion of the appreciation, which has been  only about 1 or 2 percent  He said, “Well, that’s not very much  If you really want to have an  effect on the trade balance, you need a very large appreciation”     Yes  It was in an “if” clause, however, rather than a--     He said “if”     That’s right, but it’s the way it was interpreted, and it was yanked right  out of context  It’s like any--     That’s right     Well, he was making an analytic point, that, if you’re going to have an  effect on the trade account, you’re going to need an awfully large change in the exchange rate  under the current circumstances  But he wasn’t advocating that, it’s just the point he was  making  But the Reuters people, who weren’t there at the time, went over the transcript and  yanked these two or three sentences out of the transcript  Everything else that he said     10/17-18/77 - 30 -         disappeared--was not used by the press  And it came at a particular time when the market was  quiet  You have this tendency of the press to use these things     [Secretary's note This statement was not found in Committee records]     I have a brief bit later on  The economy is not performing that badly; we  have growth here  Other countries don’t have much growth  Our rate of inflation is lower than  in most other countries  We’ve had currencies that are rising--their rates of inflation are 10, 12,  15 percent  The market has lost perspective on many of the fundamentals with this exaggerated  focus on the trade deficit and what the United States government is going to do about the trade  deficit     And interest rates have risen     [Secretary's note This statement was not found in Committee records]     At the moment, the market is not focusing too much on interest rates  At  the moment  But if some of these other fears were calm, then they would be focusing on interest  rates  The general feeling, perhaps, is that there might be further firming of interest rates here,  but I don’t think people expect much further rise     Well, at the Desk we haven’t had any pressures to do more  We’ve been  working very closely, of course, with the Bundesbank, the Swiss National Bank, but there have  been some rumblings from the Swiss, particularly, that the US ought to do more  But that’s  again in the context that the Bundesbank had done $900 million and the Swiss $1 billion, and  they still haven’t really resolved the problem they face in the market  The Swiss have a  particular problem because their currency is rising against everyone, once again; it moved above  parity with the German mark just today  So they’re more concerned  But I think in this episode  we have less pressure on us now from the others than we have had with earlier episodes  But at  the same time, we’re on a spot, since it is US policy which is in question, and a number of times  the market participants have called us and said we’re glad to see you in the market today     10/17-18/77 - 31 -           Oh, yes, disappointed     At base, this is one of the elements, but I think as central bankers, we’re  all more concerned with the financial flows and the relative stability of our market  To have  these vast amounts of money moving across the market is a problem for any central banker  I  think, though, in response to Governor Wallich’s point, that if the market felt that we would be  prepared to do $20 billion, then that amount of intervention would not be needed by anybody   And it’s a part of the question whether we are prepared to support, defend--whatever word you  want to use--our own currency  And any indication coming out of Washington or anywhere else  that the US wants to see a particular result starts a new wave of selling the dollar     Right  The British, if they buy another dollar today, it’ll just go right into  their reserves and into our bond market  If we were to buy another dollar today it would have  more effect on market psychology  This is what we’re facing--psychological markets     Well, it’s hard to measure  At the request of the Chairman a few months  ago, we have been watching very carefully for any concrete indications of shifts of funds by the  OPEC central banks, in particular, and it’s very hard to trace this because they are very  sophisticated in the manner in which they carry out their transactions  I had a feeling, [during]  this last go-round of big payments to some of the OPEC [countries] at mid-month, that more of  the funds were converted out of dollars into marks and Swiss francs than we’ve had in recent  months  But this was more from comments we heard from the market and the reaction we had  when we went into the market ourselves--that it took more intervention on our part to quiet the  market on a particular day than we would have otherwise     Yes, and we don’t get very concrete answers either  But they do point out  that they are concerned about the dollar and point out the scenario that, if the dollar continues to  decline, then they have no other choice but to continue to diversify to Swiss francs, marks, and  other currencies, yen, in order to maintain the value of their international reserve     It varies with the country     But in some cases I think they’re just not telling us the [truth]--they say  they’re still in dollars, investing in dollars, and so forth, and yet we hear from the market that  they’ve been buying other currencies  Since they operate in the Eurocurrency markets, no one  can see them very well, even the others     It’s a process  It’s a management process  These people are all studying  and have advice from consultants in the US and London on how to manage their reserves  And  you’re talking about portfolio management     Well, this is what the policymakers are saying  I’m talking more about  the ones who are managing the portfolios, or funds, whoever deals in that area  Sometimes it’s  the same person, but we’re talking about two different questions     That’s one of the manifestations, I think     Yes  This is part of the reason why it’s so difficult for us to say  categorically that, at one given week or one given month or quarter, there’s more purchases of  D-marks by OPEC central banks then at other periods  We don’t have a link to the direct  transactions picture  The problem in the market is that there are certain banks that operate for  these fellows  Any time those banks appear as heavy buyers of Swiss francs or marks,  everybody rides on the back of us and says okay, here we go, the dollar’s going to decline again  because we’ve got OPEC in the market  And so we do have the psychological reaction to  something, whether it’s real or not     Certainly     It’s perhaps a contributory factor, but I would not call it a major factor     To the extent that we have seen, there is some, perhaps some increase, it is  a factor  We’re not calling it a significant factor  I’d rather place the policy concern on these  other matters that I outlined     But the fear of this--we’re dealing with market fears  We’re not dealing  with facts, we’re dealing with fear  People worry about all of these things to the extent that these  fears [arise], some of them confirmed, then the market jumps  At this stage, the market is  jumping to sell dollars at any opportunity, at any event that somehow can be interpreted as a  negative for the dollar     10/17-18/77 - 34 -           It’s just a matter of erasing the market’s worst fears rather than turning  upside down all the rest of our policy  The market needs reassurance in this       Well, they’re afraid that we want it     Well, this is more the US Treasury than the Federal Reserve     Well, we can’t devalue against the Saudi currency or the [unintelligible]  currency or [against] all these other countries that we’re having a deficit with  The Japanese  [unintelligible]  We have a surplus with Western Europe  And you get into the argument as to  whether a devaluation at this stage would help us  The Treasury’s thinking at this stage is that it  won’t  And this was the point Secretary Blumenthal was trying to make, but the press twisted it  and made it sound as if he was talking about the dollar     I have no formal recommendations, but I would briefly note the situations  which could lead to requests for swap drawings by other central banks    [Situations noted by Pardee not recorded]     But in an exchange market, there’s no direct relationship between the  money supply and what are demands for dollars  At 400 on Thursday afternoon, everybody’s  making a bet on what the numbers are going to be  It’s just like betting on football games on  Sunday  And then, when the numbers come through, they jump one way or the other  Now the  reaction has been, definitely, the aggregates coming in strong, and this would have the  implication Governor Wallich suggested, that interest rates sooner or later will rise, therefore the  dollar would be stronger  But what I’m afraid of now, however, is that some market participants  say that if [the monetary aggregates] continue to come in strong, then you have an adverse  reaction that the dollar will be lower on the kind of considerations Governor Wallich mentioned  "
