,Date,content
1378,1980-04-22," [Statement--see Appendix]   Much more important are the interest rates On the Iranian situation, when you talk to different people they'll give you different interpretations even on the same day For the moment interest rates are the dominant factor in peoples' minds in the exchange markets   In a couple of months the exchange traders might be thinking about something else The [focus of their] attention tends to shift from time to time Currently, given that there is a feeling that we're in a period where interest rates are topping off and people are uncertain as to how far interest rates are likely to go down or whether they will stabilize, rates are the dominant factor The exchange market people look a little at the aggregates I was a bit surprised and rather pleased that the decline in the aggregates reported on Friday did not lead to a sharp sell-off of the dollar, given the sensitivity the market is showing toward monetary questions in the United States at this point But they look mainly at interest rates and less at the aggregates   It depends in some banks on whether they have monetarist economists that they have to listen to; but they work with interest rates And I'm afraid, with this 14 [number released] this morning, that we're hearing again from the market that there has not been any improvement on inflation in terms of the CPI   It's a question of [timing] We surveyed corporate treasurers yesterday to find out what they were thinking at this moment Several of them related practically the same view They expect that sooner or later interest rates may decline in the United States--that it's necessary--as we move into a recession But as I indicated in my report, if interest rates come down faster--before there is a demonstrable improvement on inflation and internationally on the trade [and] current account balances--then we're heading for trouble So there is some expectation that interest rates may recede, and certainly plenty of hope that they will at some point, from this particular group of people But the traders and corporate treasurers are telling us that it's a matter of timing in terms of when the interest rates come down and when these other things start improving   They are beginning to level off, I'm afraid, certainly in Germany and Switzerland where they are running around 6 percent or 5 percent Wholesale and producer price indexes are still very high in many of these countries Japan is still reporting very high increases, but they are beginning to level off, too, as the oil shock gets filtered into their price mechanism But the consumer price indexes are behaving better in some of these countries   Today they're off a little The Euro-mark is about 9-1/4 percent and the three-month rate on interbank [loans] is down below 10 percent   Euro-marks as against Eurodollars were around 17 percent as against 9 percent We're still at a differential of about 7 to 8 percentage points, depending on which measure we use   Well, it was at about 10 percentage points before, close to 10-1/2   There are several people who might be able to answer that In terms of the non-oil-[producing] less developed countries, there is a lot of discussion about that   I think both the Board staff and our staff, as well as other staffs, are looking at this very carefully We're moving into another period where the whole discussion of recycling is very important Since the 1974-75 period scared so many people, perhaps we're in a little better shape coming into this one People talk about Brazil and a few other countries that will have big problems, but of course the [unintelligible] decided not to talk to the IMF I don't know, Ted; you might want to comment on that     On the capital conversion? No, they haven't had many issues lately   Right   There are considerable lags You're talking about effects in 1981-1982, not now   Well, the whole package, as I indicated, is that as long as the United States is exposed, whatever we do to act unilaterally in Iran is seen as bad for the dollar The indications out of the European ministries meeting today are that perhaps they will help us, and that is giving the dollar a little lift But, as for individual items within the package we put together, it's hard to isolate what the effect on the dollar has been "
1398,1980-04-29," All I can say is that since the FOMC meeting, the dollar has declined by about 3-3/4 percent against the German mark and has declined against other currencies pretty much across the board Again that largely [reflects] the decline [in US rates] in relation to the climb of [foreign] interest rates, which has been particularly precipitous in the Eurodollar market We also had the effort to release the hostages, which when it occurred did lead to some selling of dollars At the moment it occurred the Bundesbank went quickly to the market and intervened We have not intervened in big amounts We've done about $150 million worth of marks and some Swiss francs The Bundesbank has done about We have not been in a mode of trying to resist very heavily the movement of the dollar, given that the market perception is that the problem is not intervention but a decline in interest rates   As I outlined at the FOMC meeting, it's a matter of timing in that interest rates have come down before there was any indication that we were making progress on inflation or on the trade balance The market currently is waiting for the trade figures this afternoon   It's 1795 It was 186 at the time of the FOMC meeting    4/29/80 "
1441,1980-05-20," [Statement--see Appendix]   I have seriously considered putting in a double shift--that is, having people in the trading room at the Desk during the night hours when the European markets are open We already monitor the Far Eastern markets, but there have been occasions when there was a slippage between the time operations ended in the Far East and the Bundesbank picked up its operations in Europe But for us that's a major expenditure of personnel and other resources, and I'd rather do that only if I felt it would be worthwhile for our people to stay up during those hours   [I'm talking about monitoring] operations and whatever feedback we might get from the European markets We would be monitoring their intervention as well as what is going on in the market at the time   There is no one more reluctant than I am A 24- hour day is unthinkable   They've done more on the way down in recent weeks as a result of these mutual concerns They're afraid that the dollar will start declining and [the monetary authorities will] have to intervene and undercut their monetary policy, and they want to maintain a certain policy restraint And we have this other risk that we are running with a sharp decline in interest rates and that a sudden decline in the dollar will trigger a speculative crisis against the dollar   Yes, I agree with you They sat very heavily on the dollar when it was rising, and ferociously so And they didn't help very much at first when the dollar began to decline But again, in more recent weeks with this convergence of interests, they have been very helpful We haven't had to intervene much, partly because of this atmosphere we are in And I still feel that the environment we've had since October 6 has been conducive to effectiveness of intervention because exchange traders are nervous; they are concerned that if they take a short position in dollars, interest rates might all of a sudden back up and it would become a very expensive speculative bet for them So, since October 6 we have not yet had to do the type of massive intervention in support of the dollar that we had to do before, even with the environment we have had in the last month   We didn't show up in the market until the dollar was around 190   Yes The Swedish Riksbank has asked if the Federal Reserve would increase its swap line by $200 million to $500 million You received last night two memoranda on the Swedish situation--one by me and one by Mr Caprio of the Board's staff As I indicated, the Swedish authorities expect a financing problem on the order of $4 billion, which this year they plan to cover largely through official borrowings abroad Of this, some $2-1/4 billion has already been arranged and additional loans are in the early stages of discussion In requesting an increase in the swap arrangement with the Federal Reserve, Governor Wohlin of the Riksbank expressed concern that the Riksbank needs more backstop in the form of short-term bridge financing than it currently has The Riksbank uses an intervention approach based on a currency basket and finances its intervention out of the proceeds of the official borrowing In light of the current economic and political uncertainties, the krona is vulnerable to a sudden burst of selling pressure, and the Riksbank may be obliged to [obtain] dollars in the market at a faster pace than they are raising them through financing In their view, the increase in the Federal Reserve line would give them an added cushion in addition to their dollar reserves and their other short-term facilities Governor Wohlin has stressed that the Riksbank has no immediate need to draw on the Federal Reserve, but he does not wish to rule out the possibility that they may come in for a drawing at some point  Now, as you can see from the memo, the Swedes are passing through a difficult time But under Governor Wohlin the Riksbank has acted to firm up short- and long-term interest rates and is pressing with some success for a reduction in the fiscal deficit The Federal Reserve's agreement to increase the swap line could strengthen his hand in some of those negotiations at home On the basis of these various considerations, I recommend that the Committee agree to the $200 million increase But given that we are living in a world in which we haven't had many changes in swap lines in recent years and haven't had much experience with drawings on those lines, I would like to introduce one wrinkle That we make the increase for one year and that we review the whole matter at the end of the year when we consider the renewal of the whole [array of] swap lines and decide then whether we want to put it on a permanent basis or not So, I would recommend a 1-year increase from $300 million to $500 million, with a review at the end of the year   Well, I'm not fully clear myself [but] the Bundesbank does allow other central banks to accumulate marks up to a certain amount before they ask those banks to cash them So, it is more of a facility on the reserve currency side The Swedes are borrowing marks quite frequently and they might want to keep some of them for a while That's the arrangement   Roughly   They are borrowing   Yes, they are making official borrowings in the Euromarkets   Because that's the seat of the European Monetary System and the members of the Board there are--   They have a swap line they just--   It's million On the point of when we impose conditions, I would rather wait and see what the circumstances are when they come in for a drawing We can then review it with the [Foreign Currency] Subcommittee and put on the conditions that are more or less specific to the circumstances at the time That is why I think this review procedure and a 1-year limit on [the increase in the swap line] gives us a little more control They are not in good shape, but this all relates to 1980 We don't know what 1981 will bring But I think our side will be better able to monitor it if we do it this way   As little as possible We were discussing having it come out on a Friday afternoon It's coming very shortly after this strike, and they did not want the market to think that they were acting in response to the adverse publicity of the strike   Well, we can say that the Federal Reserve and the Riksbank agreed on an increase in the swap line from $300 million to $500 million Full stop, unless we want to add that this shows a cooperation between the two central banks--or some language like that which we have worked up in the past   I'm sorry, I have some other comments I'd just note that there will be some first renewals of swap drawings in the days subsequent to the next FOMC meeting Normally, in our renewal cycle we report on these at this time [Each] is just a first renewal, so no action by the Committee is needed We have swap drawings of $141 million worth of German marks and $74 million worth of French francs that are up in July I would hope that we would have paid them by that time, but for the record I am mentioning them now "
1462,1980-06-05," I'm here There was some pressure on the dollar just after the last FOMC meeting and we did have to intervene, and in bigger amounts than we had before But the market has quieted down since then, given some good coordination between us and the Bundesbank in our intervention And the firming of the domestic rates and Euromarket rates particularly helped The market is currently quiet but very, very uneasy I think we've been lucky that there's a lot of selling of US dollars out there but money is going into the Swiss [franc], the Japanese yen, and the pound sterling rather than into the mark So people have not been interpreting it as a general weakness for the dollar However, we do have an ominous rise in the gold price--it touched $600 this afternoon in the [Comex] and the silver market prices are still creeping up Whether or not we're getting more speculative influence creeping in the markets, I don't know   I haven't found a satisfactory answer from anybody It broke out of a trading range People are worried about the oil price that will come out of the OPEC meeting There are a number of things in the Middle East that are bothering people as well as these general fears of inflation that still haven't been killed completely   It's supposed to be next week I don't know if the date-- "
1489,1980-07-09," [Statement--see Appendix]   About $65 billion   We have about $2 billion left   We've used $11 billion   Six billion    7/9/80   The swap line is $6 billion   The Treasury considers itself short right now under the Carter notes by over $3-1/2 billion, [so] we are in a hole   The answer to your question is that we can get more resources at some stage if the Treasury wants to go back and negotiate a new Carter note   The man who negotiated the last Carter notes is sitting next to you He's not at the Treasury now   I'd simply note that first maturities of six swap drawings on the Bundesbank in the amount of $190 million will be coming up over the period before the next FOMC [meeting] I expect to roll those over, renew them, if we do not have a significant reflow in marks that would enable us to repay them "
1536,1980-08-12," [Statement--see Appendix]   They are fully covered on the Carter notes The francs that we have accumulated recently have been put aside for payment of interest on those notes They [have] discussed a little the issue of accumulating additional francs [They are leaning to the view] that if we don't want any more they will acquire them But we still have very modest balances for the System   It could, but the question of financing their deficits is very important And they want to maintain a strong currency so they can get the funds There's a tremendous amount of competition among the authorities to get OPEC funds at this point Any slippage on your currency means that the money just isn't going to come in your direction   No they want strong exchange rates rather than fixed In fact, a gently rising exchange rate is--   Well, on that particular occasion, I talked to several people who tried to interpret it As you recall, on that Friday there were two other elements [involved] One was that the federal funds rate did ride up and the other was that a large increase in the aggregates was published later in the afternoon   Several [market players] sent out letters or cables around the world from New York and other centers over the weekend trying to assess the implications Those who said that the rising federal funds rate and the aggregates were important were right And those who said that the Europeans were going to react negatively to the discount rate were wrong They are very sophisticated but they can make mistakes, too It's very hard to judge which way to read it I raised the question with some of our senior people in the market as to whether the people who don't understand the Federal Reserve are making money at the expense of those who do I think the [answer] is that it's more haphazard That, in effect, handing the decision of determining interest rates over to the market on the domestic side is very much like the exchange market where we've turned to floating exchange rates I had to scold some of the fellows a little in that they had been so pleased to have floating exchange rates and they should be able to take advantage of the freer market for money But they're very nervous about it So if sophistication is part of it, there's also a difference in the market now with these OPEC funds The OPEC funds come right into the Eurodollar market in overnight money It's sitting there Where is it going to go? It's not going to stay necessarily in overnight money And the sensitivity to interest rates is much greater than we have felt for some time If the federal funds rate goes down, it means that the next day the Eurodollar rates will trail off in the Eurodollar market, which means that the fellows in OPEC and others who are moving money on that day will make a decision to put those funds that they are moving into marks or sterling or some [other currency] at that particular moment If the federal funds rate is moving up at that point, giving signals to the Euromarkets to firm a bit, then the money will come our way It's a very knife-edge sort of thing There's much more volatility in the dollar exchange rate than we've had in other periods when not much was really going on   It's not a question of hurting or helping at this stage; it's just that there's more volatility    8/12/80   [It is] if all of a sudden we have a cumulative movement that is triggered by it   No we haven't We haven't had it this month and we've been rather quick to operate Of course, we're basically interested in acquiring as many marks as we can to clear the decks for the next problem   In that case the surplus did disappear over the course of the next two or three years By 1977-78 there wasn't much surplus left   Yes, a lot of that came in directly into US Treasury bills and so forth At that time there wasn't quite so much diversification as there is now Also, the other central banks and authorities were not bidding so eagerly for the funds Now the German finance ministry is working very hard to get as many marks in as possible The Swiss have been very active, as have the Japanese It has not been very open, but a lot of work is being done And, of course, the French have quietly opened all the doors and windows for people to invest in francs In some ways that's healthy since they are deficit countries and the money has to go some place, so it's better to go in places where it's in strong hands But there is a difference this time The OPEC countries are not so automatically putting their funds in dollars and holding them there, particularly in open ways such as in Treasury bills And the others are pressing hard for funds to come to their way  -4-    8/12/80   Simply some renewals With the Bank of France we have one swap drawing for $26 million We've been repaying our mark swap debt but we have coming up in the next period some seven swap drawings in the amount of $382 million All of these are first renewals   If necessary "
1573,1980-09-16," [Statement--see Appendix]   Yes, in terms of first renewals on swap drawings, there are six drawings on the Bundesbank for a total of $3012 million And there are three drawings on the Bank of France for a total of $85 million, one of which is a second renewal for $24 million The second renewal will require authorization by the Committee   Both; [the first discussion was] about two years ago   They are prepared to at any moment "
